title,content,link
No full list of martyred intellectuals in 53 years,"The nation still awaits a comprehensive list of its intellectuals killed by the Pakistani occupation army and their local collaborators to deprive the people, who were at war for independence, of their intellectual leadership. The nation is still in dark about the number of its bright sons and daughters who made their supreme sacrifice for the independence of the country as successive governments in the 53 years of independence could not finalise the list of intellectuals martyred during the war of independence. Families of the martyred intellectuals accused the successive governments of sheer neglect as they, along with the nation, observe Martyred Intellectuals Day today. It is extremely regrettable that the nation is yet to have a complete list of martyred intellectuals and professionals, Martyred intellectual Munier Chowdhury’s son Asif Munier told New Age. ‘Our expectations have not been fulfilled and the discussion on the martyred intellectuals is limited to the observance of the intellectuals day,’ he said. ‘Our fathers made supreme sacrifice for the state, so, I think the initiative should come from the state, not only from our families only.’ After 49 years of independence, the previous Awami league government in November 2020 formed an 11-member committee to finalise the list of martyred intellectuals. The committee, however, failed to publish a full list of the martyred intellectuals in the past four years. Committee member retired Lieutenant Colonel Quazi Sazzad Ali Zahir, Bir Protik, said, ‘We tried our level best to complete the job but there were some challenges to identify the martyred intellectuals due to the long gap of time.’ Based on the committee findings, the Ministry of Liberation War Affairs has published the names of 560 martyred intellectuals in four phases so far, he said. Now, the work of the committee has stopped after the fall of the AL government, he said adding, ‘I hope the committee or a new committee would work to complete the list.’ On April 7, 2021, the ministry published the first list containing the names of 191 martyred intellectuals, followed by the second list of 143 on May 29, 2022, the third list of 108 on February 15, 2024 and the fourth list of 118 martyred intellectuals in March 2024. Of the total 560 martyred intellectuals include 198 teachers, 113 doctors, 51 lawyers, 40 engineers, 37 government and private employees, 29 social workers, 20 politicians, 18 journalists, 18 litterateurs, 3 scientists, 1 philosopher, 1 researcher, and 1 painter. Apart from this, 30 cultural activists and individuals  associated with film, drama, music and other branches of liberal arts are also  on the list of martyred intellectuals. Earlier, the liberation war affairs ministry also formed a committee to compile a list of collaborators of the marauding  Pakistan military but there was no progress till now. Adviser for the liberation war affairs ministry Faruk-e Azam told New Age on Wednesday that there was no list of Razakars at the ministry and making one would be nearly impossible. ‘I have not received any files regarding the list of Razakars. The secretary has confirmed that the ministry has no copy or related documents,’ Azam said. He said, ‘Even if we want, it is not feasible to make a list of Razakars or Freedom Fighters. Compiling such a list from events that occurred 50 years ago, without reliable documentation, is an extremely difficult task.’ The ministry has no complete and comprehensive list of martyred intellectuals but figures provided by various government and private documents is 1,111. Independence war researchers believe that even the figure 1,111 was not correct and it should be 10 times the number. Shaheed Buddhijibi Koshgrantha, a biographical encyclopedia of martyred intellectuals published by the Bangla Academy, defined intellectuals as writers, scientists, artistes, singers, teachers from universities to primary schools, researchers, journalists, lawyers, physicians, engineers, architects, sculptors, government and non-government staff, people involved in film making and theatre, and social and cultural activists. When their defeat appeared imminent towards the end of the war, the Pakistani occupation army and their local auxiliaries Razakar, Al-Badr and Al-Shams abducted members of the Bengali intelligentsia blindfolded, with hands tied, from their houses to camps or other places. They never returned. Members of the Buddhijibi Nidhan Tathyanusandhan Committee, set up in 1972, had made a list of 20,000 of the finest minds of the nation who were killed. Shaheed Buddhijibi Koshgrantha, reprinted in 1994, put the number of intellectuals executed then at 232, but said that the list was neither complete nor comprehensive. The book defined martyrs as people who had been either killed by the Pakistani army or their collaborators or had gone missing between March 25, 1971 and January 31, 1972. ‘Bangladesh,’ a documentary publication of the government in 1972, said that the Pakistani occupation army and the local death squads had killed 1,109 — 21 university teachers, 59 college teachers, 270 secondary school teachers, 637 primary school teachers, 50 physicians, 41 lawyers and 13 journalists and 16 others. Banglapedia, or the National Encyclopedia of Bangladesh, estimated that 1,111 intellectuals were killed. Families of martyred intellectuals alleged that Chowdhury Mueenuddin and Ashrafuzzaman Khan, two Al-Badr leaders found guilty of killing 18 intellectuals, including journalists, university teachers, and physicians, by an International Crimes Tribunal-2 on November 3, 2013, were now currently living in the United Kingdom and the United States, respectively. There is little progress in bringing back Mueenuddin and Ashrafuzzaman, the only convicts for killing martyred intellectuals. The families alleged that the Ministry of Foreign Affairs during the deposed AL government did not take any official steps to bring the duo back to the country and execute the sentence.",https://www.newagebd.net/post/country/252773/no-full-list-of-martyred-intellectuals-in-53-years
Khaliquzzaman Elias’ Rashomon available at bookshop,"Veteran writer-translator Professor Khaliquzzaman Elias-translated literary work titled Rashomon is available at different bookshops. The translated collection of stories in Bangla of Japanese fiction writer Ryunosuke Akutagawa was the writer-translator debut publication back in 1982. Publishing house Nautilas has recently ventured to bring out a new version of the book. Ryunosuke Akutagawa is sometimes considered as the father of modern Japanese short stories. His “Rashomon” brought him fame when the Japanese filmmaker Akira Kurosawa made a film based on his stories in 1950, said Khaliquzzaman Elias. Today, readers are familiar with works of Natsume Soseki, Kazuo Ishiguro, Kenzaburo Oe, Sayaka Murata, Toshiki Okada, and mostly Haruki Murakami, he said, mentioning, ‘Akutagawa belongs to the first generation of modern Japanese writers who paved the way for the younger generation.’ Akutagawa, a pale and feeble young man, was also a highly sensitive and introverted person so much so that it made him a maniac, and finally he committed suicide at the age of 35. Pointing out that the power of the stories of Akutagawa lies in disinterested approach to life and the characters he dealt with, his merciless treatment of their personal traits, oddities, and religious superstitions, Khaliquzzaman Elias said, ‘The book contains seven short stories.’ ‘He chose the medieval Japanese literature, both oral and written, especially stories of Genji or Genji Monogatari as background of many of his stories and fine-tuned them with modern socio-psychological trends,’ he added. Readers can buy copies of Rashomon on the Facebook page of Nautilas. The book can also be purchased on online platforms, including Rokomari, and Bookharbour. Khaliquzzman Elias, who believes in the creativity of translation, has translated several classics of world literature. Among the major classics are James George Frazer’s The Golden Bough, Jonathan Swift’s Gulliver’s Travels, Richard Wright’s Black Boy, Joseph Campbell’s The Power of Myth, Frederick Douglass’s Narrative of an American Slave, Chinua Achebe’s Arrow of God and the Greek author Nikos Kazantzakis’s Zorba the Greek and Report to Greco, and Jean-Jacques Rousseau’s Confessions.",https://www.newagebd.net/post/literature/252772/khaliquzzaman-elias-rashomon-available-at-bookshop
2 siblings arrested with yaba,"Members of Rapid Action Battalion have arrested two siblings with a large quantity of yaba tablets in Brahmanbaria. The arrested individuals are Md Alauddin, 26, and Rozina Begum, 39, offspring of Md Shafiqul Islam from Char Islampur village in Bijoynagar upazila in the district. In a press release issued Friday afternoon, RAB-9 confirmed the arrest of the two alleged drug peddlers, who were caught with 5,800 yaba tablets in the Shimrailkandi area of Brahmanbaria Sadar upazila. A case has been filed against them under the Narcotics Control Act. They were handed over to Brahmanbaria Sadar police station for further legal action.",https://www.newagebd.net/post/country/252771/2-siblings-arrested-with-yaba
BSA begins series discussion,"The Research and Publication department of Bangladesh Shilpakala Academy held the first discussion of the series, ‘New Bangladesh: Where is the Path?’, at the seminar room of National Theatre of the academy in Dhaka on Thursday. New Age journalist Abu Ismail Mohammad Daniel, Jagannath University sculpture department assistant professor Mohammad Zahidul Haque, Jatiya Nagarik Committee spokesperson Samantha Sharmin attended as discussants at the programme, which was moderated by writer-filmmaker Ebadur Rahman. July Revolutionary Alliance spokesperson Fantasir Mahmud, Rasik editor Bhuiyan Mohammad Asaduzzaman and poet-researcher Musa Al Hafiz also attended the discussion, said a press release. BSA director general Syed Jamil Ahmed delivered welcome speech at the programme. Mentioning that this is a very vital time, he said, ‘We want to see the coming together of all classes, all places, all opinions, all religions, all paths, and all things here and listen to their words.’ Pointing out that the role of the academy is never to tell what needs to be done, Jamil Ahmed said, ‘Our role is to create a platform here, where everyone can discuss, talk, and argue.’",https://www.newagebd.net/post/others1/252770/bsa-begins-series-discussion
Birshreshtha Jahangir’s martyrdom anniv today,"Today is the 53rd martyrdom anniversary of the Liberation War’s hero Birshreshtha captain Mohiuddin Jahangir. The people of Chapainawabganj remember the day every year with mixed feelings of solemnity, joy, and sorrow as Birshreshtha Jahangir sacrificed his life to free the then Nawabganj sub-division from the clutches of the Pakistani occupation forces and their collaborators after fierce fighting on December 14 in 1971. Different programmes, including hoisting the national flag, placing wreaths at the grave of Birshreshtha Jahangir on Sonamasjid premises and at his monument at Rehaichar near Mohananda Bridge, and milad mahfil will be held to mark the day. Born on 8 March in 1949 at Rahimganj village under Babuganj upazila in Barishal district, Jahangir joined the armed forces as a cadet at the Pakistan military academy on October 5, 1967. After completing training, he joined as a commissioned officer at engineering core. Later, Jahangir got posted to the 173rd engineer battalion in Multan. After working with the battalion for six months, he was shifted to the military college of engineering in Risalpur. Following finishing the 13-month-long training, he took the bomb disposal training. In 1971, Jahangir was working at the construction site at Karakoram. On June 10, he took a few days leave and went back to Risalpur. One day later, he started his journey towards the Sialkot border to reach India. He managed to cross the border safely and joined the Mukti Bahini. On July 3, he became a captain of sector 7 with the responsibility to fight in Chapainawabganj. On December 14, Jahangir, along with his co-fighters, crossed the Mohananda River near Akandabaria and camped at Rehaichar near Chapainawabganj town before dawn. He intended to destroy one of the light machine gun bunkers of the Pakistan army and crawled towards it. He managed to come closer to the bunker and charge a grenade to it. But he was fired from another bunker, and immediately shot dead. Later, a group of freedom fighters recovered his body from Rehaichar, now the southern part of Birshreshtha Shahid Captain Mohiuddin Jahangir Bridge the next morning, and buried him on the Choto Sona Mosque premises under Shibganj Thana.",https://www.newagebd.net/post/country/252769/birshreshtha-jahangirs-martyrdom-anniv-today
IUB member’s discovery of Firefly Sparkle published in Nature,"An associate member of the Centre for Astronomy, Space Science and Astrophysics of Independent University, Bangladesh, Astronomer Lamiya Mowla, has recently published a research paper in renowned science journal Nature on the discovery of Firefly Sparkle. Firefly Sparkle is a young galaxy dating back approximately 600 million years after the Big Bang when the universe was less than 5 per cent of its current age, said a press release on Thursday. An assistant professor at the Wellesley College in the United States, Lamia Mowla, said, ‘Light from the Firefly Sparkle took 13.2 billion years to reach us, but due to the universe’s expansion, the galaxy is now much farther away than 13.2 light years.’ Mowla added, ‘If we could observe it as it is today, it would likely resemble our own Milky Way. This gives us an incredible glimpse into how our galaxy might have looked in its infancy during the Epoch of Reionisation.’ This discovery, made as part of a research that analysed data from NASA’s James Webb Space Telescope by Mowla and a team of 21 other scientists based mainly in North America, Europe and Japan, offers invaluable insights into the formation and evolution of galaxies, reminiscent of the early Milky Way. Located in a distant region of space, ‘Firefly Sparkle’ consists of 10 compact star clusters embedded within a sparsely packed arc of stars. The galaxy is accompanied by two smaller neighbouring galaxies, referred to as ‘Firefly-Best Friend’ and ‘Firefly-New Best Friend’, forming a fascinating triad that offers a unique glimpse into early cosmic evolution. The discovery leveraged the power of gravitational lensing – where light passes through warped space around a massive galaxy cluster in the foreground that acts as a magnifying glass – to amplify the light of ‘Firefly Sparkle’ by up to 26 times. This natural cosmic phenomenon allowed astronomers to study the intricate structure of the galaxy despite its immense distance from Earth. Khan Muhammad Bin Asad, director of CASSA and assistant professor at the department of Physical Sciences at IUB, said, ‘Professional astronomy and the study of astrophysics are only beginning in Bangladesh, and we aspire for IUB’s CASSA to be recognised as the pioneer in this field in the future. Congratulations to Mowla on publishing this groundbreaking research and gratitude for her association with us, sharing her research, resources, and knowledge, which have significantly contributed to building the foundation for astronomy education and research at IUB.’ IUB has the only research centre for astronomy and astrophysics in Bangladesh where professional astronomers work and it is the only university in the country to offer minor courses in Astronomy and Astrophysics. IUB also houses two outreach telescopes for deep-space imaging which were received from the Dunlap Institute for Astronomy & Astrophysics of the University of Toronto, Canada, in 2022 through an outreach grant of Dr. Mowla. The Centre for Astronomy, Space Science and Astrophysics (CASSA) is dedicated to promoting education in these fields, conducting research, and contributing to global astronomical studies. The centre works to position Bangladesh as a proactive participant in the global scientific community.",https://www.newagebd.net/post/country/252768/iub-members-discovery-of-firefly-sparkle-published-in-nature
Changes in practice of interrogation in custody sought,"Nearly 92 per cent respondents of an opinion poll, carried out by Police Reform Commission, have sought reforms of the interrogation in police custody, criticising the existing practice of tortures during grilling that often lead to suspects death. The opinion came as the commission conducted the survey among 24,442 randomly selected people under a study titled ‘what kind of police do we want’. In the survey, 91.7 per cent respondents replied positively while only 8.3 per cent said ‘no’ on the question on interrogation in police custody. The question posed in the questionnaire was that in view of allegations of torture and human rights violation during interrogations of accused on remand under section 167 of the Criminal Procedure Code, 1898 whether the respondents wanted reforms of the concerned law. In a supplementary question PRC wanted suggestions from the respondents, demanding the reform, and received four major suggestions with most proposing the interrogation room be surrounded by transparent glasses at every police station. They said that the glass room would facilitate people concerned to see from outside if police was using physical force during the grilling process. The respondents also called for amending the remand related law in line with a High Court directive. They recommended interrogation of women accused with decency in presence of female police. The commission made public the survey findings, saying that it agreed with the respondents’ opinions and it was crucial to take into account the opinions and suggestions. The public survey was carried out in the wake of recent criticism in Bangladesh and around the world about the violent role of some police personnel in suppressing the anti-discrimination student movement. The interim government formed the ‘Police Reform Commission’ to reform the police force. Asked how allegations of human rights violation and police’s power misuse should be investigated, 60 per cent respondents suggested formation of a complete investigation commission to pursue such matters. Twenty per cent people suggested formation of a permanent investigation commission, led by a retired High Court judge, and 20 per cent wanted such matters be reviewed by the National Human Rights Commission by amending the relevant law. ‘Some 89.5 per cent people opined that use police force for political purposes must be stopped and 77.9 per cent want police not to indulge in corruption by misusing power,’ the survey report said. Some 75 per cent respondents demanded that police had to be brought under accountability for rights violations and incidents like enforced disappearances and extrajudicial killings. The country needed a law-abiding, corruption and political influence free independent police to maintain law and order equally for the people irrespective of their identity, the survey said. The survey report is now available on the Police Reform Commission website (www.prc.mhapsd.gov.bd), according to a press release of the home ministry.",https://www.newagebd.net/post/country/252767/changes-in-practice-of-interrogation-in-custody-sought
Sherpur district jail reopens after four months,"Sherpur district jail has reopened on a limited scale after remaining inactive for four months due to extensive damage caused on August 5. The jail received 13 inmates following court proceedings on Thursday, marking the resumption of its operations, said Sherpur district jail superintendent Md Shafiqul Alam on Friday. Sherpur chief judicial magistrate Md Sultan Mahmud inspected the jail before the reopening, along with other judicial officials. On August 5, miscreants broke into the prison, vandalised and set it on fire, looted case files and weapons, and facilitated the escape of 518 inmates. Jail superintendent Shafiqul Alam said that renovation work at the facility, carried out by the public works department, was 80 per cent complete. The allocated budget for the project stood at approximately Tk 1.6 crore. However, two preliminary tasks, including the installation of CCTV cameras, remained pending, he added. He also mentioned that the prison was made operational to reduce the inconvenience of transferring inmates to Jamalpur. ‘From now on, those arrested in both new and old cases will be brought to this prison,’ he added.",https://www.newagebd.net/post/country/252766/sherpur-district-jail-reopens-after-four-months
RU medical centre in sorry state,"Multiple problems including shortage of medicine, equipment, funding and inadequate professionals have rendered the lone Rajshahi University medical centre dysfunctional, limiting its services to the university students and teachers. At present, 22 out of 36 posts of doctors and four out of six technologists have been lying vacant at the medical centre for a long time, hampering its services badly, officials said. In addition, lack of three out of six posts of emergency medical officers and four out of six posts of nurses has forced the medical authorities to suspend its ‘afternoon services’, causing immense suffering to the students. Students alleged that they were mostly given pain killers or referred to Rajshahi Medical College Hospital while most of the doctors and technologists of the medical centre allegedly were not found in their respective chambers during office time. Saiful Islam, a third-year student of Islamic history and culture department, said that he went to the medical centre past week with breathing problems but the on-duty doctor prescribed two tablets of cold-related diseases without listening to his problem properly. According to officials, over forty medical tests including electrocardiogram, X-rays, and ultrasonography are available in the medical centre and most of these tests are provided to the students free and a few are at a nominal cost. Mafruha Siddiqa Lipi, chief medical officer of the university medical centre, said that the main obstacle to providing services was due to lack of necessary manpower. She said that the previous university authorities took a move in 2020 for recruiting 13 doctors and other necessary technologists and staff at the medical centre but the appointment got stuck due to some invisible reasons. ‘Whenever we approached the university administration in this regard, they only gave us assurances, but no visible effort was made to resolve the issue,’ she added. RU vice-chancellor professor Saleh Hasan Naqib said that they were trying to solve the existing problems to make the university medical centre fully operational. ‘We have started a process to recruit some doctors and staff so that emergency services can be ensured at the medical center,’ he said, hoping that a massive change in providing health services at the medical centre will be noticed about a month later. The RU authorities, meanwhile, have recently signed a memorandum of understanding with Popular Diagnostic Centre Ltd to get some discount for its teachers, officials, employees, and students on various medical tests.",https://www.newagebd.net/post/country/252765/ru-medical-centre-in-sorry-state
Opera holds Apu Aman Natya Asar,"Mirpur-based theatre troupe Opera organised a day-long street theatre festival titled Apu Aman Natya Asar 2024 at the Apu Aman Muktabedi in Mirpur, Dhaka on Friday. The festival featured six plays of the theatre troupes Aranyak Natyadal, BotTala, Prachyanat, Opera and Theatre 52. Inaugurated by Bangladesh Shilpakala Academy’s theatre and film department director Faiz Zahir, Opera began the festival with staging its two productions titled Pakhir Bhabishyat and Kaiballya at the festival. Pakhir Bhabishyat is written and directed by Nahid Smriti, while Koiballya, an earliest production of the troupe, is written by Sanjiban Shikdar and directed by Kazi Toufikul Islam Emon. Aranyak Natyadal staged Apu Mehedi-written and Hashim Mahmud-directed production titled Matir Mahajan, BotTala staged Kazi Roksana Ruma and Mahbub Masum-directed production ‘Abar Phalgun’, Theatre 52 staged Dhruba Esh-written and Jayita Mahalanobish-directed production ‘Ahangkari Prithibi’, and Prachyanat staged Kazi Toufikul Islam Emon-directed production titled Speak Out at the festival. The festival also awarded Kazi Toufikul Islam Emon as Apu Aman Natya Srijan Sammanana 2024.",https://www.newagebd.net/post/theatre/252764/opera-holds-apu-aman-natya-asar
