title,content,link
"SC stays HC verdict on Tarique, Mamun","The Appellate Division of the Supreme Court on Tuesday stayed seven-year jail sentence of the Bangladesh Nationalist Party acting chairman Tarique Rahman and businessman Giasuddin Al Mamun in a case lodged over money laundering. A four-member apex court bench, headed by chief justice Syed Refaat Ahmed, passed the order granting a leave to appeal petition filed against the High Court judgment. ‘The High Court convicted and sentenced him, whereas the lower court concerned had acquitted him in the case. We had filed the leave to appeal petition against the High Court judgment. Today [Tuesday] the apex court granted that plea, staying the High Court judgment as well. The court asked both the parties to submit the summaries of our plea by December 31,’ Tarique Rahman’s counsel Kaiser Kamal said. The High Court on July 21, 2016, sentenced Tarique Rahman to seven-year imprisonment and fined him Tk 20 crore, scraping his sentence of acquittal in a money laundering case. A High Court division bench comprising justices M Enayetur Rahim and Amir Hossain passed the order, repealing a lower court order that had acquitted the BNP leader in the case. The court, however, upheld the lower court sentence of seven-year imprisonment for Giasuddin Al Mamun while commuting his fine of Tk 40 crore to Tk 20 crore. According to the case document, Anti-Corruption Commission filed the case against Tarique and Mamun for taking more than Tk 20 crore as bribe and laundered it abroad. Dhaka 3rd special judge Md Motahar Hossain on November 17, 2013, acquitted Tarique from the charges and sentenced Mamun to seven-year imprisonment and fined him Tk 40 crore. The commission filed an appeal against Tarique’s acquittal on December 5, 2013. Mamun also filed an appeal against the lower court sentence.",https://www.newagebd.net/post/country/252528/sc-stays-hc-verdict-on-tarique-mamun
Bangladesh elected as UNHCR VP,"Bangladesh has been elected unanimously to serve as a vice-president of the United Nations Human Rights Council, the prime intergovernmental body of the UN responsible for the promotion and protection of all human rights around the globe. The decision was made Monday afternoon, when the council met for an organisational session pertinent to its work for the year 2025, according to message received on Tuesday. As an elected vice-president, the permanent representative of Bangladesh to the UN and other international organisations in Geneva will join the bureau of the Human Rights Council from January 1 to December 31, 2025. The bureau of the Human Rights Council consists of one president and four vice-presidents representing each of the five UN regional groups. The election process for vice-presidency started in October 2024, when Bangladesh expressed its interest in serving in the bureau as the vice-president representing the Asia-Pacific Group. The group unanimously supported the candidature of Bangladesh for the vice-presidency and forwarded the nomination for the consideration of the wider memberships of the council. Finally, the process culminated successfully when Bangladesh earned unanimous support of the entire council membership to serve as vice-president. This marks the first time that Bangladesh is going to serve as the vice-president of this prestigious UN human rights body since the Human Rights Council was established by the UN General Assembly in 2006. ‘This is yet another example of the trust and confidence that the international community reposes on Bangladesh under the prudent leadership of the chief adviser professor Muhammad Yunus as well as recognition of the active role and growing influence of Bangladesh in multilateralism,’ said the foreign ministry.",https://www.newagebd.net/post/country/252527/bangladesh-elected-as-unhcr-vp
"Man killed, buried at his factory at Kamrangirchar","Police recovered the buried body of Nur-e-Alam, 57, a cloth printing factory owner, from his factory in Dhaka’s Kamrangirchar area Tuesday evening. Kamrangirchar police station officer-in-charge Amirul Islam said that Nur-e-Alam had been brutally killed on Friday. His body was dismembered and buried inside the factory. ‘We recovered the body four days after he was reported missing. Three suspects, including a factory employee, have been arrested in connection with the murder,’ the OC added. The victim’s daughter-in-law Ataullah Khan filed a murder case with the police station on Tuesday. The police officer added that the arrested suspects were being interrogated as part of the ongoing investigation.",https://www.newagebd.net/post/country/252526/man-killed-buried-at-his-factory-at-kamrangirchar
Workshop on outcome based curriculum held at BSMMU,"The Institutional Quality Assurance Cell of Bangabandhu Sheikh Mujib Medical University on Tuesday organised a workshop on outcome based curriculum at the university in Dhaka. Professor Dr Md Shahinul Alam, interim vice-chancellor of the BSMMU, attended the workshop as chief, said a press release. He said that this type of training workshop would help the university’s residency programme to be upgraded to international standards. ‘By producing international-standard experts in medical science, we will have to contribute at the national and international levels.’ He also mentioned that the administration of the BSMMU would provide support in academic, scientific, research work, including creating a world-class curriculum, developing the faculty, and increasing the work and knowledge skills of the faculty. Presided over by Professor Dr Jesmine Banu, director of IQAC, pro-VC for administration Professor Dr Md Abul Kalam Azad, pro-VC FOR research and development Professor Dr Md Mujibur Rahman Howlader, treasurer Professor Dr Nahrin Akhter, and registrar Professor Dr Md Nazrul Islam, among others, attended the workshop as special guests. The workshop was also attended by eight facilitators, faculty members of the faculty of medicine, and course directors.",https://www.newagebd.net/post/country/252525/workshop-on-outcome-based-curriculum-held-at-bsmmu
Ex-MP Poton granted six-month bail,"The High Court has granted six months’ bail to former lawmaker Kamrul Ashraf Khan Poton, owner of M/S Poton Traders, in a high-profile case involving the embezzlement of 72,000 tonnes of government-imported urea fertiliser valued at Tk 582 crore. The alleged misappropriation of Poton, a former independent lawmaker from Narsingdi 2 constituency, occurred during the Awami League regime hit newspaper headline. The bench of Justice Md Iqbal Kabir and Justice Md Riaz Uddin Khan issued the bail order on Monday, asking the Anti-Corruption Commission to explain why Poton should not be granted regular bail. This bail was granted after a fresh application was submitted to the High Court after toppling of Awami League government on August 5, challenging a lower court’s decision to deny Poton’s bail plea. The application followed the earlier rejection of a rule issued by a different High Court bench in June 2024, which had also asked the ACC to justify its opposition to granting bail. Deputy attorney general Farid Uddin Khan said that a recommendation was sent to the Attorney General for filing an appeal against Poton’s bail, citing the scale of the alleged embezzlement, which had drawn widespread attention during the Awami League government. Additional attorney general Aneek R Hoque and ACC lawyer Shahin Ahmed  also opposed Poton’s bail. The ACC filed the case on November 26, 2023, accusing Poton and four associates of misappropriating government-imported fertiliser during transportation. The case alleges that this act caused significant financial losses to the state. Earlier, the High Court had granted bail to Poton, but the Appellate Division stayed the order on June 12, 2024, in response to an ACC appeal. The Supreme Court then directed the High Court to dispose of the pending rule. Poton’s new lawyer, Mohammad Hossain Lipu, stated that the fresh bail plea was based on procedural grounds and sought relief against the lower court’s rejection of Poton’s earlier application. Senior pro-Bangladesh Nationalist Party lawyer Ruhul Quddus Kazal moved Poton’s new application seeking bail.",https://www.newagebd.net/post/country/252524/ex-mp-poton-granted-six-month-bail
"BUMA, MACES host photography marketing competition","BRAC University Marketing Association has recently organised a photography marketing competition titled Frames of Freedom to showcase the essence of the student-led July-August mass uprising. The purpose was to honour the memories of the movement and give platform to general students and armature photographers a chance to promote their talent, said a press release on Tuesday. Education consultancy MACES who are always supportive of student initiatives sponsored the competition. BUMA partnered with the Army-IBA Business and Leadership Club, Nirban: An Artistic Platform for IUTians, BUP Photography Society, Rotaract Club of East West University, Photography Club of BNMPC and SAGC Photography Club as co-organisers to host the competition in their institutions. The Frames of Freedom Photography Competition invited students from universities and colleges to share moments captured that resonate with the theme Remembering the Days of Our 2nd Independence. The competition judges were Tanvir Murad Topu, head of photography, Pathshala South Asian Media Institute and Shafiqul Alam Kiron, photographer, Map Photo Agency. The award ceremony and a photography exhibition was recently held at the BRAC University campus on December 5, where the top 50 photographs were exhibited for general viewing. Nishat Tasnim Nazia, Shaheed Bir Uttam Anwar Girls College, was awarded as winner, while Aditya Das, Bhawal Badre Alam Government College as runner up. Popular Choice Winner went to Mominur Jaman, Dhaka Residential Model College, Honourable Mention to Humayra Akter Mahi, BRAC University, MACES managing partner Rouham Manzoor and BRACU registrar David Dowland, proctor Rubana Ahmed, BUMA adviser Syed Far Abid Hossain and joint director, OCA, Tahsina Rahman were present at the ceremony.",https://www.newagebd.net/post/country/252523/buma-maces-host-photography-marketing-competition
Indian Coast Guard takes away two trawlers with 79 people from Bangladesh,"The Indian Coast Guard took away two Bangladeshi fishing trawlers carrying 79 sailors near the maritime boundary between the two countries on Monday. The incident reportedly occurred in the Hiron Point area of Khulna within Bangladesh’s territorial waters, according to vessel owners and the department of shipping. The apprehended vessels are FV Meghna-5, owned by C&A Agro Limited of Chattogram, and FV Laila-2, owned by SR Fishing. Ansarul Haque, operations manager of C&A Agro Limited, said that FV Meghna-5 and FV Laila-2 were engaged in deep-sea fishing in Bangladeshi waters. At about 11:00am on the day, the Indian Coast Guard seized both vessels. Communication with the sailors through another trawler confirmed that the vessels were being taken towards Odisha. When asked whether the trawlers had crossed into Indian waters, he said that their vessels were within Bangladesh’s maritime boundary. The Indian Coast Guard crossed into their territory and seized them. Ansarul Haque also confirmed lodging complaints with the Bangladesh coast guard, ministry of fisheries and livestock, ministry of foreign affairs, and other relevant authorities, who have assured full support. FV Meghna-5 had 37 individuals, including crew and fishermen, onboard, while FV Laila-2 carried 42. Both crews reported being in good condition during communications on Monday night and Tuesday morning. Commodore Mohammad Maqsud Alam, managing director of the department of shipping, said that the two vessels were seized near Indian waters. ‘The Bangladesh Coast Guard and other government agencies are in contact with Indian authorities, and we are closely monitoring the situation,’ he added.",https://www.newagebd.net/post/country/252522/indian-coast-guard-takes-away-two-trawlers-with-79-people-from-bangladesh
Failed to fetch title,Content not available,https://www.newagebd.net/post/country/252521/protest-march-towards-agartala-today
"Punishment of Hasina, cohorts demanded","Marking the International Human Rights Day on Tuesday, oppression victims, their families, political and student leaders renewed the call for ensuring punishment for Sheikh Hasina and her accomplices for gross human rights violations during Awami League’s misrule of over 15 years. They also said that AL could not be allowed to involve in politics without ensuring justice for the victims of enforcement disappearances and extrajudicial killings, BDR carnage, killings during Hefazat rally and  student-people mass uprising. People from all walks of life need to be united to resist all conspiracies hatched by the Indian government in recent times, speakers said at a mass gathering organised by Mayer Daak, a platform of enforced disappearance and extrajudicial killing victims’ family members, at Suhrawardy Udyan in the capital. ‘I demand to the interim government for ensuring punishment of Sheikh Hasina and her collaborators at the earliest for killing people indiscriminately,’ said Korban Sheikh Hillol, who lost eyesight during the student-mass movement on August 5 in police firing. According to the interim government latest data, about 1500 people were killed and 19,931 were injured during the July mass uprising. Adiba Islam Ridhi, whose father disappeared in December 2013 and still traceless, said ‘We still don’t know where my father is. I demand trial of the people involved in disappearing my father forcibly.’ On November 5, the Commission for Inquiry into Enforced Disappearances that it had received over 1,600 complaints of disappearance incidents occurred during the 15-year rule of Awami League. The complaints were lodged from September 15 to October 31 this year by the enforced disappearance victims and their families. About 200 of the victims are still traceless. Maayer Daak co-founder Sanjida Islam Tulee said that it was the biggest event of the platform and it could be possible due to ouster of Sheikh Hasina. Bangladesh Nationalist Party standing committee member Abdul Moyeen Khan said that fascist AL government had committed extrajudicial killings and enforced disappearances as their views went against AL. ‘AL had proved time and again as a human rights violator party. We also demand punishment of Sheikh Hasina and her collaborators,’ he added. Addressing the event, Student Movement Against Discrimination convener Hasnat Abdullah said that AL would not be allowed to involve in politics or take part in elections before ensuring punishment for extrajudicial killings, enforced disappearances. ‘The Awami League did not even say sorry after killing about 2,000 people in July uprising. There will be no compromise with AL,’ said Hasnat, urging people from all walks of life to unite to resist Indian Narenda Modi’s conspiracy to divide the protesters. Posts, Telecommunications, and Information Technology adviser Nahid Islam said that AL was a party that never respected humanism. ‘We have to ensure punishment of Awami League people for their misdeeds. If anyone tries to rehabilitee AL, they will be identified as mass enemy,’ he added. On February 25–26, 2009 rebellion in the erstwhile Bangladesh Rifles carnage left 75 people, including 57 army officials killed. Bangladesh Jamaat-e-Islami secretary general Mia Golam Parwar said that Sheikh Hasina had ordered the BDR carnage in a planned way. He said that AL had to be resisted in a united way through a proper electoral system. Jatiya Nagorik Committee convener Nasir Uddin Patwary said that they would not allow any elections before ensuring trial of Hasina and her collaborators. Nagorik Oikya convener Mahmudur Rahman Manna and Ganosamhati Andolan chief coordinator Zonayed Saki, among others, spoke.",https://www.newagebd.net/post/country/252520/punishment-of-hasina-cohorts-demanded
BNP for RAB’s abolition,"The Bangladesh Nationalist Party recommended the abolition of the Rapid Action Battalion, citing allegations of human rights violations and extrajudicial killings. It made the recommendation to the Police Reform Committee the interim government has recently formed. BNP standing committee member retired major Hafizuddin Ahmed came up with the recommendation at a press conference on Tuesday at the party chairperson’s office at Gulshan in the capital. Mentioning that the force already faced harsh criticism at home and abroad, he said that the RAB became a ‘monster’ in the eyes of the country’s people. ‘We recommend the RAB’s abolition for their involvement in extrajudicial killings and enforced disappearances and we believe that its abolition would send  a positive message to people,’ he added. Hafiz also said that necessary measures could be taken to enable the police force along with its specialised forces, including the Armed Police Battalion, to carry out the responsibilities of the Rapid Action Battalion. He further said that both local and international human rights organisations, the United Nations, most political parties, and the public blamed the RAB for most of the incidents of enforced disappearances, killings, torture and repression. Hafiz at the briefing also referred to the United States’ sanctioning of the force over allegations of human rights violation. The Rapid Action Battalion was founded on March 26, 2004 during the BNP-led four-party alliance government to curb organised crimes and terrorism. Since its very establishment the force had remained under intense scrutiny, facing serious allegations of human rights violations. The party also gave other reform recommendations, including forming a police commission, to the Police Reform Commission. It has suggested formation of an eight-member Police Commission headed by the Parliamentary Standing Committee on Home Affairs chairman to properly guide, advise and support the police force. One of its recommendations is to form a citizen committee in every upazila or police station jurisdiction to support the police in combating crimes at the local level, improving public-police relations, and giving advice on maintaining law and order. The chair of the committee would be an eminent person of the respective area and the officer-in-charge of the police station concerned would be its member secretary, the BNP suggested as the possible structure of its proposed citizen committees. They also recommended strengthening of community policing, saying that community policing would reduce various crimes and social unrest, help bridge the gap between the police and the public, and increase public awareness. Hafiz further said that after the fall of the Awami League regime on August 5, a total of 488 police officers took shelter at the cantonment who he said were involved with enforced disappearances, killings and corruption. The army did not do the right thing by giving them shelter as they were offenders, the retired serviceman said. Enforced disappearances, killings and repression of the opposition people perpetrated by the Awami regime turned the country into a ‘police state’, he added.",https://www.newagebd.net/post/politics/252519/bnp-for-rabs-abolition
"Tk 27,000cr withdrawn after AL ouster","The number of bank accounts holding deposits exceeding Tk 1 crore dropped by 1,657 as of September, equivalent Tk 27,000 cr due to withdrawal pressure particularly from Awami League connected individuals. According to central bank data, the number of such accounts stood at 1,17,127  during July- September, down from 1,18,784 at the end of June, when the number reached peak. By the end of September, the total deposits in the banking sector were recorded at Tk 18.25 lakh crore, with Tk 7.46 lakh crore held in accounts with more than Tk 1 crore. However, it marked a decline of Tk 27,000 crore from June’s figure of Tk 7.73 lakh crore. The number of such accounts was 1,15,890 accounts in March and 1,16,908 at the end of December 2022. Banking insiders attribute this decline to the political turbulence following the fall of the Awami League-led government on August 5. Many individuals associated with the Awami League reportedly withdrew large sums, transferring money abroad amidst fears of political fallout. This capital flight along with intensified scrutiny from regulatory agencies worsened the situation for them. The Bangladesh Financial Intelligence Unit (BFIU) has frozen numerous accounts linked to businesses, politicians, and activists associated with the party. Moreover, agencies such as the Anti-Corruption Commission and the Criminal Investigation Department have ramped up efforts to identify individuals accused of amassing wealth through illicit means. Some supporters of the Awami League have gone into hiding, while others have left the country to avoid legal or financial repercussions. Mainul Islam, former professor of economics at Chittagong University, told New Age that the current political unrest has significantly contributed to heightened withdrawals from banks. He explained that many influential individuals, particularly politicians, began withdrawing large sums of money following the intensification of the student-led protests in July. These funds, he noted, were transferred abroad, with most of these individuals fled overseas to lead a comfortable life. He expressed grave concerns about the uncertainty surrounding the banking sector, emphasizing that recovery seems unlikely in the near future due to the absence of tangible improvements. Highlighting the fragile state of the sector, he pointed out that 10 to 11 banks are in particularly precarious conditions. The professor questioned whether the central bank possesses the capacity or strategy to salvage these troubled institutions effectively, given the severity of their crises. Additionally, the Bangladesh Bank has restructured the boards of 11 banks due to widespread irregularities and loan scams. This move, while necessary, has contributed to depositor anxiety, leading to further withdrawals. The situation was exacerbated when the newly appointed BB governor, Ahsan H Mansur, publicly acknowledged that around 10 banks faced potential bankruptcy. His statement intensified depositors’ concerns, prompting a surge in withdrawals that many banks struggled to manage. Out of Bangladesh’s 16.20 crore bank accounts, 11.73 crore accounts hold less than Tk 5,000, while accounts with deposits exceeding Tk 1 crore represent only 0.073 per cent of the total. Despite their small number, these high-value accounts account for approximately 40 per cent of the sector’s aggregate deposits, reflecting a disproportionate concentration of wealth. Among the high-value accounts, 1,800 accounts held deposits exceeding Tk 50 crore each, collectively amounting to more than Tk 2.51 lakh crore. Despite this decline, the trend of growth in high-value accounts has been consistent over recent years, increasing from 75,563 accounts in December 2018 to 1,01,976 by December 2021. However, the recent economic and political challenges have disrupted this growth trajectory. Experts said that persistent inflation, political unrest, energy shortages, and high dollar rates have constrained businesses’ profitability, reducing their capacity to maintain large bank deposits. The Bangladesh Bureau of Statistics reported an inflation rate of 11.38 per cent in November, with overall inflation exceeding 9 per cent for 20 consecutive months, driven by escalating commodity prices. High inflation has also led many individuals to hold onto cash rather than keep it in banks.",https://www.newagebd.net/post/country/252518/tk-27000cr-withdrawn-after-al-ouster
