title,content,link
Yonex-Sunrise Int’l Badminton begins Friday,"The country’s senior and junior shuttlers will be busy for over a week as nearly 350 competitors from 19 countries compete in the Yonex-Sunrise junior and senior International Badminton tournaments, to be held at the city’s Shaheed Tajuddin Ahmed Indoor Stadium from December 13 to 21. The Junior International Series will be held from December 13 to 15, while the Senior International Challenge is scheduled for December 17 to 21. A total of 114 shuttlers from three countries — host Bangladesh, India, and Indonesia —will compete in five categories — boys’ singles and doubles, girl’s singles and doubles, and mixed doubles — in the junior series offering a purse of $ 5,000 as prize money. While a total of 228 senior shuttlers from Bangladesh, India, Thailand, Myanmar, Canada, Indonesia, Sri Lanka, Japan, Maldives, Ukraine, Italy, Finland, Bulgaria, Uganda, Vietnam, Malaysia, the Philippines, Singapore, and England will compete in the senior series. There will also be five events—men’s singles and doubles, women’s singles and doubles, and mixed doubles—in the International Challenge offering $ 15,000 as prize money. Bangladesh Badminton Federation acting president Quamrun Nahar Dana disclosed the details of the competition during a press conference at the Bangladesh Olympic Association auditorium on Wednesday. The tournament director and a deputy inspector general of police, Taptun Nasreen, was also present on the occasion.",https://www.newagebd.net/post/others/252561/yonex-sunrise-intl-badminton-begins-friday
ACC to launch probe against ‘big fishes’ soon: chairman,"The newly appointed chairman of Anti-Corruption Commission, Mohammad Abdul Momen, on Wednesday said that the commission would start investigation into the allegations against ‘big fishes’ soon. ‘Working as per public expectations is top priority. We will take action immediately about those cases of corruption which affected the country significantly and take action against culprits who were behind the corruption,’ he said. Momen came up with the remarks while talking to journalists at ACC headquarters in the capital’s Segun Bagicha after taking charge as chairman of the commission. Earlier on the day, the Transparency International Bangladesh, in a statement, urged the new ACC chairman and commissioners to voluntarily disclose their income and asset statements to ensure accountability and transparency. In this regard, the ACC chief said that the commission’s chairman and commissioners would submit information on all their movable and immovable assets within seven days. Momen also told journalists that the new commission will not be influenced by any political ideology or bias. ‘We will be neutral, adhering to the law,’ he added. About his priority works, he said, ‘We will start working first on the issues expected by the people and the big corruptions that affected the state.’ ‘So that those who were involved in all this big corruption do not get a release,’ he added. When asked about a graft allegation against Momen while he was posted at Biman Bangladesh Airlines, he said it was true that a graft allegation came to ACC against me in 2009 but I was cleared of the charges after completion of probe in 2023. Abdul Momen and another commissioner Mia Mohammad Ali Akbar Azizi joined ACC on Wednesday but another commissioner Brigadier General (retd) Hafiz Ahsan Farid did not join on the day. TIB, in a media statement on Wednesday, emphasised the importance of maintaining public trust in this key institution and called for proactive measures to promote integrity. TIB executive director Iftekharuzzaman said that at this crucial moment, the leadership of the ACC should take the initiative to promote transparency and accountability within the institution. He urged the ACC’s top officials to disclose details regarding their income and assets, either in their own name or family members’ names, whether declared or undeclared. The TIB also called for the disclosure of data demonstrating consistency between income from legitimate sources and accumulated wealth. TIB suggested for full disclosure of any direct or indirect political affiliations and a formal declaration of readiness to voluntarily resign and undergo legal investigation in case of any discrepancies in their asset declarations. The government on Tuesday appointed senior secretary of the Public Security Division of home ministry Mohammad Abdul Momen as ACC chairman and other two commissioners.",https://www.newagebd.net/post/country/252560/acc-to-launch-probe-against-big-fishes-soon-chairman
Police must reach scene of incident in an hour: DMP commissioner,"Dhaka Metropolitan police commissioner Sheikh Md Sajjad Ali has instructed police officers to act promptly on any complaints or general diaries filed at police stations, emphasising the importance of swift responses in building public trust. Speaking at the monthly crime review meeting for November 2024, held at the Bangladesh Police Auditorium in Dhaka’s Rajarbagh on Wednesday, the DMP commissioner said, ‘The police must reach the scene of an incident within an hour and conduct initial investigations. If necessary, a case must be filed. Quick action in any incident will foster a positive perception of the police among the public.’ Highlighting the challenges faced by Dhaka city, home to nearly two crore residents, the DMP commissioner noted the city’s issues, such as traffic congestion and other complications. ‘To restore our lost glory, Dhaka Metropolitan Police and Bangladesh Police have undertaken initiatives, including engaging directly with the public, listening to their concerns, and assuring them of our commitment to providing top-notch service,’ he said. The DMP commissioner encouraged police officers to set examples through their behavior, ethics, and lifestyle, saying, ‘As the DMP commissioner, I aspire to elevate this institution to new heights. I urge my colleagues to also serve as role models. Public perception of police officers is as important as the fulfillment of their legal responsibilities.’ The commissioner emphasised that one of the police’s primary duties is to apprehend criminals and ensure justice through the courts. He issued a stern warning against misclassifying homicides as unnatural deaths in police records. ‘Such misreporting will lead to severe punitive action, and the respective officer-in-charge of the station will be held accountable,’ he added. He also called for strict action against muggers, extortionists and teen gangs. To combat these crimes, he proposed the formation of citizen forums comprising teachers, students, workers, community leaders, and businesspeople to promote collaboration and prevention. During the meeting, joint commissioner, crime, Md Faruq Hossain presented a detailed analysis of November’s crime statistics, covering offenses such as robbery, burglary, murder, accidental deaths, road accidents, gender-based violence, drug trafficking, and arms recovery. The DMP commissioner provided various directives aimed at tackling these issues effectively.",https://www.newagebd.net/post/country/252559/police-must-reach-scene-of-incident-in-an-hour-dmp-commissioner
FIFA to confirm Saudi Arabia as 2034 World Cup hosts,"FIFA is set to confirm on Wednesday that Saudi Arabia will host the 2034 World Cup while a joint bid by Morocco, Spain and Portugal which also features matches in South America will be awarded the 2030 tournament. The awarding of hosting rights for both tournaments will go to a vote during a FIFA Congress to be held virtually, but there is no doubt about the outcomes with neither bid having a rival. As for 2034, FIFA invoked its principle of rotating its flagship tournament between continents, only welcoming bids from Asia or Oceania -- the 2026 World Cup, the first involving 48 teams, will take place across North America. Controversially, the body gave potential bidders barely a month last year to submit candidacies, and Australia and Indonesia quickly abandoned their interest. That left Saudi Arabia as the sole candidate, clearing the way for the World Cup to return to the Gulf region so soon after Qatar hosted in 2022. The kingdom's de facto ruler, Crown Prince Mohammed bin Salman, has been using sport for some time to amass influence and improve its global image -- critics though say he is effectively ‘sportswashing’ by diverting attention from Saudi Arabia's rights record. Saudi Arabia already hosts several high-profile events including a Formula One Grand Prix, heavyweight boxing contests, the LIV rival golf circuit funded by Saudi's sovereign wealth fund,  and the WTA Finals tennis. Being handed the 2034 World Cup will be a crowning moment, and Saudi will secure hosting rights despite currently only boasting two stadiums with a capacity of 40,000, when 14 are required. Beyond that logistical challenge, the baking temperatures in the northern hemisphere summer could mean pushing the tournament back to later in the year, as happened in Qatar in 2022. However, the fact that Ramadan will take place in December that year is an added complication. Moreover, the awarding of the World Cup to Saudi will make the issue of human rights a major talking point again, just as two years ago. Rights groups highlight mass executions in Saudi Arabia and allegations of torture, as well as restrictions on women under the conservative country's male guardianship system. Free expression is severely restricted too. The 2030 tournament will mark a century since the first World Cup was held in Uruguay, and as a result the bid will also see the South American nation handed a game along with Argentina and Paraguay. That makes it a completely unprecedented bid, involving three different continental confederations. FIFA confirmed over a year ago that the joint proposal led by Morocco, Spain and Portugal was the sole contender for 2030, with all other potential candidacies having fallen by the wayside. A joint British and Irish bid was abandoned when they decided to focus on hosting Euro 2028, while there were suggestions of a bid from South Korea, China, Japan and North Korea. Four South American countries launched a joint bid in 2019, convinced that the centenary World Cup should entirely take place on the same continent where it all began. In late 2022, UEFA promoted a bid uniting Spain and Portugal with war-torn Ukraine in a show of ‘solidarity’ following the Russian invasion. However, Ukraine was quietly dropped from that candidacy last year as Morocco joined forces with the Iberian neighbours, while South America agreed to step aside in exchange for being awarded the hosting of three games, one each for Uruguay, Paraguay and Argentina. Following these ‘centenary celebrations’ in the comparative chill of the southern hemisphere winter, the six teams involved -- along with their fans -- will have to cross the Atlantic Ocean to play the rest of the tournament. This tentacular tournament will conclude with the final on July 21, and it remains to be seen where that game will be staged. Spain, which hosted the 1982 World Cup, is set to be the centrepiece as it boasts 11 of the 20 proposed stadiums. Morocco -- which has tried and failed on five previous occasions to be awarded the staging of the tournament -- will become the second African nation to host the competition after South Africa in 2010. Potential venues for the final include the Santiago Bernabeu in Madrid and Barcelona's Camp Nou, which is nearing the end of a substantial renovation project, as well as the planned Hassan II stadium between Casablanca and Rabat, which is set to become ‘the biggest stadium in the world’ with a capacity of 115,000. Portugal, which hosted Euro 2004, will offer two stadiums in Lisbon and one in Porto, and hopes to stage a semi-final.",https://www.newagebd.net/post/football/252558/fifa-to-confirm-saudi-arabia-as-2034-world-cup-hosts
Failed to fetch title,Content not available,https://www.newagebd.net/post/cricket/252557/no-deal-yet-for-cricket%5C%27s-champions-trophy-format
Professor Yunus stresses expansion of technology in CHT,"Bangladesh interim government chief adviser Professor Muhammad Yunus has laid emphasis on the expansion of technology in the Chittagong Hill Tracts to bridge the gap in communication. ‘The hilly areas are inaccessible, hence communication is difficult. That’s why there is a need for technology to expand. This distance can be overcome with technology,’ he said while virtually addressing a training programme titled ‘Hilly Zilla Parishad Management’ at the CHT Complex in Dhaka on Wednesday. The chief adviser said the hill districts which were enriched with natural beauty and resources could be the best development zone but it is lagging behind others. ‘You (CHT people) were supposed to move forward with their crops, fruits, and traditional products,’ he said. Recalling memories of women footballers came from the CHT and their struggles in clinching a trophy recently, Yunus said, ‘Your daughters have won the world in football. The youths should not only be citizens of Bangladesh, they should be citizens of the world. It will not be left behind as a remote area. There will be limitations, but the limits of mind have to be expanded. You have to reach out to people all over the world with your credit.’ He invited youths from the CHT to attend the youth festival scheduled to be held in January next and urged their parents to encourage their children to participate in the festival. He urged the youth to go forward with education and CHT will not stay behind compared to the big cities.",https://www.newagebd.net/post/country/252556/professor-yunus-stresses-expansion-of-technology-in-cht
Japan organisers say 2026 Asian Games on track after reports,"Preparations for the 2026 Asian Games in Japan are going ‘smoothly’, its chairman said Wednesday, after reports the governing body told organisers to make significant improvements. Japanese media said the Olympic Council of Asia is not happy with preparations for the event in Nagoya and the wider Aichi Prefecture area and has accused organisers of not sticking to the host city contract. Aichi governor Hideaki Omura, who also serves as chairman of the local organising committee, told reporters that preparations were on schedule. ‘We are taking this in a calm manner and my understanding is that preparations are progressing smoothly,’ he said. Reports said the OCA has demanded improvements in several areas, including accommodation and transport for athletes and teams. As many as 15,000 athletes could compete at the September 19 to October 4 Games -- even more than the Olympics. The OCA has reportedly asked organisers to think again about their accommodation plans, which are said to involve housing athletes in container units and on a cruise ship. ‘We received opinions on the progress at a coordinating committee in September. We are preparing based on this,’ an organising committee spokesman told AFP. The spokesman added that they have discussions with the OCA on ‘a daily basis’. AFP has approached the OCA for comment. The previous Asian Games were held in the Chinese city of Hangzhou in 2023, one year later than planned because of the pandemic.",https://www.newagebd.net/post/others/252555/japan-organisers-say-2026-asian-games-on-track-after-reports
Afghan refugees minister killed by suicide blast,"The Afghan minister for refugees was killed on Wednesday in a suicide bombing at the ministry’s offices in the capital Kabul, government sources said, blaming the Islamic State group for the attack which has not been claimed. Taliban government spokesman Zabihullah Mujahid deplored ‘a cowardly attack’ carried out by the Islamic State group, saluting a ‘great fighter’ who ‘fell as a martyr’. The explosion, which was the first attack targeting a minister since the Taliban returned to power in 2021, ‘happened at the ministry for refugees and minister Khalil Ur-Rahman Haqqani has been martyred along with some of his colleagues,’ a government source said. He added that the explosion was caused by a suicide blast. The roads leading to the ministry were blocked by Taliban authorities, with security personnel posted on surrounding rooftops. The ministry’s account on X said training workshops were held in recent days on its premises. The ministry’s corridors are full daily of numerous displaced people coming to request assistance or to follow up on resettlement cases in a country that still has more than three million war-displaced. Khalil Ur-Rahman Haqqani — who never appeared without an automatic weapon in his hand — was the brother of Jalaluddin Haqqani, founder of the feared Haqqani network responsible for some of the most violent attacks during the Taliban’s two-decade insurgency. He was also the uncle of Sirajuddin Haqqani, the current interior minister. Khalil Ur-Rahman’s nephew, Anas Haqqani, praised his uncle, saying he ‘reached the highest level of martyrdom’, and condemned his killing by ‘those who apparently claim to follow the blessed religion of Islam’, in a post on X. The Haqqanis are said to be engaged in a struggle for influence within the Taliban authorities. According to press reports, they are pitted as a pragmatic faction up against supporters of the severe interpretation of Islamic law in line with the Taliban’s supreme leader based in Kandahar. Khalil Ur-Rahman Haqqani, who was 58, had been on US and UN sanctions lists, with Washington offering $5 million for information on him. Several senior Taliban leaders have been killed since their return to power, including provincial governors, commanders and religious clerics, mostly in attacks claimed by IS. Violence has waned in Afghanistan since the Taliban forces took over the country in 2021, ending their war against US-led NATO coalition forces. However, the regional chapter of IS, known as Islamic State Khorasan, is active in Afghanistan and has regularly targeted civilians, foreigners and Taliban officials with gun and bomb attacks. In Kabul, explosions regularly echo through the city, but while local sources report them, they are rarely confirmed by Taliban authorities. At the end of October, a child was killed and about 10 people were wounded in a bomb attack on a downtown market. In November, IS claimed responsibility for a gun attack that left 10 people dead at a Sufi shrine in northern Baghlan province. The Taliban authorities frequently announce the arrest or killing of jihadist group members — even as they continue to claim that the IS threat has been eradicated in the country.",https://www.newagebd.net/post/south-asia/252554/afghan-refugees-minister-killed-by-suicide-blast
Failed to fetch title,Content not available,https://www.newagebd.net/post/football/252553/maresca-to-lean-on-chelsea-squad-depth-for-trip-to-kazakhstan
Failed to fetch title,Content not available,https://www.newagebd.net/post/cricket/252552/miller-and-linde-take-south-africa-to-win-over-pakistan
Failed to fetch title,Content not available,https://www.newagebd.net/post/mis/252551/adb-approves-$600m-loan-for-structural-reforms-in-bangladesh
Ancelotti hoping for top eight push after Atalanta win,"Carlo Ancelotti hopes that Real Madrid's win over Atalanta will help his team push for a top eight finish in the Champions League and direct passage for the last 16. Reigning European champions Madrid came through a tough battle in Bergamo to beat Serie A leaders Atalanta 3-2 with goals from Kylian Mbappe, Vinicius Junior and Jude Bellingham and get their title defence back on track. Madrid are now three points from the top eight positions with matches against Salzburg and Brest remaining in their league phase campaign and the rest of this week's fixtures coming up on Wednesday. ‘I don't know if we can get into top eight, but the goal is obvious, we need to win both the matches that we have left,’ Ancelotti told reporters. ‘This win will give us a lot, it's a great win because it was based on quality play and hard work. It's given us some breathing room... Let's hope we have more players available (in January), but we're more relaxed about it after today, absolutely.’ Atalanta coach Gian Piero Gasperini was so proud of his team's performance he wasn't even too upset by Mateo Retegui blazing over a golden chance to equalise in added time. Italy forward Retegui somehow missed the target from inches out when making contact with Ademola Lookman's fizzing low cross and looked ashen faced once he realise the opportunity he had passed up. Defeat dropped Atalanta, who scored through Lookman and Charles De Ketelaere, down to ninth on 11 points with matches against Sturm Graz and Barcelona completing their league phase. ‘It happened so fast... a draw would have possibly better reflected the balance of play but maybe, losing like we did will hurt us more and force us to improve,’ said Gasperini. ‘The defeat had nothing to do with luck or anything like that and that means that we still need to tweak a few things to get to their level.’",https://www.newagebd.net/post/football/252550/ancelotti-hoping-for-top-eight-push-after-atalanta-win
"Salah keeps Liverpool perfect, Real down Atalanta","Mohamed Salah helped maintain Liverpool's perfect record in the Champions League on Tuesday while holders Real Madrid bounced back from their defeat at Anfield to topple in-form Italians Atalanta. Elsewhere, struggling Paris Saint-Germain gained a vital win at Salzburg, while Bayer Leverkusen edged Inter Milan to move second. Aston Villa, in their first appearance in the continent's elite club competition for 41 years, maintained their bright progress beating Leipzig 3-2 to sit third. The first eight teams qualify directly for the last 16 with those placed ninth to 24 entering a play-off round. In Spain, Salah's 63rd-minute penalty proved decisive against dogged debutants Girona to extend the Premier League leaders' record to six from six in the revamped format of Europe's flagship club competition. Under new coach Arne Slot Liverpool are virtually assured a place in the last 16. ‘If you ask me about all six games, I'm really pleased with all the results... (but) I'm far from pleased about the performance tonight,’ Slot told reporters in Girona. ‘(We had) hardly any control at all over the game, maybe the second half was a bit better but then I'm trying to be positive.’ Salah sent Paulo Gazzaniga the wrong way to net his 50th Champions League goal, pulling the Egyptian level with Filippo Inzaghi as the 10th highest goalscorer of all-time in the competition. The winger is out of contract at the end of the season but his 16 goals across all competitions have been essential in Liverpool's superb first half of the season. While Liverpool are sitting pretty with two league phase rounds to come early next year, kings of Europe Real Madrid, beaten 2-0 by Liverpool last time out, have work to do to ensure their progress into the knockout phase. Kylian Mbappe gave Real a 10th minute lead before hobbling off injured in Atalanta, his strike was cancelled out by Charles de Ketelaere's penalty in first-half additional time. Real coach Carlo Ancelotti started Vinicius Junior for the first time since a hamstring problem last month. The Brazilian had Real back on top before the hour, with Jude Bellingham also on the scoresheet for a 3-2 win over the Serie a leaders. The hard-fought victory moved Real up to 18th on nine points and will have helped to settle any nerves at the 15-time European champions ahead of games against Salzburg and Brest in January. PSG put the wheels back on their stuttering campaign with a much needed 3-0 defeat on the road at Salzburg. The French champions went into this encounter in 25th with just four points and three goals scored after five matches. They approach their last two league outings in provisional 24th - the final berth for the play-offs ahead of Wednesday's games. Bayern swept aside Ukraine side Shakhtar Donetsk in Gelsenkirchen 5-1. Fellow Bundesliga giants Leverkusen became the first team to score against Inter in this year's competition in a 1-0 win that lifted them five points adrift of Liverpool at the top of the league. Another noteworthy performance on matchday six came on the Brittany coast where modest French Ligue 1 outfit Brest dished out a 1-0 defeat to former European champions PSV Eindhoven. It left the Atlantic port city club flying high in fifth in their first ever appearance at European football's high table. In other games, Celtic and Dinamo Zagreb remained in contention for the knockout round after an uninspiring 0-0 draw and Club Brugge beat Sporting 2-1. Headline matches on Wednesday include Manchester city at Juventus, and Barcelona at Borussia Dortmund.",https://www.newagebd.net/post/football/252549/salah-keeps-liverpool-perfect-real-down-atalanta-
Failed to fetch title,Content not available,https://www.newagebd.net/post/cricket/252548/bangladesh-suffer-odi-series-loss-to-west-indies-
