title,content,link
Khamenei says Assad’s fall will not weaken Iran,"Iran’s supreme leader Ayatollah Ali Khamenei said on Wednesday the weakening of the anti-Israel ‘resistance’ after the ouster of Bashar al-Assad in Syria would not diminish Tehran’s power. Some, ‘unaware of the meaning of resistance, imagine that when the resistance becomes weak, Islamic Iran will also become weak Iran is strong and powerful and will become even more powerful,’ Khamenei said in his first speech after Assad’s fall. Syrian rebels’ lightning push to Damascus from their strongholds in the northwest ended the decades-long rule of Assad’s family, once an ally of Tehran. Assad had long played a strategic role in Iran’s anti-Israel ‘axis of resistance’, particularly in facilitating the supply of weapons to Tehran’s ally Hezbollah in neighbouring Lebanon. The axis of resistance includes Hezbollah, as well as Hamas in Gaza, Huthi rebels in Yemen and smaller Shia militia groups in Iraq. All of the groups are united in their opposition to Israel and its main backer the United States. The Iranian supreme leader, who has the final say in his country’s affairs, accused the United States and ‘the Zionist regime’, Israel, of plotting against Assad. ‘No one should doubt that what has taken place in Syria is the product of a joint US-Israeli plot,’ he said. He also blamed another ‘neighbouring state of Syria’ for its ‘obvious role’ in the recent developments, without naming the country. Iraq, Israel, Jordan, Lebanon and Turkey all share borders with Syria. Of those neighbours, Turkey has long supported the ouster of Assad. According to Khamenei, different ‘invaders’ in Syria were pursuing different aims. ‘Their goals are different, some of them are seeking to seize the lands of northern or southern Syria, America is seeking to strengthen its position in the region,’ he said. Turkey has forces in northern Syria, while in the south the Israeli army has sent troops into a UN-patrolled buffer zone on the countries’ shared border east of the Israeli-annexed Golan Heights. The US also has troops based in Syria, where they have worked with Kurdish-led fighters battling the Islamic State group.",https://www.newagebd.net/post/middle-east/252574/khamenei-says-assads-fall-will-not-weaken-iran
Allegations of judicial corruption often reach me unexpectedly: Justice Syed Md Ziaul Karim,"Outgoing Appellate Division judge Justice Syed Md Ziaul Karim, in his farewell speech on Wednesday, addressed claims of corruption within the judiciary, noting that such allegations often reach him unexpectedly. He urged unity across all levels of the judiciary, from lower court officials to senior judges, to safeguard the integrity of the justice system. ‘Judicial management cannot succeed through individual efforts alone,’ Justice Ziaul remarked, stressing the need for collective responsibility. He underscored the pivotal role of the chief justice, describing the position as the judiciary’s guardian, responsible for issuing clear directives, rewarding capable judges, and offering reprimands when necessary. Justice Ziaul highlighted the importance of judicial independence, stating that judges must be free to express their thoughts and deliver judgments without external interference. He called for support from individuals and groups involved in court welfare activities to resist challenges to judicial autonomy. ‘The judicial system risks collapse if the moral failings of a few judges are not addressed,’ he warned. ‘Unity within the judiciary is crucial to overcoming these challenges.’ Justice Ziaul emphasised the necessity of implementing High Court inspection reports and recommendations made under Article 109 of the constitution. He argued that these measures would enhance transparency and accountability in the administrative and judicial processes of lower courts. He also praised chief justice Syed Refaat Ahmed’s proactive supervision, which he said had been instrumental in addressing the challenges faced by lower courts and their judges. Chief justice Syed Refaat Ahmed, who leads the six-member Appellate Division, shared his experiences of working alongside Justice Syed Md Ziaul Karim in both the High Court and the Appellate Division. Speaking during the farewell event, attorney general Md Asaduzzaman and Supreme Court Bar Association president AM Mahbub Uddin Khokon lauded Justice Ziaul Karim’s contributions, highlighting his 20 years as a judge and 18 years as an advocate.",https://www.newagebd.net/post/country/252573/allegations-of-judicial-corruption-often-reach-me-unexpectedly-justice-syed-md-ziaul-karim
"Khaleda, Tarique invited to president’s reception programme on Victory Day","Bangladesh Nationalist Party chairperson Begum Khaleda Zia and the party’s acting chairperson Tarique Rahman were invited to attend a reception programme hosted by Bangladesh president Mohammed Shahabuddin at Bangabhaban on the occasion of the country’s 54th Victory Day. The invitation letter was delivered by the President’s Military secretary Major General Mohammad Adil Chowdhury to the BNP chairperson’s political office in Gulshan on Wednesday. The BNP standing committee member AZM Zahid Hossain accepted the invitation letter on behalf of BNP chairperson Khaleda Zia and acting chairperson Tarique Rahman. Earlier, the BNP chairperson Khaleda Zia made her first appearance at the Armed Forces Day reception at Senakunja in Dhaka Cantonment after 12 years on November 21.",https://www.newagebd.net/post/country/252572/khaleda-tarique-invited-to-presidents-reception-programme-on-victory-day
Macron races to choose new PM,"French president Emmanuel Macron raced Wednesday to meet a self-imposed 48-hour deadline to name a new prime minister after he hosted party bosses in a bid to hammer out a consensus and avoid a protracted political crisis. Following the ouster of the government of Michel Barnier in a historic no-confidence vote last week, Macron on Tuesday gathered leaders from across the political spectrum in a bid to form a ‘government of national interest’. The bosses of the far-right National Rally and hard-left France Unbowed, who joined forces to oust Barnier, were not invited. Macron, who is set to travel to Poland on Thursday, aimed to name a new prime minister ‘within 48 hours’, said the party chiefs who had met him Tuesday. Several people close to the president said the announcement could come as early as Wednesday evening. Last week far-right and hard-left lawmakers joined forces to oust the minority government of Barnier following a standoff over an austerity budget. Macron is now under huge pressure to form a government that can survive a no-confidence vote and pass a budget for next year in a bid to limit political and economic turmoil. The French leader dissolved parliament in June after the far right trounced his alliance in European elections and called snap parliamentary polls that resulted in a hung parliament. He told party leaders on Tuesday that he did not want to dissolve the National Assembly lower house again before the end of his second and final term in 2027, a person close to him said. Barnier, prime minister for only three months, remains in charge on a caretaker basis until a new government is appointed. On Wednesday, the cabinet were due to discuss a special budget law to allow the French state to keep functioning in the new year. The National Assembly will debate the bill on Monday, a parliamentary source said, with most parties saying they will back it in the name of stability. Some commentators said that bringing together so many parties marked progress from Macron’s new attempt to reach consensus after the snap election, but progress still appeared elusive. Greens leader Marine Tondelier said on Tuesday the presidential camp was not ready for any ‘compromise or concession’, but Macron had stressed the need ‘to no longer rely on the RN to govern’. Her party is part of the left-wing New Popular Front, which emerged as the largest bloc in the National Assembly after the summer elections. Macron has hoped to prise the Socialists, Greens and Communists away from their pact with the LFI but their bosses insist a new prime minister should be named from their ranks. On Wednesday morning, Socialist Party leader Olivier Faure spoke out against the candidacy of Macron’s centrist ally Francois Bayrou tipped as a possible contender for prime minister. Faure told broadcaster BFMTV/RMC that Bayrou, 73, would embody a ‘continuity’, whereas he wanted to see a prime minister ‘from the left’. He refused to say whether the Socialists would censure a government led by the centrist. Far-right leader Marine Le Pen, who emerged as kingmaker after the elections, said she relished being awarded the ‘medal of the opposition’ while mainstream parties held ‘a banquet to share out jobs’ in government. An Ifop-Fiducial poll for Le Figaro Magazine and Sud Radio published on Wednesday indicated that Le Pen would win between 36 percent and 38 percent of the vote in the first round of the French presidential election. The poll, carried out after Barnier’s ouster, suggested Le Pen would obtain 36 per cent of the vote against centre-right former premier Edouard Philippe (25 per cent) and 38 per cent against Barnier’s predecessor Gabriel Attal (20 per cent). Some observers have suggested that Le Pen, 56, is seeking to bring down Macron before his term ends by joining forces with the hard left and ousting Barnier. ‘Macron hopes to replace the informal deal with Le Pen’s far right which initially sustained the short-lived Barnier government with a more formal deal with the moderate left and independents,’ risk consultancy Eurasia Group said.",https://www.newagebd.net/post/europe/252571/macron-races-to-choose-new-pm
Failed to fetch title,Content not available,https://www.newagebd.net/post/opinion/252570/syria-now
In need of a permanent education commission,"EDUCATION is the cornerstone of national development, serving as a foundation for cultivating informed societies, robust economies, and accountable governance systems. In Bangladesh, despite significant progress, the education sector faces persistent challenges that threaten the country’s trajectory toward sustainable growth. Issues such as outdated curricula, disparities in quality and access, inadequate teacher training, and inefficient policy implementation hinder the ability of the education system to meet the demands of a dynamic, globally connected world. Moreover, the sector struggles to adapt to modern challenges, including digital transformation, climate change, and evolving labour market needs. To confront these multifaceted challenges effectively, the establishment of a permanent education commission emerges as a transformative necessity. Envisioned in the National Education Policy 2010, this commission is designed to provide a long-term, institutionalised mechanism for addressing systemic educational issues. Its mandate would extend beyond short-term fixes, ensuring continuity and coherence in policy implementation across successive governments. A permanent body would enable consistent monitoring and evaluation of reforms, promoting evidence-based decision-making and reducing the frequent disruptions caused by political transitions.  Challenges in education landscape BANGLADESH’S education sector has achieved remarkable progress in increasing enrolment rates and gender parity in primary and secondary education. However, systemic challenges remain: Policy discontinuity: Political transitions often disrupt educational reforms, undermining the long-term impact of policies. For instance, ambitious reforms proposed by one administration may be discarded or deprioritised by the next. Curriculum gaps: The education system struggles to balance traditional learning with skills that align with the demands of the 21st century, such as critical thinking, problem solving, and technological literacy. Equity issues: Stark disparities persist between urban and rural education outcomes, with marginalised communities often receiving substandard education. Teacher quality and training: While enrolment has surged, the capacity and quality of teaching staff have not kept pace, compromising learning outcomes. Fragmented governance: Education administration is divided across multiple entities, including two separate ministries, leading to inefficiencies and a lack of cohesive strategy.  National Education Policy 2010 THE National Education Policy 2010, a landmark document in Bangladesh’s education history, explicitly recommended the establishment of a permanent education commission. It recognised that sustainable educational progress requires an institutionalised mechanism to: ensure consistency in policy implementation across successive governments; provide regular assessments and revisions of curricula based on evidence and emerging trends; address regional and socio-economic disparities in education; and, monitor and evaluate the performance of education programs systematically. Despite this visionary proposal, the absence of such a commission has left the education system vulnerable to ad-hoc decision-making and reactive measures.  Benefits of permanent commission A PERMANENT education commission would serve as an independent, non-partisan body, tasked with overseeing and guiding the education sector. Its core responsibilities could include: Policy formulation and review: The commission could work as a repository of expertise, continuously updating education policies to reflect global best practices while aligning with national priorities. This would reduce the disruptions caused by political changes. Monitoring and evaluation: By establishing robust mechanisms for data collection and analysis, the commission could provide actionable insights into the effectiveness of existing programs, identifying gaps and recommending timely interventions. Curriculum development: The commission could ensure that the curriculum is dynamic, inclusive, and responsive to the evolving needs of society and the job market, particularly in integrating technology and fostering creativity. Equity and inclusion: A dedicated focus on bridging disparities would enable the commission to champion inclusive education, addressing the needs of underserved communities, including women and girls, ethnic and language minorities, and persons with disabilities. Coordination among stakeholders: By acting as a central coordinating body, the commission could harmonise efforts among the ministry of education, development partners, private sector actors, and civil society organisations. Teacher training and development: The commission could play a critical role in standardising and enhancing teacher training programs, ensuring educators are equipped with modern pedagogical skills.  Global examples of permanent commissions SEVERAL countries have successfully institutionalised similar bodies, offering valuable lessons for Bangladesh: In India, the National Council of Educational Research and Training serves as a premier institution for educational planning and research, providing a model of structured governance in education. It contributes to policy development, curriculum design, and teacher training while ensuring alignment with national goals and global best practices. NCERT’s role in updating textbooks, introducing competency-based assessments, and fostering innovation in pedagogy highlights its ability to sustain progress across decades. In the South Korea, the National Education Commission of South Korea is a cornerstone of its transformation into a global leader in education. It ensures continuity in policy implementation and upholds rigorous standards of education. By focusing on technology integration, teacher quality, and research-backed policy-making, South Korea has sustained stellar outcomes in literacy, innovation, and workforce readiness, making it a beacon for developing nations. Celebrated for its world-class education system, Finland benefits from research-driven advisory bodies that emphasise evidence-based policy-making and teacher empowerment. These entities have been pivotal in maintaining Finland’s commitment to equity and excellence by ensuring that education policies are grounded in both research and practice. The emphasis on lifelong learning and localised curriculum development further bolsters its success. These examples demonstrate that a dedicated commission can drive significant improvements by providing a stable, long-term vision for education.  Recommendations for commission TO ENSURE its success, the proposed permanent education commission in Bangladesh must: Independent and non-political: The commission should operate autonomously, free from political influence, to ensure objectivity and impartiality in its recommendations. Include diverse stakeholders: Membership should represent academia, practitioners, policymakers, private sector experts, and civil society, fostering a holistic approach to education reform. Leverage technology: The commission must integrate cutting-edge technology to address challenges such as teacher shortages, resource limitations, and remote learning needs. Focus on lifelong learning: Beyond traditional schooling, the commission should emphasise vocational training, adult education, and reskilling initiatives to prepare the workforce for future challenges. Accountability: Clear benchmarks and reporting mechanisms should be established to track progress and ensure transparency in operations.  Conclusion BANGLADESH’S education system sits at a critical juncture, offering immense potential to serve as a driving force for socio-economic transformation. However, persistent structural and operational challenges — ranging from outdated curricula to inequitable access — threaten to undermine this potential. The establishment of a permanent education commission, as envisioned in the National Education Policy 2010, is no longer a recommendation that can wait — it is an urgent necessity. A permanent education commission would represent a transformative leap for Bangladesh by institutionalizing a forward-looking, independent body solely dedicated to education reform. This commission would address systemic challenges with a cohesive, evidence-based approach, ensuring that education policies are aligned with the nation’s long-term aspirations and the demands of a rapidly evolving global landscape. It would act as a custodian of educational integrity, providing consistent oversight, strategic guidance, and adaptability to emerging trends, such as digital transformation and the integration of 21st-century skills. Such a commission would also act as a bridge between national aspirations and global trends. By aligning the education system with international best practices, it could facilitate the integration of modern pedagogical techniques, digital tools, and skills development aligned with the demands of the Fourth Industrial Revolution. Furthermore, its focus on equity could help address regional and socioeconomic disparities, ensuring that no student is left behind. In this way, a Permanent Education Commission would not only uphold the recommendations of the National Education Policy 2010 but also serve as a catalyst for the comprehensive transformation of Bangladesh’s education sector.  Musharraf Tansen is a development analyst and former country representative of Malala Fund.",https://www.newagebd.net/post/opinion/252569/in-need-of-a-permanent-education-commission
