title,content,link
French internet firm fined 50m euros for unsolicited ads,"France’s largest internet operator Orange was on Tuesday slapped with a 50-million-euro ($53-million) fine for sending unsolicited adverts resembling emails to customers. Orange is the successor to France’s monopoly telephone operator and remains the leading telecommunications firm, with a popular email service. ‘Internet access and email service provider Orange used its email service to introduce advertisements’ that resembled emails in customers’ message feeds, said Louis Dutheillet de Lamothe, deputy head of France’s privacy watchdog CNIL. Advertisers in France are required to obtain permission before sending material to a person’s email address, and CNIL considered Orange’s actions were equivalent to that even if users’ addresses were not used to display the ads between their emails.",https://www.newagebd.net/post/mis/252493/french-internet-firm-fined-50m-euros-for-unsolicited-ads
Israeli strikes kill 25 in Gaza,"Gaza’s civil defence agency said Tuesday that Israeli strikes in the north of the Palestinian territory had killed 25 people, including women and children. ‘At 8:00pm(1800 GMT) last night, Israeli strikes targeted a multi-story building belonging to the Al-Kahlut family, killing 25 people. Sixteen bodies have been identified, while others remain trapped under the rubble,’ civil defence spokesman Mahmud Bassal said, adding five women and five children were among the dead. The Israeli army did not comment on the strike. Bassal said ‘residents, without adequate support, are attempting to rescue those still buried’. The north of the Gaza Strip has been the focus of an intense Israeli military operation for more than two months, which the army says is intended to prevent Hamas militants from regrouping there. Meanwhile, Israeli prime minister Benjamin Netanyahu said Monday he would not stop the war in Gaza ‘now’, with renewed efforts towards a ceasefire underway. Speaking at a press conference in Jerusalem 14 months into the war against Hamas Palestinian militants, he said ‘if we end the war now, Hamas will return, recover, rebuild and attack us again — and that is what we do not want to go back to’. Netanyahu reiterated that he had set the goal of ‘the annihilation of Hamas, the elimination of its military and administrative capabilities’ to prevent future attacks but said that the objective was not yet complete. US secretary of state Antony Blinken said on October 23 that Israel had ‘managed to dismantle Hamas’s military capacity’ and eliminated its senior leadership. With those successes, he said, it was time to ‘get the hostages home and bring the war to an end with an understanding of what will follow.’ In recent days, there had been signs that months of failed ceasefire and hostage release negotiations might be revived and achieve a breakthrough. Qatar, a main mediator, said on Saturday there was new ‘momentum’ for negotiations created by the election of Donald Trump in the United States. The war in Gaza was sparked by Hamas’s October 7, 2023 attack on Israel, which resulted in the deaths of 1,208 people, mostly civilians, according to an AFP tally based on official data. Israel’s retaliatory offensive in Gaza has killed at least 44,758 people, mostly civilians, according to data from the Hamas-run health ministry that is considered reliable by the UN. A source close to the Hamas delegation said at the same time that Turkey as well as Egypt and Qatar had been ‘making commendable efforts to stop the war,’ and a new round of talks could begin soon. On Sunday, the prime minister met with the families of hostages held in Gaza and said that Israel’s wars on Hezbollah and Hamas would facilitate negotiations for their release. Protesters, including relatives of the hostages, have repeatedly called for a deal to free the captives and accused him of prolonging the war. The war in Gaza was sparked by Hamas’s  October 7, 2023 attack which resulted in the deaths of 1,208 people, mostly civilians, according to an AFP tally based on official data. During the attack, militants also kidnapped 251 hostages, 96 of whom remain in Gaza, including 34 who the military says are dead. Israel’s retaliatory offensive in Gaza has killed at least 44,758 people, mostly civilians, according to data from the Hamas-run health ministry that is considered reliable by the UN.",https://www.newagebd.net/post/middle-east/252492/israeli-strikes-kill-25-in-gaza
77 Nobel laureates sign letter opposing RFK Jr. as Trump’s health secretary,"Seventy-seven Nobel prize winners on Monday sent an open letter to the US Senate opposing the nomination of Robert F Kennedy Jr., president-elect Donald Trump’s choice for secretary of health and human services, citing his ‘lack of credentials’ and anti-vaccine beliefs. ‘In view of his record, placing Kennedy in charge of DHHS would put the public’s health in jeopardy,’ concludes the letter signed by 77 Nobel recipients in medicine, chemistry, physics and economics. Among the signatories is Drew Weissman, who received the 2023 Nobel Prize in Medicine for his work on developing mRNA vaccines, which was a major breakthrough in the fight against Covid-19. Kennedy, a nephew of assassinated US president John F Kennedy Jr, made his own White House run earlier this year before throwing his support behind Trump. In return, Trump has tapped him to oversee the part of the executive branch in charge of health and medicine — though his selection must be approved by a majority of the US Senate, as outlined by the Constitution. An environmental lawyer by trade with no medical background, Kennedy has spent years professing conspiracy theories linking vaccines and autism, and most recently spread misinformation about Covid-19 vaccines. He has said if he is confirmed for the position he will work to remove fluoride from tap water in the US, despite its addition being considered a major victory against bacteria causing tooth decay. ‘In addition to his lack of credentials or relevant experience in medicine, science, public health, or administration,’ the letter reads, ‘Mr. Kennedy has been an opponent of many health-protecting and life-saving vaccines, such as those that prevent measles and polio.’ ‘We strongly urge you to vote against the confirmation of his appointment,’ the letter said. Kennedy is far from the only Trump cabinet nominee to stir controversy. Among the most notable is Pete Hegseth, a Fox News anchor tapped to lead the Department of Defence, who has seen his nomination derailed with sexual assault allegations and rumours of excessive drinking. And Trump’s first pick for Attorney General, former US Congressman Matt Gaetz, withdrew after further scrutiny emerged of alleged sexual relations he had with a minor.",https://www.newagebd.net/post/north-america/252491/77-nobel-laureates-sign-letter-opposing-rfk-jr.-as-trumps-health-secretary
Taiwan says China carrying out huge maritime deployment,"China is deploying dozens of ships in its biggest maritime mobilisation around Taiwan in years, Taipei said Tuesday, after Beijing voiced fury at President Lai Ching-te’s recent visit to the United States. Taiwanese forces were on high alert in anticipation of Beijing’s People’s Liberation Army staging war games in response to Lai’s US stopovers and call with Republican House speaker Mike Johnson. Taiwan’s defence ministry said the number of Chinese ships in the waters around the island exceeded Beijing’s maritime response to then US House speaker Nancy Pelosi’s visit to Taipei in 2022, which was the largest-ever war games. In those drills, Beijing deployed ballistic missiles, fighter jets and warships in what analysts described as practice for a blockade and ultimate invasion of Taiwan — and was a display of how far China’s military had come since the last Taiwan Strait crisis in the mid-1990s. Nearly 90 Chinese naval and coast guard ships were currently in waters along the so-called first island chain, which links Okinawa, Taiwan and the Philippines, a senior Taiwanese security official said. Taiwan’s defence ministry said earlier it had also detected 47 Chinese aircraft near the island in the 24 hours to 6:00am (2200 GMT). That was the highest number of aircraft detected in a single day since a record 153 reported on October 15, after China staged major military drills in response to Lai’s National Day speech days earlier. China — which regards Taiwan as its territory and has not ruled out using force to bring it under its control — has held four large-scale military exercises in just over two years, including the drills in response to Pelosi’s visit and two since Lai took office in May. ‘It can indeed be said that the scale of these maritime forces exceeds the four drills since 2022,’ defence ministry spokesman Sun Li-fang told reporters. Sun said the latest exercises drew forces from three separate Chinese regional commands, while another defence ministry official said China’s actions were ‘not solely directed at Taiwan’. There has been no public announcement by the PLA or Chinese state media about increased military activity in the East China Sea, Taiwan Strait, South China Sea or Western Pacific Ocean, where Taiwan said Chinese ships had been detected. However, a Beijing foreign ministry spokeswoman said Tuesday that China will ‘resolutely defend’ its sovereignty. The lack of an announcement from Beijing was unusual and, if drills were under way, could be a ‘deliberate strategy to sow confusion and exert psychological pressure,’ Duan Dang, a Vietnam-based maritime security analyst, said. ‘China’s current movements resemble what we would see during preparations for real combat, exceeding the scale of previous exercises,’ he added. Taipei-based security analyst J Michael Cole said the mix of PLA navy vessels and coast guard ships highlighted Beijing’s efforts to ‘increase interoperability’ between the two. ‘Such efforts also blur the lines between civilian and military components and thus complicate Taiwan’s ability to respond proportionally,’ Cole said. Beijing has asserted its claims over contested territories in the region far more boldly in recent years, as its military strength has grown. The escalating actions — over islands in the East China Sea claimed by Japan, self-ruled Taiwan, and reefs and islands in the South China Sea that are also claimed by Southeast Asian nations — have come as Beijing’s rivals have drawn closer to the United States. US defence secretary Lloyd Austin said Monday that China was the ‘only country in the world that has the intent and, increasingly, the capability to change the rules-based international order.’ ‘We want to see this region, this area remain open to freedom of navigation and the ability to fly the skies and international airways whenever we want to,’ Austin said in a speech aboard the USS George Washington, an aircraft carrier stationed in Japan. ‘We’re going to continue to work with our allies and partners to ensure that we can do just that.’ The United States is Taiwan’s most important backer and biggest supplier of arms, but has long maintained ‘strategic ambiguity’ when it comes to putting boots on the ground to defend the island. Lai said Friday he was ‘confident’ of deeper cooperation with the next Donald Trump administration, a day after he spoke with US Republican House Speaker Mike Johnson that angered China. China’s foreign ministry warned Taiwan on Friday that ‘seeking independence with the help of the United States will inevitably hit a wall’, and called on Washington to ‘cease meddling in Taiwan-related affairs’. The dispute between Taiwan and China goes back to 1949 when Chiang Kai-shek’s nationalist forces were defeated by Mao Zedong’s communist fighters and fled to the island.",https://www.newagebd.net/post/asia/252490/taiwan-says-china-carrying-out-huge-maritime-deployment
Four police officers temporarily suspended,"Four police officers, including former Deputy Commissioner (Mirpur Division) of Dhaka Metropolitan Police (DMP), Md Jasim Uddin Molla, were temporarily suspended on Tuesday. The other suspended officers are: Additional Deputy Commissioner (Gulshan Division) of DMP Md. Rafiqul Islam, Assistant Commissioner (Traffic-Jatrabari Zone) of DMP Tanjil Ahmed, and Assistant Superintendent of Police (ASP) of APBN, Md. Rafiqul Islam. The suspension orders were issued by the Police-1 section of the Public Security Division under the Home Ministry on Tuesday. Separate notifications have already been issued, signed by Senior Secretary Dr Mohammad Abdul Momen on the order of the President. According to the notification, former DC of DMP and currently attached to the Rangpur Range DIG office Md. Jasim Uddin Mollah has been charged with crimes under the International Crimes Tribunal Act and an arrest warrant has been issued. He was arrested from Rangpur on October 30. Accordingly, Md. Jasim has been suspended from government service with effect from October 30 under the provisions of Section 39(2) of the Government Services Act, 2018 (Act No. 57 of 2018). During the period of suspension, he will be entitled to subsistence allowance as per the rules. Former ADC (Gulshan Division) Md. Rafiqul Islam's notification said that he was arrested on October 18 in a case filed by Badda Police Station and sent to court. Rafiqul has been temporarily suspended from government service from October 18 as per the provisions of Section 39(2) of the Government Services Act, 2018 (Act No. 57 of 2018). During the temporary suspension, Rafiqul will be attached to the office of the Chattogram Range DIG and will receive allowance as per the rules. The notification of AC (Traffic-Jatrabari Zone)Tanjil Ahmed said that he was arrested on October 15 in a case filed with Jatrabari Police Station and sent to court. Therefore, Tanjil Ahmed has been temporarily suspended from government service from October 15 as per the provisions of Section 39(2) of the Government Services Act, 2018 (Act No. 57 of 2018), the notification said. During the period of his temporary suspension, Tanjil will be attached to the office of the Barisal Range DIG and will be entitled to get allowance as per the rules. Another notification on ASP of APBN Md. Rafiqul Islam said that he was arrested on September 13 in a case filed with Hathazari Model Police Station of Chattogram and sent to court. Rafiqul has been temporarily suspended from government service from September 13 as per the provisions of Section 39 (2) of the Government Services Act, 2018 (Act No. 57 of 2018). During the period of temporary suspension, Rafiqul Islam will be attached to the office of Mymensingh Range DIG and will be entitled to get allowance as per the rules.",https://www.newagebd.net/post/country/252489/four-police-officers-temporarily-suspended
Kenyan police teargas anti-femicide march,"Kenyan police tear-gassed a peaceful march against femicide in the capital Nairobi on Tuesday, detaining a number of protesters, according to AFP reporters and rights groups. There was a strong police presence in Nairobi ahead of the march — just one of many planned across the East African country, where violence against women has been a long-running issue. Officers fired tear gas against an initially small group of young women in Nairobi’s Central Business District, AFP journalists saw. The area saw some of the worst police violence during anti-government demonstrations earlier this year. Heavily equipped officers — both uniformed and plain-clothed — also made multiple arrests in the CBD, according to rights groups. AFP witnessed at least one young woman being bundled screaming into the back of a police vehicle. ‘The government is part of the problem,’ said protester Koneli, 38, who declined to give her second name. ‘There is no reason why you should send armed police against people with placards,’ she said. The rally gathered pace in the afternoon as several hundred women marched to parliament, booing and chanting: ‘Shame on you!’ and ‘teach your sons’. The march was repeatedly dispersed by tear gas, with one 22-year-old woman also telling AFP that officers appeared to be targeting women wearing t-shirts with anti-femicide slogans for arrest. ‘How am I going to trust my government to end this if we have barely just got here and we are being tear-gassed already?’ said demonstrator Zeitan, 38. ‘We are not violent we are here to fight for women’s rights,’ protester Akinyi said, shortly before she was tear-gassed. The march follows calls from rights bodies for action over femicide in the country, with the Kenyan National Commission for Human Rights saying in November that 97 women had been murdered in the past three months. President William Ruto addressed parliament on the reports, labelling gender-based violence ‘tragic and unacceptable’ and urging society to address the issue. Amnesty International and the Law Society of Kenya released a joint statement condemning the police actions on Tuesday, saying it sent a ‘chilling message’ to peaceful protesters. ‘The violent response by police, including the arrest of these peaceful protesters, is a direct attack on Kenya’s democratic principles and the human rights of its citizens,’ it said. Kenyan police have previously come under international scrutiny over their tough approach to demonstrations. Peaceful anti-government rallies earlier this year spiralled into violence, leaving at least 60 dead, according to rights groups.",https://www.newagebd.net/post/africa/252488/kenyan-police-teargas-anti-femicide-march
European countries suspend Syrian asylum decisions after Assad’s fall,"Britain, Germany, France, Italy and several other European countries said ON Monday they would freeze all pending asylum requests from Syrians, a day after the ouster of president Bashar al-Assad. While Berlin and other governments said they were watching the fast-moving developments in the war-ravaged nation, Austria signalled it would soon deport refugees back to Syria. Far-right politicians elsewhere made similar demands, including in Germany — home to Europe’s largest Syrian community — at a time when immigration has become a hot-button issue across the continent. Alice Weidel, of the anti-immigration Alternative for Germany, reacted with disdain to Sunday’s mass rallies by jubilant Syrians celebrating Assad’s downfall. ‘Anyone in Germany who celebrates ‘free Syria’ evidently no longer has any reason to flee,’ she wrote on X. ‘They should return to Syria immediately.’ World leaders and Syrians abroad watched in disbelief at the weekend as Islamist-led rebels swept into Damascus, ending Assad’s brutal rule while also sparking new uncertainty. A German foreign ministry spokesman pointed out that ‘the fact that the Assad regime has been ended is unfortunately no guarantee of peaceful developments’ in the future. Germany has taken in almost one million Syrians, with most arriving in 2015-16 under ex-chancellor Angela Merkel. Interior minister Nancy Faeser said many Syrian refugees ‘now finally have hope of returning to their Syrian homeland’ but cautioned that ‘the situation in Syria is currently very unclear’. The Federal Office for Migration and Refugees had imposed a freeze on decisions for ongoing asylum procedures ‘until the situation is clearer’. She added that ‘concrete possibilities of return cannot yet be predicted and it would be unprofessional to speculate in such a volatile situation’. Rights group Amnesty International slammed Germany’s freeze on asylum decisions, stressing that for now ‘the human rights situation in the country is completely unclear’. The head of the UN refugee agency also cautioned that ‘patience and vigilance’ were needed on the issue of refugee returns. In Austria, where about 1,00,000 Syrians live, conservative chancellor Karl Nehammer instructed the interior ministry ‘to suspend all on-going Syrian asylum applications and to review all asylum grants’. Interior minister Gerhard Karner added he had ‘instructed the ministry to prepare an orderly repatriation and deportation programme to Syria’. ‘The political situation in Syria has changed fundamentally and, above all, rapidly in recent days,’ the ministry said, adding it is ‘currently monitoring and analysing the new situation’. The French interior ministry said it too would put asylum requests from Syrians on hold, with authorities in Belgium, the Netherlands, Switzerland, Denmark, Sweden and Norway announcing similar moves. Britain’s interior ministry said it was taking the same measure ‘whilst we assess the current situation’. The Italian government said late Monday after a cabinet meeting that it too was suspending asylum request ‘in line with other European partners.’ The leader of the far-right Sweden Democrats, a coalition partner in the government, said residence permits for Syrian refugees should now be ‘reviewed’. ‘Destructive Islamist forces are behind the change of power’ in Syria, wrote their leader Jimmie Akesson on X. ‘I see that groups are happy about this development here in Sweden. You should see it as a good opportunity to go home.’ In Greece, a government spokesman voiced hope that Assad’s fall will eventually allow ‘the safe return of Syrian refugees’ to their country, but without announcing concrete measures. In Germany, the debate gained momentum as the country heads towards February elections. Achim Brotel, president of a grouping of German communes, called for border controls to stop fleeing Assad loyalists reaching Germany. The centre-right opposition CDU suggested that rejected Syrian asylum-seekers should now lose so-called subsidiary protection. ‘If the reason for protection no longer applies, then refugees will have to return to their home country,’ CDU legislator Thorsten Frei told Welt TV. CDU MP Jens Spahn suggested that Berlin charter flights to Syria and offer 1,000 euros ($1,057) to ‘anyone who wants to return’. A member of chancellor Olaf Scholz’s Social Democrats criticised the debate as ‘populist and irresponsible’. Greens party deputy Anton Hofreiter also said ‘it is completely unclear what will happen next in Syria’ and deportation talk was ‘completely out of place’. Many Syrians in Germany have watched the events in their home country with great joy but prefer to wait and see before deciding whether to return. ‘We want to go back to Syria,’ said Mahmoud Zaml, 25, who works in an Arabic pastry shop in Berlin, adding that he hopes to help ‘rebuild’ his country. ‘But we have to wait a bit now,’ he said. ‘We have to see what happens and if it is really 100 per cent safe, then we will go back to Syria.’",https://www.newagebd.net/post/europe/252487/european-countries-suspend-syrian-asylum-decisions-after-assads-fall
Bangladesh-US defence dialogue starts Wednesday in Hawaii,"The 11th bilateral defence dialogue between Bangladesh and the United States will be held from December 11. A delegation from Bangladesh, led by director general of Armed Forces Division (operations and plans) Brig Gen Md Alimul Amin, will participate in the dialogue, said a press release of ISPR. The dialogue will be held in Hawaii, United States and will conclude on December 12. The dialogue is very important for the mutual military cooperation between the two countries. Different aspects of military cooperation between the two countries including issues related to global and regional security, technology, defence equipment, disaster management, peacekeeping operations, training, joint exercise and drills, workshops and others will be discussed in the dialogue. The delegation includes senior officials from the Army, Navy and Air Force, as well as the Ministry of Foreign Affairs and the Bangladesh Coast Guard.  ",https://www.newagebd.net/post/country/252486/bangladesh-us-defence-dialogue-starts-wednesday-in-hawaii
