title,content,link
Prime accused Chandan gives confessional statement,"Chandan Das, the prime accused in the murder case of lawyer Saiful Islam Alif in Chattogram, has confessed to his involvement in the murder before the court under Section 164. Chattogram Metropolitan Magistrate Kazi Shariful Islam recorded the confessional statement on Monday evening. Following the statement, the court ordered Chandan to be sent to jail, said Osman Gani, the bench assistant. Osman Gani said that the investigation officer had earlier filed an application seeking to record the accused’s statement. After his confession, the court directed authorities to take him into custody. No lawyer appeared for the accused. Lawyer Saiful was hacked to death during a clash between members of law enforcement agencies and followers of Hindu community leader Chinmoy Krishna Das Brahmachari near the Chattogram court building area on November 26 while sending Chinmoy to jail in a sedition case.",https://www.newagebd.net/post/country/252436/prime-accused-chandan-gives-confessional-statement
Mugging incidents on rise in Dhaka: DMP chief,"Dhaka Metropolitan Police commissioner Sheikh Sajjat Ali said on Monday that incidents of mugging and robbery were reported to be on the rise in the capital. Detective Branch and local police have been instructed to remain vigilant to tackle these crimes, he said at a press briefing at DMP media centre on Minto Road in the capital. He also said that ‘trade’ was being done as far as cases related to deaths in the July-August mass uprising were concerned. He also said that action had been taken against a police officer in the Mohammadpur area on Sunday for allegedly being involved in such an incident. ‘Individuals should only be brought to book if evidence links them to the incident,’ he added. ‘It will be difficult to stop extortion if the people do not resist it. Please do not pay such ‘toll’. We, the police, will stand by the people’s side,’ he said. The commissioner also claimed that more than 80,000 of the around two lakh police members were recruited based on their political affiliations in the past 15 year. ‘In the past 15 years, various forms of scrutiny were done during appointments to determine the political affiliations of the candidates, as well as those of their fathers, grandfathers, and even ancestors,’ As a result, 80,000 to 90,000 of the two lakh police members were recruited through this process, he said, adding, ‘We cannot simply ask 80,000 to 90,000 police personnel to leave.’ He apologised to the residents of Dhaka and the people of the country for DMP’s unprofessional conduct during the July-August quota reform student movement. The commissioner said that actions were taken against responsible officials over the DMP’s unprofessional actions at that time. At the briefing, he emphasised other issues, including the current law and order situation in Dhaka, traffic management and the steps being taken by the police to address these challenges.",https://www.newagebd.net/post/country/252435/mugging-incidents-on-rise-in-dhaka-dmp-chief
Climate change poses major threat to Bangladesh’s apparel earnings,"Bangladesh, Cambodia, Pakistan, and Vietnam — four major apparel producers — could face a 22 per cent decline in nominal earnings by 2030 and 68 per cent by 2050 if the countries fail to invest in climate adaptation, according to a new study revealed on Monday. These losses could result in nearly one million forgone jobs by 2030 and up to eight million by 2050, underscoring the urgent need for mitigation efforts, report says. The study titled ‘Hot Air: How will fashion adapt to accelerating climate change?’ highlights the urgent need for these countries to implement adaptation strategies to safeguard their industries from the escalating impacts of climate change. High heat stress days have surged by 42 per cent across five major garment production hubs including Dhaka, Hanoi, Ho Chi Minh City, Phnom Penh, and Karachi over the last 20 years, with the frequency of extreme heat events rising alarmingly, according to the study. Bangladesh’s lack of meaningful workplace heat standards contrasts with stricter regulations in countries like Vietnam and Malaysia, creating compliance risks for international brands under the European Union’s corporate accountability laws, it says. These gaps in standards not only threaten worker wellbeing but also pose significant operational and reputational risks for the global apparel sector. The findings highlight an urgent need for Bangladesh to implement robust climate adaptation strategies, enforce meaningful workplace standards, and strengthen social protection mechanisms to safeguard workers and sustain its apparel industry in the face of escalating climate threats. The report also says Bangladesh's low purchasing power for manufacturing wages and limited social protection coverage exacerbated its climate vulnerability. These weaknesses leave workers ill-equipped to cope with lost income and rising living costs driven by climate events. Indoor heat risks also remain unaddressed in Bangladesh although the Accord on Fire and Building Safety introduced critical safety measures after the Rana Plaza disaster in 2013. The Labour Act of 2006 mandates ‘adequate ventilation’ and ‘comfortable’ temperatures but lacks enforceable thresholds or specific requirements, leaving workers exposed to extreme heat conditions. According to the report, in Bangladesh, compliance with indoor 'comfort' standards is certified by unregulated third parties. While the Accord on Fire and Building Safety, established in 2013 after the Rana Plaza disaster that claimed over 1,100 lives, oversees safety and health, it excludes indoor heat regulations from its scope, a gap also present in its successor organization, the RSC. Regarding Bangladesh, the study also says the devastating floods of July and August 2024 have compounded the industry’s vulnerabilities. Widespread inundation caused significant production delays in garment factories and disrupted operations at the Chattogram port, a vital link in global supply chains. The cumulative impact of these floods has reduced apparel output, adding strain to an industry already grappling with political instability and economic pressures. Researchers warn that these climate risks are widespread, with 23 production centres reporting significant increases in high-heat days. This threshold, which accounts for heat and humidity, marks the point at which the International Labour Organisation (ILO) advises garment workers to alternate equally between rest and work to maintain safe core body temperatures. Researchers also report an increase in the intensity of heavy rainfall over the last two decades, further compounding climate-related risks. Heat stress and flooding pose severe challenges to apparel production, affecting workers’ health, slowing production, and even causing the shutdown of factories, transportation, and ports. Previous research by Cornell ILR and Schroders estimates that four key apparel-producing nations could lose up to $65 billion in export earnings by 2030 due to extreme heat and flooding. The impacts are already being felt. In April, heatwaves in Bangladesh forced school closures and led to lower productivity and increased sick days among garment workers. In August, Vietnam grappled with deadly floods and landslides that disrupted education and delayed the start of the school year. The findings underline the urgent need for adaptation measures and robust social protection systems to shield workers from these escalating climate threats. Researchers also warn that under emerging Due Diligence laws, brands could face legal liabilities for harm caused to workers by extreme climate events. Jason Judd, executive director of Cornell University’s Global Labor Institute, emphasised that extreme heat and flooding pose significant health risks for millions of garment workers and represent material threats to the fashion industry. He highlighted the urgent need for adaptation investments to protect workers and supply chains, stressing that these efforts must complement de-carbonisation initiatives. Judd also underscored the importance of pairing physical adaptation measures with robust social investments, noting that one without the other would be ineffective. He pointed to living wages as a critical example, enabling workers to manage lost workdays and rising costs associated with electricity, food, and climate-related medical expenses. Judd called for clear and enforceable climate-labour requirements across the industry, encompassing employers, brands, investors, and lenders. ‘These are needed for the industry to adapt to climate breakdown and for major brands and retailers to meet their obligations to workers under new CSDDD rules,’ Judd added.",https://www.newagebd.net/post/apparel/252434/climate-change-poses-major-threat-to-bangladeshs-apparel-earnings
AL crony keeps raking in abnormal profit,"One of the Awami League cronies, who made it to the recently published White Paper on economy for raking in abnormal profit, continues to do so with its business monopoly as a commercial independent power producer, while paying less for years for the gas it uses in its plants. The United Power Generation and Distribution Company Limited that owns two commercial independent power plants, which are the only power plants of this kind in the country, has refused to pay for years the legitimate price for the gas it uses for power generation. Years of paying less since January 2018 has led to the piling up of the company’s dues to the state-owned Titas Gas Transmission and Distribution Company Ltd to Tk 486 crore by October 2024, eight months after the Appellate Division had ruled against it holding back the payment. The company commercially producing power was not supposed to receive the gas in the first place, considering the 2008 policy to enhance private sector participation in the power sector, amidst rapidly depleting gas reserve and staggering energy crisis. The story of how the company, which fetched, almost without failing, 50–74 per cent annual profits over the last decade, used the scarce national resource for commercial purpose is a telltale sign of Awami League’s brazen favouritism, according to energy experts. The United Power that purchased gas for Tk 988 crore between 2017–18 and 2023–24, earned Tk 3,799 crore from electricity sale. ‘The United has refused to pay legitimate price for rather a long time. Its gas supply should be disconnected,’ said Shahnewaz Parvez, managing director, Titas. But business monopoly stood in the way, he said, reminding that the United Power was the only company supplying electricity in the Dhaka and Chattogram export processing zones. The power plants, with installed capacity of 164MW, were established with Bangladesh Export Processing Zone Authority’s approval in 2008 and 2009, just around the time Awami League assumed power. The two plants’ establishment cost was over Tk 1,005 crore. Energy experts explain that a commercial power plant is essentially different from other power producers such as independent power producers, given that the government takes no risk and responsibility for the commercial one, leaving its construction and business to be operated on its own. Independent power producers, also known as IPPs, on the other hand, enjoy privileges from government, such as, guaranteed fuel supply and electricity sale. The government buys electricity from all the IPPs in the country. The ‘Policy guidelines for enhancement of private participation in the power sector, 2008’ states that commercial power plants’ investors will have to arrange their own fuel and energy. The policy, however, also allows commercial power plants to obtain licence as an independent power producer. But such a licence, known as COIPP, combining two types of power plants, was awarded only to one company: United Power. The White Paper released by the interim government cites United Power as a member of Awami League’s favoured groups that received special terms. The company receives gas at the IPP rate of Tk 15.75 per meter cube instead of the captive rate of Tk 30.75 per meter cube, the paper says. ‘…selling power at the commercial rate to the Dhaka and Chittagong EPZ, thus raking in abnormal profit,’ reads a line of the White Paper. A year before the United Power obtained the licence in October 2009, it had signed a deal with the Titas for purchasing gas at the captive rate for its Dhaka EPZ power plant. The captive rate for purchasing gas, applicable to captive and commercial power plants, has always been higher than the IPP rate. In 2009, the difference in gas prices for the IPP and captive was Tk 1.12 per unit, which is Tk 15 at the moment. The United Power started paying the IPP rate after obtaining the licence and continued to do so until August, 2022, when the High Court ruled that the company must pay separate rates—the captive rate for electricity sold commercially and the IPP rate for electricity sold to the government. The High Court order came following a legal battle triggered by Titas asking for separate rates in 2019. The United Power’s outstanding bills resulting from paying less stood at Tk 377 crore in 2022 when the High Court ordered in favour of the Titas to charge separate rates. In December 2022, the United Power agreed to pay back the dues in 40 instalments, only one of which—Tk 30 crore—has so far been paid. But after the company had started paying the separate rates from August 2022, it stopped paying higher heating value which is obligatory under the contract when the supplied fuel produces heat higher than contracted. Fuels with higher heating value yields more production. The United Power had tried to have the High Court order reviewed by the Appellate Division, but its petition was discharged in February this year. Still, the company did not clear its dues. ‘The bill the company paid was barely half of what it had owed,’ said Hasan Mehedi, member secretary of Bangladesh Working Group on Ecology and Development, analysing data obtained from the Titas. How much the United Power owed to the Karnaphuli Gas Distribution Company Limited is unknown. The working group’s analysis also revealed that 23 per cent of the power produced between 2017–18 and 2023–24 was supplied to the national grid, while the rest went as a commercial supply to the Bangladesh Export Processing Zones Authority. Last year, the United Power declared 20 per cent profit. Its profit stood at 74 per cent in 2018, followed by similar profits made in 2016 and 2017. In the other years, since 2013, the company reported 50 per cent or more profit. Neither the Bangladesh Power Development Board nor Titas or Bangladesh Energy Regulatory Commission officials have any idea about the rates at which the United Power sells power commercially. BERC officials recalled the pressure under which they issued the COIPP licence to the United power. There are seven other commercial power plants, all holding COPP licence, which is awarded exclusively for commercial power production, despite desperate attempts to have it changed to COIPP. The United Power has been lobbying for some time now for a COIPP licence for its third commercial power plant, Leviathan Global Bd Ltd, a 53MW power station under construction at Karnaphuli EPZ. ‘The United Power is enjoying absolute monopoly in business,’ said energy expert Mohammad Tamim, who was a member of the committee that prepared the White Paper on the state of economy made public on December 2. The United Power did not have to look back after its venture of the two COIPP power plants made eye-watering profits. Since 2011, the United Power set up seven more power plants—all IPPs—with installed generation capacity of 1,041MW. United Power’s company secretary Elias Howladar told New Age that he did not have any comments about any of the matters.",https://www.newagebd.net/post/power-energy/252433/al-crony-keeps-raking-in-abnormal-profit
EU countries urged to shift visa centres from Delhi,"Chief adviser Professor Muhammad Yunus on Monday urged the European Union to relocate its visa centres for Bangladeshis from Delhi to Dhaka or to any other neighbouring country. He made the call when a 19-member EU delegation, led by Michael Miller, head of the Delegation of the European Union to Bangladesh, met him at the Chief Adviser›s Office in Tejgaon in Dhaka. The European Union, on the other hand, observed huge foreign direct investment potential in Bangladesh, leading to a tentative schedule of starting a discussion on the matter of ease of doing business in Bangladesh in January, according to an EU statement shared on the verified page of European Union in Bangladesh. The EU also recalled its offer to boost smart, secure, and open links via the Global Gateway strategy and mentioned the January 2025 visit of the vice-president of the European Investment Bank, said the EU statement. According to a chief adviser office statement, the chief adviser told the EU delegation that as India has restricted visas for Bangladeshis, many students are unable to go to Delhi to get visas for EU countries. As a result, he said, uncertainty has arisen about their educational careers, while universities in Europe are not getting Bangladeshi students. ‘If the visa office is shifted to Dhaka or any neighbouring country, both Bangladesh and the European Union will benefit,’ he added. As many as 15 EU diplomats expressed their views in the two-and-a-half-hour meeting. Paying tribute to the martyrs and injured in the July-August uprising, Yunus briefly outlined the oppression, exploitation, enforced disappearances, and human rights violations over the past 16 years during the Awami League regime in the country. Stating that misinformation is being spread against Bangladesh on a large scale, Yunus also sought the EU’s cooperation to fight the misinformation. Yunus also informed that dictator Sheikh Hasina and her aides, who were forced to flee the country in the July uprising, are trying to destabilise the country with the huge amount of money they laundered. During the meeting, foreign affairs adviser Md Touhid Hossain informed EU representatives that Bulgaria has already shifted its visa centre for Bangladeshis to Indonesia and Vietnam. He urged other countries to follow the same process. The EU representatives expressed their full support to the chief adviser in the reform process and vowed to stand by him in the aim of building a new Bangladesh by providing advice and recommendations, said the chief adviser›s media wing release. EU participants underlined their readiness to help Bangladesh achieve a successful and inclusive transition, underpinned by human rights, the rule of law, and good governance, leading to democratic elections. The EU confirmed that it will use its resources to help Bangladesh deliver in line with the expectations of its citizens. The EU recognised the key role of Bangladesh for hosting more than a million Rohingya refugees. After the meeting, environment, forest, and climate change adviser Syeda Rizwana Hasan told journalists, ‘we asked about getting trade benefits from the EU in their market so that Bangladesh can graduate from the Least Developed Country status. ‘We have talked about climate change and solving the Rohingya problem,’ she said while briefing journalists at the gate of the chief adviser›s state guest house Jamuna in Dhaka. The envoys who participated in the meeting are: Christian Brix Moller, Ambassador of Denmark to Bangladesh; Marie Masdupuy, Ambassador of France to Bangladesh; Achim Tr»ster, Ambassador of Germany to Bangladesh; Antonio Alessandro, Ambassador of Italy to Bangladesh; Gabriel Sistiaga Ochoa de Chinchetru, Ambassador of Spain to Bangladesh; Nicholas Weeks, Ambassador of Sweden to Bangladesh; Michael Miller, Ambassador and Head of the EU Delegation to Bangladesh; Andre Carstens, CDA a.i., Embassy of the Netherlands in Dhaka. Heads/Representatives of EU Missions in New Delhi: Didier VANDERHASSELT, Ambassador of Belgium to Bangladesh; Nikolay Yankov, Ambassador of Bulgaria to Bangladesh; Marje LUUP, Ambassador of Estonia to Bangladesh; Peggy FRANTZEN, Ambassador of Luxembourg to Bangladesh; Robert Maxian, Ambassador of Slovakia to Bangladesh; Evagoras Vryonides, High Commissioner-designate of Cyprus to Bangladesh; Gabor Szucs, first secretary, Dhaka Office of the Hungarian Embassy in New Delhi; Jaroslaw Jerzy Groberek, Counsellor, Poland Embassy in New Delhi; Sofia Batalha, Deputy Head of Mission, Portugal Embassy in New Delhi; Irma Sinkovec, first secretary, Embassy of Slovenia in New Delhi; and Ruxandra CIOCANELEA, second secretary, Embassy of Romania in New Delhi.",https://www.newagebd.net/post/foreign-affairs/252432/eu-countries-urged-to-shift-visa-centres-from-delhi
Poet Ershad Majumder dies,"Poet, translator, researcher and journalist Ershad Majumder died of old age complications while undergoing treatment at Dhaka’s United Hospital Sunday night. He was 84. Ershad breathed his last at 10.45pm. He was suffering from diabetic and cardiac ailment, said his family sources on Monday. Born on March 8 in 1940 at Ukilpara in Feni, Ershad Majumder studied at Feni College, Jagannath College and Dhaka College. He completed graduation degree in 1961 from Dhaka University. He joined the then Pakistan Observer as an economic reporter. Later, Ershad, also a pioneer of the economic journalism in the country, worked at different newspapers, including Dainik Sangbad, Dainik Purbodesh, Dainik Banglar Bani and Dainik Janapad. He was also chief editor of Weekly Reporter in 1978. Then he had worked as a managing editor at Daily New Nation. He had translated the poetries of Rumi and Mansur Hallaj. Fourteen books, including story, literature and poem were published in his name. His publications include ‘Mayer Chithi’, ‘Kabitar Boi’, ‘Chorar Boi’, ‘Upannash Nayika’, literature Nar-Nari and Ramani, Krishna Kotha, Srimiti Kotha, and Pita-Putrake.",https://www.newagebd.net/post/literature/252431/poet-ershad-majumder-dies
