title,content,link
"Defence research centre, navy ships in Syria destroyed in overnight strikes","A defence ministry research centre in northern Damascus was destroyed and about 10 navy ships were damaged in coastal Latakia in overnight strikes attributed to Israel by a Syria war monitor. The Syrian Observatory for Human Rights reported Monday that ‘Israeli warplanes’ had launched strikes on military targets including ‘the Barzeh scientific research centre’ and naval vessels and army warehouses in and around the Latakia military port. The strikes came on the heels of the collapse of former president Bashar al-Assad’s government over the weekend in the face of a lightning rebel advance. Western countries, including the United States had previously struck the research facility in Barzeh in 2018, saying it was related to Syria’s ‘chemical weapons infrastructure’. On Tuesday, three blocks of buildings that made up the centre were completely destroyed, according to an AFP journalist at the scene, with fire still burning among the ruins. Hundreds of documents were scattered on the ground, some on fire, as a strong smell of explosives lingered in the air. An employee who worked at the centre for 25 years and came to inspect the damage said that ‘the buildings destroyed were not military’. ‘The military centres were destroyed in the past, and the current research was civilian,’ he added, requesting anonymity. A ‘second scientific research centre’, based in Jamraya near Damascus, was also hit by strikes Monday night and ‘totally destroyed’, he said. AFP journalists in Damascus heard heavy strikes overnight into Tuesday morning. In Latakia, smoke was still rising Tuesday morning from the wreckage of navy ships equipped with machine guns and rocket launchers, half-sunk in the water, an AFP correspondent saw. Ahmad Khabaze said civilian employees such as himself had not stopped coming to work at the sea port. ‘Employees are still coming in to take care of state facilities even after the regime fell,’ he told AFP. Another civilian port employee, Samir Alloush, 54, told AFP he heard ‘strange noises in the night that went on for so long’. The region of Latakia was the heartland of Assad’s minority Alawite community, but after the rebel takeover, people there toppled a statue of the deposed dictator’s father. The Observatory reported more than 300 Israeli strikes across the country in the days since Assad fled, saying they had destroyed Syria’s ‘most important military sites’. Israel has conducted hundreds of strikes on Syria since the civil war began in 2011 following Assad’s crackdown on a democracy movement. On Monday, Israel said it had struck ‘remaining chemical weapons or long-range missiles and rockets in order that they will not fall in the hands of extremists’.",https://www.newagebd.net/post/middle-east/252471/defence-research-centre-navy-ships-in-syria-destroyed-in-overnight-strikes
Dhaka residents urged to wear masks outdoors amid worsening air pollution,"The government on Tuesday asked people not to go outside without masks as air quality in Dhaka and elsewhere in Bangladesh deteriorated to an unhealthy and hazardous level. The environment, forest and climate change ministry in its first ever advisory also advised individuals with sensitive health conditions or elderly and children to stay indoors unless absolutely necessary. Environment activists blamed the failure of the authorities concerned to rectify pollution sources for the deterioration of the air quality as Dhaka kept ranking first among the cities with the most polluted air, threatening public health. The Air Quality Index turned so bad that it exceeded the mark of 250 sometimes, the environment ministry said in the advisory when Dhaka’s AQI recorded 241 at 9:00am. The index placed Dhaka as one of the top polluted cities of the world for a long time. Center for Atmospheric Pollution Studies founding director and Stamford University Bangladesh environment science professor Ahmad Kamruzzaman Majumder said that average air pollution in the ountry jumped to AQI 171 in 2023 from 146 in 2017. National Institute of Diseases of the Chest and Hospital director Md Delwar Hossain said that with the rise of air pollution the number of patients and fatalities due to respiratory diseases, chronic obstructive pulmonary disease, interstitial lung disease and asthma, among others, were on the rise. ‘We have no vacant beds now as the 670-bed specialised hospital is flooded with patients with respiratory diseases,’ he told New Age on Tuesday. In 2023, the institute treated 146,469 patients with various respiratory illnesses, with 1,046 fatalities. The figures were 110,774 and 877 respectively in 2000. Several researches revealed the major sources of air pollution in Bangladesh that included construction sites, brick kilns, traffic, burning of solid waste, trans boundary pollution and industrial pollution. Despite knowing the sources, the authority did not take any pragmatic steps to curb the pollution over the years while the sources became intense, increasing pollution, said green activists. The environment ministry said that controlling air pollution was a time-consuming process. It urged all stakeholders to collaborate with the government in controlling air pollution. Department of Environment director for air quality wing Md Ziaul Haque said that controlling air pollution was a multi-stakeholder issue. Local government agencies, industry ministry, transport ministry are among other important entities that need to come forward to stop air pollution for some of the sources, he explained. Officials concerned said that the department conducted several drives against the illegal brick fields and demolished or shut more than 500 brick fields in the past five years. Many of them, however, again went back to production for the lack of monitoring. The authority did not take any punitive actions against the polluters like city corporations responsible for dust pollution from dilapidated roads and construction sites, renovation works and burning solid waste. In 2023, the World Bank published a report titled Striving for Clean Air: Air Pollution and Public Health in South Asia that found that an estimated 30 per cent of pollution in Bangladesh’s largest cities originated in India. To combat transboundary air pollution, four South Asian countries – Bangladesh, India, Nepal and Pakistan – agreed on the need to reduce national annual average PM 2.5 levels to 35 micrograms per cubic metre by 2030. The declaration was forged in Nepal in December 2022, during meetings facilitated by the World Bank and the International Centre for Integrated Mountain Development. None of the countries has, however, taken any pragmatic measures so far. Children and elderly people are more vulnerable to air pollution, said Bangladesh Shishu Hospital and Institute director and professor Mahbubul Hoque. He said that they were receiving an additional number of child patients with respiratory tract infections everyday. The hospital data showed that on average daily 130 patients were admitted to the hospital and another 1,200 patients were given treatment at the outpatient department of the 680-bed hospital. Mahbubul suggested people to avoid pollution as much as possible and to use masks if they need to go outside. The Boston-based Health Effects Institute, in partnership with UNICEF, in a report published in June revealed alarming trends in air quality both in Bangladesh and worldwide, posing significant health risks. According to the latest State of Global Air 2024 report, in 2021 alone, air pollution was responsible for over 2,35,000 deaths in Bangladesh, highlighting a significant public health challenge. The report finds that children under five years are especially vulnerable, with health effects including premature birth, low birth weight, asthma, and lung diseases. In several countries in Africa and in Asia, including Bangladesh, more than 40 per cent of all deaths from lower-respiratory-tract infections in children under five years are attributed to air pollution. In 2021, Bangladesh recorded over 19,000 deaths of children under five years due to air pollution-related conditions. In 2021, exposure to air pollution globally was linked to more than 7,00,000 deaths of children under five years, making it the second-leading risk factor for death globally for this age group, after malnutrition.    Vehicles move through flying dust exposing passengers to health hazard in Shyampur area of the capital on Tuesday.  Sony Ramani",https://www.newagebd.net/post/country/252470/dhaka-residents-urged-to-wear-masks-outdoors-amid-worsening-air-pollution
Mohammad Abdul Momen new chairman of ACC,"The government on Tuesday appointed senior secretary of the Public Security division of home ministry Mohammad Abdul Momen as new chairman of the Anti-Corruption Commission. The government also appointed retired District and Sessions Judge Mia Mohammad Ali Akbar Azizi and Brigadier General (retd) Hafiz Ahsan Farid as new commissioners of the ACC, according to a gazette notification issued by the Cabinet Division. It said that Momen, as ACC chairman, will enjoy salary, allowances, and status given to an Appellate Division judge, while the two commissioners, as commissioners, will enjoy salary, allowances, and status given to a High Court Division judge. Momen was working on a contract basis in the public  security division of the Ministry of Home Affairs, but he resigned on December 8 from that post to join as ACC chairman, said ministry officials. The Public Administration ministry also on Tuesday issued a separate official order cancelling Momen’s contractual appointment. Momen was sent on compulsory retirement in 2013 by the then Awami League government while he was a joint secretary. After the AL government fell on August 5 amid a student-led mass uprising, he was appointed as secretary of the Public Security Division of the home ministry on contractual basis. Later, he was promoted to senior secretary. On October 29, former ACC chairman Mohammad Moinuddin Abdullah and two commissioners, Md Zahurul Haque (Investigation) and Mosammat Asia Khatoon (Inquiry), resigned from their positions.",https://www.newagebd.net/post/country/252469/-mohammad-abdul-momen-new-chairman-of-acc
Concerns raised over interviewees for post of BFIU head,"Bangladesh Bank has called ten individuals for interviews to appoint the next head of the Bangladesh Financial Intelligence Unit. The interviews are scheduled for December 11 and 12. However, the selection process has sparked alarm. According to central bank officials, several individuals shortlisted for the position, including some tied to the S Alam Group during the previous Awami League government, have faced accusations of benefiting from bank irregularities and corruption. They warn that appointing such individuals could undermine the integrity of the financial intelligence body and derail efforts to recover laundered money. Observers have expressed grave concerns, highlighting the significant role of the BFIU in tackling financial crimes. They fear that appointing individuals implicated in corruption or linked to bank fraud could compromise the unit’s credibility. Some critics claim this could jeopardise the recovery of laundered funds and render past sacrifices, including the struggles of students and disabled individuals, meaningless. The ten individuals called for interviews include former Bangladesh Bank executive directors AFM Shahinul Islam, Nazrul Islam, Zahurul Huda, Akhtarul Islam, and Nurul Amin, as well as current executive directors Rafiqul Islam, AKM Ehsan, Mamun Hossain, Md Saiful Islam Khan, and a former deputy managing director of NCC Bank. Among the candidates, Zahurul Huda has attracted particular criticism. After retiring from Bangladesh Bank, Huda reportedly joined the training academy of the S Alam Group. Following S Alam Group’s takeover of National Bank, he was appointed as an independent director of the bank. Sources allege that during their tenure at Bangladesh Bank, some of the shortlisted candidates extended undue concessions to the S Alam Group. In return, they reportedly secured lucrative positions in the conglomerate upon retirement. Critics argue that appointing such individuals to lead the BFIU could lead to the collapse of crucial financial oversight and anti-corruption measures. They call for greater scrutiny and transparency in the selection process to ensure the integrity of Bangladesh’s financial system.",https://www.newagebd.net/post/banking/252468/concerns-raised-over-interviewees-for-post-of-bfiu-head
"Indian players sledged, we hit back: Bangladesh U-19 captain","Bangladesh Under-19 captain Azizul Hakim Tamim believes that aggression and sledging are a part of cricket, and it was necessary against India in the final of the ACC Men's U-19 Asia Cup. The champions of the 2024 edition returned home on Monday night and were received by the Bangladesh Cricket Board officials with bouquets at the airport. The junior Tigers retained the title with an impressive 59-run victory over India in the final at the Dubai International Cricket Stadium on Sunday. They had claimed their maiden trophy of the tournament last year, defeating hosts UAE by a massive 195 runs in the final at the same venue. 'Indian players sledged, and we gave it back ... To win, you must show some aggression and do some sledging,' Azizul told reporters at the Hazrat Shahjalal Airport on Monday. During the final, a large number of expatriates were cheering for the Bangladesh team, chanting 'Allahu Akbar' from the stands. ‘When they [fans] were saying it, as a Muslim, I liked it. They supported us players a lot; they were in the stands from the morning. Alhamdulillah, it's a great feeling.’ Azizul also shared an incident from the semi-final match against Pakistan, where they secured a seven-wicket victory, which turned out to be quite heated. 'I had missed a free hit. A Pakistani fielder asked me, 'Did you even see the ball?' After that, I hit a six and then asked him, 'Did you see the ball this time?'.' Azizul expressed confidence about carrying the momentum from their Asia Cup victory into the forthcoming ICC U-19 World Cup, scheduled to be held in Zimbabwe and Namibia in 2026. ‘Of course, we have gained confidence from winning the Asia Cup. Beating teams like India and Pakistan also makes you feel confident,’ he said. ‘We will try to hold on to this confidence. We have a few series coming up and then the World Cup. We will try to perform well.’ ",https://www.newagebd.net/post/cricket/252467/indian-players-sledged-we-hit-back-bangladesh-u-19-captain-
City Bank announces major salary restructuring to support employees amid inflation,"City Bank has announced a groundbreaking salary restructuring initiative to align with market standards and enhance employee well-being amidst rising inflation. The Board of Directors has approved an annual salary increment of Tk 162 crore for 2024, which will culminate in a total increase of Tk 300 crore by the end of 2025, including PMP adjustments and bonuses. This historic decision will increase the bank’s total salary expenditure to Tk 1,210 crore annually by next year. The initiative follows an in-depth salary survey conducted by Cerebrus Consultants Ltd., comparing City Bank’s compensation packages with those of peer banks. The restructuring is designed to bring salaries closer to market averages while maintaining fairness. Employees whose current salaries are significantly below market standards will receive higher percentage increases, while those closer to market averages will see comparatively smaller increments. From assistant officer to senior executive vice president levels, the salary increments range from 10% to 50%, with an average increase of around 23%. Regardless of current salary levels, a minimum increment of Tk 10,000 has been ensured for all employees, while the maximum increase in some cases has reached Tk 60,000. All Support staff, outsourced staff, contractual employees, and management trainees are also receiving these raises. The new salary structure will take effect on November 1, 2024, with employees receiving the updated amounts in their December payroll, including arrears for November. ‘Our employees are the backbone of CityBank,’ said Aziz Al Kaiser, Chairman of City Bank. ‘By aligning compensation with market standards, we aim to create a workplace where everyone thrives.’ City Bank’s MD & CEO Mashrur Arefin stated, ‘The bank’s profit has increased manifold during my six-year tenure as CEO. Operating profit, which stood at Tk 699 crore, is now even surpassing the Tk 2,000 crore mark this year. It is our moral obligation to ensure our staff can lead comfortable lives with their families during these challenging times.’ This bold initiative underscores City Bank’s vision to foster a sustainable, employee-centric environment, solidifying its reputation as a leading employer in the banking sector.",https://www.newagebd.net/post/mis/252466/city-bank-announces-major-salary-restructuring-to-support-employees-amid-inflation
A World Cup on three continents sparks climate concerns,"The 2030 FIFA World Cup will send dozens of football teams and hordes of fans crisscrossing the globe for matches on three continents, sparking alarm over the environmental cost. An announcement on the 2030 and 2034 World Cups will be made on Wednesday, with expectations of a dramatic expansion of geographic footprint -- and with that planet-heating greenhouse gas emissions. While Saudi Arabia is the lone candidate for 2034, Morocco, Spain and Portugal have formed a joint bid for the 2030 tournament, with Uruguay, Argentina and Paraguay each also set to host a match. Guillaume Gouze, of the Centre of Sports Law and Economics at the University of Limoges, said FIFA has a ‘moral responsibility’ to integrate climate concerns into its tournament plans. Instead, he said, it had proposed World Cups that are an ‘ecological aberration’. Benja Faecks of the NGO Carbon Market Watch, which evaluates climate promises of major events, told AFP that in general attempts at greenwashing in sport -- or ‘sportswashing’ -- are harder than they used to be, with academics and campaigners holding organisations to account. But she said that the 2030 tournament was ‘an unfortunate geographic choice’. When an event is spread over sites thousands of kilometres apart, teams and potentially hundreds of thousands of their loyal fans have to travel by plane. The three matches in Argentina, Uruguay and Paraguay are to mark the 100th anniversary of the event, which was born in Montevideo. FIFA is keen to support access to football across different parts of the world, said David Gogishvili, a researcher at the University of Lausanne in Switzerland. But ‘it is a crazy idea in terms of the impact this choice will have on the planet’, he added. FIFA has already expanded participation in the competition, which will see 48 teams take part in the 2026 edition -- held in Mexico, the United States and Canada -- compared to 32 in 2022. This ‘is almost worse than the Cup on three continents,’ says Aurelien Francois, who teaches sports management at the University of Rouen in France. More teams means more fans wanting to visit the venues, more capacity needed in the hotel and catering sector, and more waste, among other issues. FIFA says that, with the exception of the games in Argentina, Uruguay and Paraguay ‘for 101 games, the tournament will be played in a footprint of neighbouring countries in close geographic proximity and with extensive and well developed transport links and infrastructure’. Meanwhile, oil and gas giant Saudi Aramco became a major sponsor earlier this year in a controversial deal that runs through to 2027. In October, an open letter from more than a hundred female professional footballers across 24 countries called for the deal to be cancelled on the grounds of human rights and environmental concerns, saying: ‘FIFA might as well pour oil on the pitch and set it alight’. Just shrinking the geographic footprint is not enough, researchers said. While the 2022 World Cup was held in a ‘compact’ site in Qatar, it was necessary to build new air-conditioned stadiums that were rarely reused. Potential improvements could include a policy of not awarding the World Cup to a city where everything has yet to be built, echoing a rule by the International Olympic Committee, said Gogishvili. Another idea to reduce air travel is to reserve a large proportion of stadium tickets for fans travelling from within a few hundred kilometres, and encourage transport by train. Gouze, like other experts interviewed by AFP, supports creating more fan zones in soccer-loving cities for ‘a collective experience’ that recreates the stadium atmosphere in front of a big screen. But this would need FIFA to accept the impact on the economic profitability of the World Cup. Soccer fans are a reflection of the population as a whole, so a growing percentage are more environmentally conscious than even a few years ago, said Ronan Evain of Hamburg-based Football Supporters Europe. He said that while co-hosting is not a problem in and of itself, citing the example of the 2002 Cup co-hosted by Japan and South Korea, the 2030 tournament poses ‘too many questions’ for fans. These include the environmental costs, as well as financial considerations for fans trying to follow their teams across the planet. But die-hard supporters will not let the long-haul flight put them off, said Antoine Miche, director of Football Ecologie France. ‘Passion can make you do things that don't make sense,’ he added. ",https://www.newagebd.net/post/football/252465/a-world-cup-on-three-continents-sparks-climate-concerns
"BFIU seeks Hasina, Rehana bank account details","Bangladesh Financial Intelligence Unit, the financial intelligence agency of the central bank, has sought the bank account details of ousted prime minister Sheikh Hasina and her younger sister Sheikh Rehana. It also sought the bank account details of ‘Father of the Nation Bangabandhu Sheikh Mujibur Rahman Memorial Trust’ and Chowdhury Zafarullah Sarafat. The intelligence unit sent instructions to the country’s banks and financial institutions, seeking account information on Monday, a senior official of the BFIU told media on Tuesday. The letter sent by the BFIU said that the relevant sections of the Prevention of Money Laundering Rules would be applicable in the order to seek transactions. The official concerned of the BFIU said that they were asked to inform where and how the money came to the account of the ‘Father of the Nation Bangabandhu Sheikh Mujibur Rahman Memorial Trust’, where the money was spent later and whether it was withdrawn in cash. Sheikh Hasina is the chairman of the trust and her sister Sheikh Rehana is one of the trustees. Besides, information was sought from others who are involved in this trust or the accounts in which money were transferred or deposited from the trust account.",https://www.newagebd.net/post/country/252464/bfiu-seeks-hasina-rehana-bank-account-details
Eight accused in Ctg court violence case put on fresh 5-day remand,"A Chattogram court on Tuesday sent eight accused arrested in connection with the clashes and vandalism during over ex-ISKCON leader Chinmoy Krishna’s bail denial on a five-day police remand. The court passed the order when police produced the accused before the court of Chattogram Metropolitan Magistrate Alamgir Hossain amid tight security and sought their remand. They were sent on a six-day remand on December 4 following their arrest. On November 26, the supporters of Chinmoy Krishna Das engaged in violent clashes with police and others on the court premises when the court rejected his bail plea in a sedition case. During the clashes, lawyer Saiful Islam Alif was hacked to death. So far, six cases including a murder case, police assault, vandalism, and obstruction of government duties, have been filed in connection with the incident. Three of these cases were filed by police.",https://www.newagebd.net/post/country/252463/eight-accused-in-ctg-court-violence-case-put-on-fresh-5-day-remand
