title,content,link
Developments in Bangladesh can’t be dismissed only as media exaggerations: India,"India has expressed concern over what it called a ‘surge of extremist rhetoric’ in Bangladesh and said the interim government must live up to its responsibility of protecting the minorities. ‘We are concerned at the surge of extremist rhetoric, increasing incidents of violence and provocation,’ spokesperson at the Ministry of External Affairs Randhir Jaiswal told reporters in a regular media briefing in New Delhi on Friday. He said these developments ‘cannot be dismissed’ only as ‘media exaggerations.’ ‘We once again call upon Bangladesh to take steps for the protection of minorities,’ said the MEA spokesperson. Expressing its concern over the situation of Hindus and other minorities in Bangladesh, Jaiswal said that the Indian government has raised the issue with Bangladesh. ‘We made opposition very clear as far as the situation of Hindus and minorities in Bangladesh is concerned. We have raised this matter with Bangladesh that they must take responsibility for protecting the minorities and safeguarding their interests, and providing for their safety and security,’ he added. On the arrest and imprisonment of Chinmoy Krishna Das, Jaiswal said they have issued a statement on that. ‘We see ISKCON as a globally well-regarded organisation with a strong record of social service,’ said the MEA spokesperson. He said cases against individuals and legal processes are underway. The Indian MEA spokesperson said they hope and expect that these processes will be dealt with in a fair, just and transparent manner ensuring full respect for these individuals and all those who are concerned.",https://www.newagebd.net/post/foreign-affairs/251526/developments-in-bangladesh-cant-be-dismissed-only-as-media-exaggerations-india
"Dhaka slams desecration of nat’l flag, burning of Yunus’ effigy in Kolkata","The government of Bangladesh on Friday strongly condemned acts of desecrating the national flag of Bangladesh and burning of the effigy of interim government chief adviser Professor Muhammad Yunus in Kolkata of India. Expressing deep concern over violent protest outside the Deputy High Commission of Bangladesh in Kolkata, the government of Bangladesh called upon Indian government to take necessary measures in order to prevent occurrences of such incidents in the future. The government of Bangladesh urged the Indian government to ensure safety and security of the Deputy High Commission of Bangladesh in Kolkata and other diplomatic missions of Bangladesh in India as well as its diplomats and non-diplomatic members of staff, said a press release issued by the foreign affairs ministry of Bangladesh. The government of Bangladesh noted with deep concern the violent protest organised outside the Deputy High Commission of Bangladesh in Kolkata on Thursday afternoon by a Hindu organisation of Kolkata named Bongio Hindu Jagran, said the release The rally and demonstration organised by a large group of protesters turned violent, with the protesters breaking through police barricades and reaching the boundary of Bangladesh Deputy High Commission, mentioned the release. They set fire to the national flag of Bangladesh and burnt the effigy of the chief adviser of the government of Bangladesh, the release added. Although the situation seems to be under control at the moment, there is a prevailing sense of insecurity among all the members of the Deputy High Commission, said the MoFA.",https://www.newagebd.net/post/foreign-affairs/251525/dhaka-slams-desecration-of-natl-flag-burning-of-yunus-effigy-in-kolkata
Rahat Fateh Ali Khan to perform at charity concert in Dhaka,"Celebrated singer Rahat Fateh Ali Khan will perform at a charity concert for supporting families of victims of the student-led mass uprising in December in Dhaka. Students’ platform Spirits of July will organise the charity concert titled Echoes of Revolution at Bangladesh Army Stadium in the capital on December 21. The earnings from the concert will be donated to the July Shaheed Smrity Foundation to support the families of the martyrs and the injured persons during the uprising. Organisers on Friday made the announcement at a press conference held at Madhu’s Canteen in Dhaka University. DU students and Spirits of July members Hasan Mahmud Rizvi, Sadekur Rahman Sunny, Md Jafor Ali and Wahid-Uz-Zaman in a joint statement announced that a contract was signed with Rahat Fateh Ali Khan on November 28. ‘He decided to perform at our concert without remuneration and the amount collected from the concert will also be donated to the families of the martyrs and injured,’ said Rizvi. The organisers also announced that local bands Artcell, Chirkutt, Ashes, Aftermath and rap singers Sezan and Hannan would also perform with token fees in the concert. The concert will also feature a graffiti exhibition related to the uprising, theatre productions and Mugdho Water Corner, the organisers said. Tickets for the concert will be available for sale in the first week of December, the organisers said, adding that tickets would be available in three categories and the prices of the tickets would be decided soon. Jafor said that Spirits of July and July Shaheed Smrity Foundation signed a memorandum of understanding on November 12 to donate the concert earnings to the foundation to support affected families. An advisory board comprising DU teachers and eminent personalities had been formed to ensure transparency in financial matters and to provide advice, said the organisers. The concert’s sponsor Prime Bank deputy managing director Ziaur Rahman, DU AF Rahman Hall provost Quazi Mahfujul Hoque Supan, DU institute of modern languages professor Mohammed Ansarul Alam and DU sociology department associate professor Mohammad Mahbub Quaisar, among others, were present at the press conference.",https://www.newagebd.net/post/music/251524/rahat-fateh-ali-khan-to-perform-at-charity-concert-in-dhaka
Hefazat-e-Islam organises rally demanding ban on ISKCON,"Leaders and activists of Hefazat-e-Islam Bangladesh on Friday held a protest rally in Dhaka demanding a ban on the International Society for Krishna Consciousness and protesting the murder of lawyer Saiful Islam Alif in Chattogram. Hefazet’s Dhaka city unit arranged the protest rally and a procession at the north gate of the National Mosque Baitul Mukarram in Dhaka after Jumma prayers, where several thousand people participated. Earlier, on Thursday, Hefazat took the decision to hold the protest rally at a meeting at Jamia Rahmia Arabia Mohammadpur presided over by the organisation’s Dhaka city unit president Maulana Junaid Al Habib. Hefazat leaders at the rally said that the defeated forces of the country were using a section of Hindus to create chaos and anarchy. As part of this, ISKCON is carrying out a malicious attempt to destabilise the country, they said. They also condemned the incident of killing lawyer Saiful Islam Alif in Chattogram and demanded punishment for the people involved in the brutal killing.",https://www.newagebd.net/post/country/251523/hefazat-e-islam-organises-rally-demanding-ban-on-iskcon
DU students show solidarity with Palestine,"On the occasion of the International Day of Solidarity with the Palestinian People, a ‘March for Palestine’ began at around 3:30pm at the Anti-Violence Raju Memorial Sculpture at Dhaka University attended by the students and others on Friday. During the programme, a large national flag of Palestine was displayed and participants chanted slogans ‘Answer for genocide,’ ‘Free, free Palestine,’ ‘2024: Genocide no more,’ ‘Occupation no more,’ ‘From Arakan to Palestine, let there be freedom,’ ‘Child killing no more,’ and ‘Zionism no more,’ among others. A mass signature campaign in support of Palestine was also conducted. Then a procession carrying the large flag started from the Raju Memorial Sculpture, passed Ruqayyah Hall, the VC Chattor, and Fuller Road, before ending back at the Raju Sculpture. At the programme, Abu Baker Mojumder, coordinator of the Anti-Discrimination Student Movement, said, ‘When we started our movement in July, the cries of the people of Palestine worked as our spirit. Therefore, on this day, we demand the liberation of Palestine.’ Other leaders of the Anti-Discrimination Student Movement, including coordinator Lutfor Rahman, Hasib Al Islam, Rifat Rashid, co-coordinator Mohiuddin, along with many students, were present at the march for Palestine programme.",https://www.newagebd.net/post/country/251522/du-students-show-solidarity-with-palestine
Sammilito Parishad names Abul Kalam as panel leader for BGMEA elections,"The managing director and chief executive officer of Chaity Group, Md Abul Kalam, has been officially announced as the panel leader of Sammilito Parishad, a major group representing the country’s garment manufacturers. The announcement was made on Thursday at an event held at a city hotel in Dhaka, ahead of the upcoming elections for the Bangladesh Garment Manufacturers and Exporters Association. Among those present at the event were former BGMEA presidents Faruque Hassan, Redwan Ahmed, Mostofa Golam Quddus, Kazi Moniruzzaman, SM Fazlul Hoque, and Khandoker Rafiqul Islam. Sammilito Parishad and Forum, another panel, are traditional rivals in BGMEA elections, vying for control of the apex body of Bangladesh's apparel sector. Earlier, on October 20, the Ministry of Commerce dissolved BGMEA's Board of Directors in accordance with Section 17 of the Trade Organisations Act, 2022. The ministry appointed Md Anwar Hossain, vice-chairman of the Export Promotion Bureau (EPB), as the administrator of BGMEA. According to the ministry’s announcement, the administrator will oversee the holding of free and fair elections within 120 days and will hand over the responsibilities to the newly elected BGMEA leadership. On August 24, Designtex Group managing director Khandoker Rafiqul Islam was elected president of BGMEA following the resignation of SM Mannan Kochi. Mannan Kochi, a member of Sammilito Parishad, had been elected BGMEA president for the 2024-26 term on March 14. After his resignation, BGMEA’s board selected Rafiqul Islam to serve for the remainder of the term. In August, a group of BGMEA members led by Forum, another panel, demanded the dissolution of the current BGMEA board. They cited the board’s failure to provide adequate guidance to members during challenging times, including student protests, government instability, labour unrest, and flooding. The group also alleged irregularities in the BGMEA election held earlier this year, claiming that Kochi had close ties with the ousted prime minister and had been involved in suppressing student protests during the July-August unrest. Earlier, another election-centric panel of BGMEA namely Forum on November 20 announced Rising Group managing director Mahmud Hasan Khan as panel leader for the upcoming elections of the trade body.",https://www.newagebd.net/post/apparel/251521/sammilito-parishad-names-abul-kalam-as-panel-leader-for-bgmea-elections
Irish voters votes cast ballot in closely fought general election,"Voting got under way in Ireland on Friday in a general election in which the two centre-right coalition partners are neck-and-neck with opposition party Sinn Fein. Polls opened at 0700 GMT and will close at 2200 GMT as voters choose new members of the 174-seat lower chamber of parliament, the Dail. Final opinion polling put the three main parties -- centre-right Fine Gael and Fianna Fail, and the leftist-nationalist Sinn Fein -- each on around 20 percent. Counting is not due to start until Saturday morning, with partial results expected throughout the day. A final result, however, may not be clear for days as EU member Ireland’s proportional representation system sees votes of eliminated candidates redistributed during multiple rounds of counting. Prime Minister Simon Harris was one of the first to vote, casting his ballot in his constituency of Delgany, south of Dublin. The Fine Gael leader, who became Ireland’s youngest-ever taoiseach (prime minister) when he took over in April, held a solid lead entering the campaign. But the party lost its advantage after Harris was seen in a viral clip appearing rude and dismissive to a care worker on the campaign trail. ‘I’ve enjoyed putting forward my policy vision as a new leader, as a new Taoiseach,’ Harris, 38, told reporters after voting. ‘Now I’m looking forward to the people having their say.’ Some in his constituency did not share his optimism. IT worker Kevin Barry, 41, said he was unsure about voting ‘as all the options seem so terrible’. While leaning towards the governing coalition, Barry told AFP: ‘I am not really happy with them as they are responsible for the mess that we are in, particularly with regard to housing.’ For Peta Scott, 54, a healthcare worker and mother of four, housing woes meant it was ‘a challenge’ for her children to stay in Ireland. In north Dublin, Deric Sweeman, a 55-year-old truck driver, said he voted for Sinn Fein. ‘It’s time for a change... Fine Gael and Fianna Fail have had enough to fix it and they have not done it,’ he added. Housing and infrastructure improvements need to be the priorities for the next government, he said. At the last general election in 2020, Sinn Fein -- the former political wing of the paramilitary Irish Republican Army -- won the popular vote but could not find willing coalition partners. That led to weeks of horsetrading, ending up with Fine Gael, which has been in power since 2011, agreeing a deal with Fianna Fail, led by the experienced Micheal Martin, 64. The role of prime minister rotated between the two party leaders. The smaller Green Party made up the governing coalition. Harris has had to defend the government’s patchy record on tackling a worsening housing crisis and fend off accusations of profligate public spending. A giveaway budget last month was also aimed at appeasing voters fretting about sky-high housing and childcare costs. Both centre-right parties stress their pro-business credentials and say returning them to power would ensure stability, particularly with turmoil abroad and the risk of external shocks. Ireland’s economy depends on foreign direct investment and lavish corporate tax returns from mainly US tech and pharma giants. But threats from incoming US president Donald Trump to slap tariffs on imports and repatriate corporate tax of US firms from countries such as Ireland have caused concern for economic stability. Mary Lou McDonald’s Sinn Fein has seen a dip in support because of its progressive stance on social issues and migration policy, as immigration became a key election issue. But it has rallied on the back of a campaign heavily focused on housing policy and claims it is the only alternative to the Fine Gael and Fianna Fail, who have swapped power since Irish independence from Britain in 1921. In McDonald’s Dublin central constituency, retiree William McCarthy voted Sinn Fein but did not think they would win. Physiotherapist Jenny Foley, 28, voted for the smaller centre-left Social Democrats because of their immigration policy and pro-choice stance, with abortion legalised in Ireland in 2018. ‘I am really interested in candidates who are not on the side of closing Ireland’s borders. I’m really not a fan of all of that,’ she added. Independents could play a role in the formation of the next government if Fine Gael and Fianna Fail fall short of an 88-seat majority.",https://www.newagebd.net/post/europe/251520/irish-voters-votes-cast-ballot-in-closely-fought-general-election
"Govt seizes 40,000 Kg polythene in anti-polythene campaign","Bangladesh interim government is intensifying its efforts to enforce the ban on polythene shopping bags, urging all citizens to comply with the directives to stop using such bags. Non-compliance will result in strict actions, said Tapan Kumar Biswas, additional secretary and chair of the monitoring committee on this issue under the Ministry of Environment, Forest and Climate, during a monitoring operation at New Market Kitchen Market in Dhaka on Friday. He told reporters that since November 3, authorities have conducted 166 raids to enforce the ban. Officials fined 349 establishments a total of Tk 19,29,900 and confiscated 40,000 kg of polythene during this period. ‘Public awareness is growing, and we are witnessing gradual improvements,’ he said. ‘Awareness campaigns, providing alternatives, and strict enforcement are advancing simultaneously,’ added Tapan. During the monitoring activity, market committee members acknowledged the harmful effects of polythene usage and pledged to adopt eco-friendly alternatives. Officials from the Ministry of Environment, Department of Environment, law enforcement agencies, and representatives from the media participated in the operation.",https://www.newagebd.net/post/country/251519/govt-seizes-40000-kg-polythene-in-anti-polythene-campaign
"Floods kill 8, thousands evacuate in Malaysia, Thailand","Flooding in northern Malaysia and southern Thailand has claimed lives of at least eight people and forced tens of thousands to flee homes, officials in both countries said on Friday. More than 80,000 people were evacuated to 467 temporary shelters in Malaysia this week, with four deaths recorded across the northern states of Kelantan, Terengganu and Sarawak, according to disaster officials. Floods in neighbouring Thailand killed two people in Pattani province and two in Songkhla province, the Department of Disaster Prevention and Mitigation said on its Facebook page. More than 240,000 households in southern Thailand have been affected by the flooding, it said, following days of heavy rain. Images from Pattani showed knee-high waters lapping at shuttered shopfronts and a rescue team evacuating some residents by boat. ‘The flood level is high, so it’s impossible to move our belongings elsewhere,’ one resident in Pattani told Thai broadcaster PBS. ‘We have to sacrifice them.’ Malaysia’s National Disaster Command Centre said it had mobilised a team to aid rescue operations in affected states. The weather offices of both countries have forecast heavy rain until at least Saturday. Floods are an annual phenomenon in Malaysia and southern Thailand. Malaysia Deputy Prime Minister Ahmad Zahid Hamidi said Thursday that the floods were ‘expected to be more severe than in 2014’ -- when about 118,000 people fled their homes -- according to the official Bernama news agency. Thousands of emergency services personnel have been deployed in flood-prone states along with rescue boats, four-wheel-drive vehicles and helicopters, Zahid, who chairs the National Disaster Management Committee, was also quoted as saying.",https://www.newagebd.net/post/asia/251518/floods-kill-8-thousands-evacuate-in-malaysia-thailand
CA’s press secretary urges journalists to fight Indian media’s misinformation campaign with truth,"Bangladesh interim government chief adviser’s press secretary Shafiqul Alam has encouraged journalists and editors to talk to the Indian media to confront the misinformation campaign coming from some of the Indian media outlets and their social media platforms. ‘We must tell our stories our way. Else, they will set our narrative according to their liking,’ he said, highlighting the importance of getting empowered by the truth to fight against misinformation campaign. Alam, in Facebook post from his verified account, said Indians should know that smart people also live in its Eastern border and a few months back these people ousted a ‘brutal dictatorship’ in one of the finest revolutions in human history. The press secretary said he was happy to see some of the journalists were speaking to the Indian media, especially their TV stations. ‘Many of us were afraid that we would struggle against the verbal onslaught of their TV hosts,’ Alam observed. He said some had defied fears and they are ‘boldly telling our side of the story.’ Alam said they had realised that it was time to confront an ‘industrial scale misinformation campaign’ coming from some of the Indian media outlets and their social media platforms. The press secretary said he knew they would make mistakes and they would also be intimidated. ‘Some may get the impression that the Indians are smarter people. But believe me, if you are empowered by the truth, no misinformation campaign can stop you,’ Alam said.",https://www.newagebd.net/post/country/251517/cas-press-secretary-urges-journalists-to-fight-indian-medias-misinformation-campaign-with-truth
Electoral offenders should be punished: Badiul Alam,"Chief of the electoral reform commission Badiul Alam Majudar on Friday said that the perpetrators of crimes committed in the last three general elections should be punished. ‘Those who committed electoral crimes in the last three elections should be punished. The election commission committed the biggest crimes,’ he said. Badiul Alam was addressing a shadow-parliament [debate] on the ‘role of the EC, candidates and citizens for a fair election’, organised by Debate for Democracy at the Bangladesh Film Development Corporation in Dhaka. He said that the government was the most important partner in the elections after the EC. If the government didn’t help, it wouldn’t be possible even for a neutral election commission to conduct a fair election. About the newly constituted election commission, headed by AMM Nasir Uddin, the reform commission chief said that a tree was known by its fruits. ‘But, there is no big challenge for this EC. Because, unlike last time, there is no pressure from the ruling political party,’ he said. Badiul Alam said that many media didn’t provide true information about the last three national elections. ‘The role of the media in elections is important. But in the last three elections, some media deliberately did not tell the truth, while some others were even forced not to tell the truth,’ he said. The reform commission chief said that ensuring the participation of women voters and expatriate voters could be a challenge for the election commission. Citing that the election system reform is important, he added, ‘But time must be given for reform [in the electoral system].’",https://www.newagebd.net/post/country/251516/electoral-offenders-should-be-punished-badiul-alam
Fire breaks out at agro-products warehouse in Mymensingh,"A fire broke out at a warehouse of agricultural products in BSCIC area of Mymensingh Sadar upazila on Friday, said fire officials. Motiur Rahman, deputy director of Fire Service and Civil Defence (FSCD) department in Mymensingh, said the fire originated from the warehouse around 10:45am and engulfed a bakery adjacent to it. Being informed, six firefighting units from several stations rushed to the spot and are working to tame the flame, he said. The cause of the fire couldn’t be known immediately, he said, adding that details about the incident will be shared later. ",https://www.newagebd.net/post/country/251514/fire-breaks-out-at-agro-products-warehouse-in-mymensingh
