title,content,link
WTO chief reappointed as Trump threat looms,"World Trade Organisation chief Ngozi Okonjo-Iweala was reappointed Friday for a second term, in the shadow of the coming return of Donald Trump and his disdain for international trade rules. Okonjo-Iweala, the first woman and the first African to head the WTO, was the only candidate in the race, and had been all but assured a second term. The organisation’s 166 members ‘today agreed to give incumbent Ngozi Okonjo-Iweala a second term as director-general,’ the WTO said in a statement. The 70-year-old Nigerian’s reappointment was approved by consensus during a special meeting of the organisation’s General Council, held behind closed doors, the WTO said. Her current term ends in August 2025, and the appointment process for the next  mandate had initially been scheduled to take months. But with Okonjo-Iweala the only candidate, African countries called for the process to be speeded up, officially to facilitate preparations for the WTO’s next big ministerial conference, set to be held in Cameroon in 2026. The unstated objective is to ‘accelerate the process, because they did not want Trump’s team to come in and veto her as they did four years ago’, said Keith Rockwell, a senior research fellow at the Hinrich Foundation. The common practice of appointing directors-general by consensus made it possible in 2020 for Trump to block Okonjo-Iweala’s appointment for months, forcing her to wait to take the reins until after President Joe Biden entered the White House in early 2021. The overwhelming support for Okonjo-Iweala’s second term came ‘not so much (because) everyone loves Ngozi’, a source close to the discussions told AFP. Rather, members were ‘worried that if she doesn’t get reinstated, then it’s possible that the administration in Washington would slow things (or) block other contenders’, leaving a void at the top, the source said. ‘The alternative of no-one leading the organisation is unacceptable to them.’ Rockwell, a former WTO spokesman, told AFP that speeding up Okonjo-Iweala’s reappointment ‘creates tensions in the relationship with the United States, for sure — tensions which would probably have been there under any circumstances, but now this raises the stakes’. During Trump’s first term, the WTO faced relentless attacks from his administration, which crippled the organisation’s dispute settlement appeal system, and also threatened to pull the United States out of the organisation altogether. And Trump has already signalled he is preparing to launch all-out trade wars, threatening to unleash a flurry of tariffs on China, Canada and Mexico on his first day in office on January 20. ‘The festival of tariffs announced to date shows that he has no intention of following any rules,’ said Elvire Fabry, a researcher at the Institut Jacques Delors think-tank. ‘The United States would not even need to withdraw from the WTO,’ she told AFP. ‘They are freeing themselves from the WTO rules’. In this context, the WTO chief will have ‘a fire-fighter role’, she said. It will be a question of ‘saving what can be saved, and making the case that there is no real alternative to the WTO rules’, said another source close to the discussions on speeding up Okonjo-Iweala’s reappointment. ‘It will be a very difficult mandate, with little certainty about what will happen.’ Rockwell noted that the WTO’s problems were not solely linked to Washington. ‘It is a time right now in which application of the WTO rules has deteriorated,’ he said. ‘You can’t blame all of this on the United States. That’s true of many other members as well.’ Dmitry Grozoubinski, author of the book ‘Why Politicians Lie about Trade’, agreed. ‘Governments are increasingly turning to trade measures to address issues like national security, environmental competition, and re-industrialisation, and policymakers aren’t as moved as they once were by arguments that their ideas violate the letter or spirit of WTO commitments,’ he told AFP. ‘If president-elect Trump makes destroying the WTO a priority,’ he said, the organisation’s ‘options will be limited as the institution is not built to withstand overt demolition from within its membership’. Since taking the WTO reins, Okonjo-Iweala has tried to breathe new life into the fragile organisation, pushing for fresh focus on areas like climate change and health. But pressure is growing for WTO reform, in particular of the moribund appeals portion of its dispute settlement system, which collapsed during the first Trump presidency as Washington blocked the appointment of judges.",https://www.newagebd.net/post/trade-commerce/251544/wto-chief-reappointed-as-trump-threat-looms
Thousands in Italy strike over low purchasing power and pay,"Thousands of Italians took part in a general strike Friday to protest low wages and purchasing power, although its impact on transport was limited. The strike, called by two union confederations, was set to last eight hours in all sectors except transport, where far-right transport minister Matteo Salvini ordered it halved it to four hours. The country’s main union — the left-wing CGIL — and the centrist UIL called the strike in protest at the draft 2025 budget tabled by the hard-right government of prime minister Giorgia Meloni, calling it ‘totally unsuitable to resolve the country’s problems’. They want to see ‘an increase in purchasing power for employees and retired people, as well as funding for health, education, public services and industrial policies’, the CGIL said in a statement. Italy, like France, has been singled out by the European Union for its huge deficit. It is under intense pressure to balance the books and slash its huge public debt, which is currently hovering at around three trillion euros ($3.2 trillion). Meloni’s government has committed to reducing the public deficit to 2.8 per cent of gross domestic product from 2026 –- below the ceiling of 3.0 per cent of GDP set by the European Union. The tough target will require cuts in tax rebates and budget cuts for many ministries and public services. Italy’s second-largest union, the centre-right CSIL, did not taking part in the strike. CSIL boss Luigi Sbarra on Thursday called it a ‘sterile, demagogic, populist protest’ at a time when the draft budget has not yet been finalised. The eight-hour stoppage affected numerous private and public sectors, including education, industry, healthcare, post office services and courts. The limited strike for public bus, metro and tram services lasted just four hours, from 9:00am (0800 GMT) to 1:00pm. The shorter time was ordered by minister Salvini — also Meloni’s deputy prime minister — under a law that limits strike time to maintain minimum service. The national airline ITA cancelled 109 flights Friday, including 18 international ones, while Ryanair cancelled ‘a small number of flights’. Besides Rome, thousands of people demonstrated in Milan, Naples, Bologna and Palermo. ‘The government has betrayed everything it told its voters,’ in particular that ‘it would have improved the conditions of workers,’ the CGIL’s Daniele Canti told AFPTV at the demonstration in the capital. Train transport was not affected as rail workers downed tools at the weekend and Italian law prevents them striking again for at least 12 days.",https://www.newagebd.net/post/economy/251543/thousands-in-italy-strike-over-low-purchasing-power-and-pay
Salehuddin for inclusive public financial management reform,"Finance adviser Salehuddin Ahmed on Friday underscored the need for a triangular approach to public financial management or PFM, integrating the efforts of the public sector, private sector and citizens to ensure efficient, transparent and accountable financial services. ‘In our country, the main bottleneck is the institution itself. We have good programmes and plans, but we must focus on implementation by aligning these with our institutional capacity and commitment,’ he said while speaking as chief guest at ‘Review Workshop on the 3rd PFM Reform Strategy 2025-2030’ at a training centre in Gazipur, said a press release. The workshop, organised by the Finance Division with support from the World Bank, aimed to finalise technical notes based on insights gathered from 31 consultation workshops held in recent months. Finance secretary Md Khairuzzaman Mozumder presided over the event while Finance Division additional secretary and national programme director of e Strengthen Public Financial Management Programme to Enable Service Delivery, or SPFMS, Bilquis Jahan Rimi and lead governance specialist (financial management) of the World Bank Suraiya Zannath spoke on the occasion. Senior officials from the Finance Division, representatives from the World Bank, and other development partners participated in the event. Salehuddin Ahmed stressed that the upcoming reform strategy should be straightforward, actionable and tailored to address Bangladesh’s unique challenges. Khairuzzaman Mozumder highlighted the government’s achievements in public financial reform. He pointed out how automation in salary disbursement and pension management had enhanced  efficiency and transparency. ‘For instance, electronic fund transfers now ensure that salaries reach employees on the first day of each month, which used to take 8-9 days. Similarly, the pension management system has been automated, eliminating delays and ensuring life verification. These reforms have expanded into private domains, such as the government-to-person or G2P payment system, which supports corruption-free social safety net programmes,’ he added. According to the press release, public financial management is pivotal to Bangladesh’s vision of achieving fiscal discipline, macroeconomic stability and sustainable development. It provides a framework for strategic resource allocation across agriculture, industrialisation and services to drive inclusive growth. As Bangladesh prepares its third PFM reform strategy, it is essential to identify gaps in previous reforms and reflect on the effective use of public funds. This requires sequencing reforms into three types: process reforms for efficiency, structural reforms for modernisation and institutional reforms for strong governance. Adapting global best practices while considering Bangladesh’s unique context is key. The inclusion of a clear action plan within the strategy will ensure cost-effectiveness, clarity, and better implementation. Ownership and commitment to this strategy are crucial, as it represents a shared responsibility to manage public resources equitably and effectively for all citizens. With unity and determination, Bangladesh can build a robust PFM system that supports a prosperous and sustainable future.",https://www.newagebd.net/post/economy/251542/salehuddin-for-inclusive-public-financial-management-reform
Bangladesh slips a notch in mobile internet speed: Ookla,"Bangladesh has slipped a notch in its global ranking for mobile internet speed performance, according to Ookla’s Speedtest Global Index. The country stood at 89th place out of 111 countries in Ookla’s mobile internet speed index for October. The country previously held the 88th position in September. The index highlighted that the average mobile internet download speed in Bangladesh decreased to 27.56 Mbps in October from 28.42 Mbps in September. Globally, United Arab Emirates held the top position of the list, offering the fastest mobile internet with an average speed of 428.53 Mbps in the reporting period. This is up from 413.14 Mbps, showing that UAE continues to provide high-speed internet to its users. Neighbouring country India also ranked high, holding the 26th position with an average download speed of 95.67 Mbps in October. India has remained in the same position it held in September, although the median download speed saw a slight increase from 91.72 Mbps. Among the other South Asian countries, Maldives is at 25th position, Pakistan at 100th, Sri Lanka at 103th and Afghanistan is at 111th position in terms of mobile internet speed. The October report did not include data from Myanmar. Bangladesh’s mobile network landscape is dominated by five major providers, namely Banglalink, Grameenphone, Robi, Airtel and Teletalk. Among them, Banglalink has emerged as the fastest internet provider. According to the report, 89 per cent of Banglalink’s tests showed a minimum download speed of at least 5 Mbps and an upload speed of at least 1 Mbps. In addition to mobile internet, Bangladesh also deteriorated in fixed broadband speed. The country has moved down three places to rank 101th globally among 158 countries, compared to its previous position of 108th. The report states that the median fixed broadband download speed in October was 48.06 Mbps compared with 48.38 Mbps reported in the previous month. Ookla’s Speedtest Global Index, which provided these rankings, is a widely recognised tool that compares internet speeds across the world.",https://www.newagebd.net/post/telecom/251541/bangladesh-slips-a-notch-in-mobile-internet-speed-ookla
"Prices of vegetables, onions, potatoes remain high","Vegetables, onions, potatoes and edible oil continued to be sold at high prices, while the prices of coarse rice, broiler chicken and eggs dropped slightly on Dhaka’s kitchen markets over the week ending Friday. Traders said that the prices of vegetables, onions and potatoes remained high due to a lack of adequate supply as the production of early varieties of the items was hampered due to flood and downpour in many parts of the country. They said that vegetables had started to appear on the market, but the supply remained insufficient. Traders also said that while the price of edible oil remained high, a supply shortage of packaged soya bean oil emerged on the market, whereas the availability of unpackaged oil increased over the week. The prices of most of the vegetables remained high on the kitchen markets over the week. Aubergine sold for Tk 80-100 a kilogram, papaya for Tk 40-50 a kilogram, bitter gourd for Tk 80-100 a kilogram, pointed guard for Tk 50-60 a kilogram, okra for Tk 60-70 a kilogram, string beans for Tk 80-90 a kilogram, teasel gourd for Tk 70-80 a kilogram, ridge gourd for Tk 60-70 a kilogram, snake gourd for Tk 60-70 a kilogram, beans for Tk 60-70 and tomato for Tk 150-160 a kilogram on Friday. The price of green chillies remained stable and the item sold for Tk 100-140 a kilogram in the city on the day. The price of potatoes remained excessively high and the item sold for Tk 75-80 a kilogram on the city’s kitchen markets on Friday. The prices of onions also remained high and its local variety sold for Tk 130-140 a kilogram while the imported item sold for Tk 100-110 a kilogram on Friday. The prices of edible oil also remained high over the week and unpackaged soya bean oil sold for Tk 165-168 a litre while the packaged item sold for Tk 170 a litre on Friday. A five-litre bottle of soya bean oil sold for Tk 815 on the city markets. Palm oil sold for Tk 160-162 a litre on the city markets on the day. Although the prices of coarse rice decreased slightly, the prices of the staple food remained high. The coarse and medium-quality varieties of rice sold for Tk 53–60 a kilogram on Friday. Lower-grade Miniket sold for Tk 70-75 a kilogram over the week. The fine variety of Miniket sold for Tk 78–82 a kilogram and Najirshail for Tk 80-90 a kilogram on Friday. The prices of broiler chicken decreased by Tk 10 a kilogram and the item sold for Tk 170-200 a kilogram while Sonalika variety of chicken sold for Tk 280-290 a kilogram on the day. The prices of garlic remained high and its local variety retailed at Tk 230–260 a kilogram while imported garlic sold for Tk 220–240 a kilogram on the day. The price of sugar remained high over the week and the item sold for Tk 135-140 a kilogram on Friday. The price of eggs decreased by Tk 2 a hali (four pieces) and the item sold for Tk 48-50 a hali on the city’s kitchen markets on Friday. Rohita sold for Tk 300–450 a kilogram and Katla for Tk 300–450 a kilogram, depending on size and quality. Pangas sold for Tk 200–230 a kilogram and Tilapia for Tk 220–230 a kilogram on Friday. The coarse variety of red lentil sold for Tk 105-110 a kilogram and the medium-quality variety for Tk 115–120 a kilogram on Friday. The price of fine variety of red lentil remained high and the item sold for Tk 135–140 a kilogram on Friday.",https://www.newagebd.net/post/commodities/251540/prices-of-vegetables-onions-potatoes-remain-high
France arrests 26 as South Asian migrant trafficking ring smashed,"French authorities arrested 26 people and seized 11 million euros ($12 million) as they smashed a migrant trafficking ring suspected of bringing several thousand people from South Asia into France, border police said on Thursday. Charging between 15,000 and 26,000 euros per person, the traffickers are suspected of having smuggled several thousand people from India, Sri Lanka and Nepal into France since September 2021, the force said. Authorities estimate the network generated several million euros in illegal profits, which were laundered through construction companies, gold trafficking and informal transfers of money back to South Asia. The arrests took place between March and November 2024, said Julien Gentile, director of the French border force at Paris Charles De Gaulle airport. ‘The smugglers facilitated migrants’ travel to the European Union via Dubai or African states, while providing them with illegally obtained tourist, work or medical visas,’ said Gentile. The head of the network is still at large, with France’s request for his extradition from Dubai yet to be agreed, according to the border force. Of the 26 men arrested, 15 were placed in pre-trial detention with seven under judicial supervision. The remaining four, who were recently arrested, were to be presented on Thursday to the investigating judge. The 11 million euros’ worth of assets included properties, luxury cars, jewellery and gold. Those arrested are accused of belonging to different levels of the gang, ranging from smugglers to money launderers and shady finance brokers. ‘This is the exceptional nature of the case,’ Gentile added. Details of the investigation by France’s Office for the Fight against the Illicit Traffic of Migrants, were released with migration becoming a key issue for French political parties. The conservative government that took office in September has said it will clampdown, while France has also faced pressure over undocumented migrants crossing the Channel to Britain from its northern coast. Interior minister Bruno Retailleau was to visit the Calais region on Friday for talks with local mayors on the migrant crisis. At least 72 undocumented migrants have died this year trying to cross the Channel. The mayors have asked for more police and a tougher clampdown on the smuggling gangs. Retailleau is also to go to London on December 8-9 for talks on the migrants. Human trafficking carries a potential sentence of up to 20 years in France. In December 2023, a plane carrying hundreds of Indian passengers was grounded for days at Vatry airport east of Paris over concerns it was part of a human trafficking scheme. The plane had taken off from the United Arab Emirates and was detained after an anonymous tipoff.",https://www.newagebd.net/post/europe/251539/france-arrests-26-as-south-asian-migrant-trafficking-ring-smashed
Macron unveils Notre Dame after restoration,"French president Emmanuel Macron on Friday inspected the gleaming restored interior of Notre Dame cathedral, saying workers had done the ‘impossible’ by healing a ‘national wound’ caused by a 2019 fire that ravaged the mediaeval landmark. Eight days ahead of the December 7 reopening of the cathedral, Macron conducted an inspection, broadcast live on television, which provided the first official insight into how the 850-year-old edifice now looks inside. ‘You have achieved what was thought impossible,’ Macron told workers and officials who packed Notre Dame after the French president toured the cathedral. ‘The blaze at Notre Dame was a national wound, and you have been its remedy through will, through work, through commitment,’ he said, adding the cathedral’s re-opening will be a ‘shock of hope.’ ‘This is an immense source of pride for the entire nation,’ Macron said, expressing hope that the spirit of ‘fraternity’ would endure. Notre Dame will welcome visitors and worshippers again over the December 7-8 weekend, after a sometimes challenging restoration to return the imposing Paris cathedral to its former glory after it was badly damaged by fire on April 19, 2019. World leaders are expected to attend but the guest list has yet to be revealed. The French president is hoping the re-opening of Notre Dame will be a major feather in his cap amid the current political deadlock following early parliamentary elections this summer. ‘We were told many times at the beginning that it wouldn’t be possible, that it was crazy, that it was arbitrary, that we were going to do it wrong,’ Macron said. ‘But in the end,’ he added, ‘you did it.’ Macron toured the key areas of the cathedral, including the nave, choir and chapel, and spoke to experts. ‘Sublime,’ said a visibly pleased Macron, who was accompanied by Paris’ archbishop Laurent Ulrich, the culture minister, the mayor of Paris and other officials. ‘It is much more welcoming,’ he added, praising Notre Dame’s pale-coloured stones and saying everyone involved in the reconstruction should ‘be proud’. After the devastating fire Macron set the ambitious goal to rebuild Notre Dame within five years and make it ‘even more beautiful’ than before, a target that the French authorities say has been met. The ‘building site of the century’ was a ‘challenge that many considered insane’, Macron has said. Some 250 companies and hundreds of experts were brought it for restoration work costing hundreds of millions of euros. All 2,000 people who contributed to the effort had been invited to Friday’s event. The restoration cost a total of nearly 700 million euros (more than $750 million at today’s rate). It was financed from the 846 million euros in donations that poured in from 150 countries in an unprecedented surge of solidarity. The 19th-century gothic spire has now been resurrected with an exact copy of the original, the stained windows have regained their colour, the walls shining after fire stains cleaned and a restored organ ready to thunder out again. Unseen to visitors is a new mechanism to protect against any future fires, a discreet system of pipes ready to release millions of water droplets in case of a new disaster. Notre Dame, which welcomed 12 million visitors in 2017, expects to receive an even higher figure of 14 to 15 million after the reopening, according to the church authorities. French ministers have also floated the idea of charging tourists an entrance fee to the site but the Paris diocese has said free admission was an important principle to maintain. Macron had hoped to speak inside Notre Dame to mark the reopening but after negotiations with the diocese, he was now set to speak in the forecourt only. France is by its constitution a secular country with a strict division between church and state. The next day, Sunday December 8, will see the first mass and consecration of the new altar. Macron said in December 2023 he had invited Pope Francis to the reopening of the cathedral but the head of the Catholic church announced in September, to the surprise of some observers, that he would not be coming. Instead, the pontiff is making a landmark visit during the subsequent weekend to the French island of Corsica. The French Catholic church has in recent years been rocked by a succession of sexual abuse allegations against clerics, including most recently the monk known as Abbe Pierre who became a household name for providing aid to the destitute. Over five years on, the investigation into what caused the fire is on-going, with initial findings backing an accidental cause such as a short circuit, a welder’s torch or a cigarette.",https://www.newagebd.net/post/europe/251538/macron-unveils-notre-dame-after-restoration
