title,content,link
England on verge of wrapping up first New Zealand Test,"A sustained seam attack by Chris Woakes and Brydon Carse following a belligerent batting effort saw England on the verge of wrapping up the first Test at stumps on day three in Christchurch on Saturday. New Zealand were 155-6 at the close, ahead by just four runs and with only four wickets remaining. Daryl Mitchell was not out 31 with Nathan Smith on one. England made 499 in their first innings, an imposing 151-run lead, led by Harry Brook's 171. ‘We're in an amazing position to go on and win the game,’ said Brook, who benefitted from five dropped catches. ‘I had a lot of luck, didn't I. and thankfully I cashed in.’ New Zealand were hurting at the fielding errors with Brook adding 153 after he was first dropped on 18. ‘Fielding's something we pride ourselves on and that's the part that hurts,’ said seamer Matt Henry. ‘We work hard on it and it's usually where we turn a game on its head. So obviously it hurts when chances go down.’ Brook's knock was supported by 80 from captain Ben Stokes and 77 from Ollie Pope. It was then the turn of England's seamers as New Zealand's salvage attempt faltered at the start with Tom Latham caught by Brook for one to give Woakes his first wicket in the third over. Devon Conway was on eight when his attempt to pull Carse to the boundary was miscued to Gus Atkinson at mid-on and New Zealand were tottering at 23-2. Kane Williamson and Rachin Ravindra set about stitching the innings together as they put on 41 for the third wicket before Ravindra went for 24. The left-hander could not resist pulling a short ball from Carse but failed to get on top of the bounce and was caught by Jacob Bethell waiting at mid-wicket. Woakes returned to remove Williamson and Tom Blundell in successive balls to end the day with 3-39. Williamson, so often called upon to rescue his country, was unruffled until on 61 -- his second half-century of the Test -- he missed a straight delivery and was trapped lbw. With his next ball, Woakes found the faintest edge of Blundell's bat but he was denied a hat-trick by Glenn Phillips who pushed a short ball towards the covers. Phillips progressed to 19 before he was given out lbw to a Carse delivery that nipped back. New Zealand sought a review but replays showed the ball was skimming the bails and the decision was the umpires call and Carse had 3-22. England resumed the day at 319-5 and raced along at six an over before being all out after lunch. A masterful Brook, who benefitted from five of the eight catches spilled by New Zealand, led England's rescue after they were left reeling at 71-4. The only good news for New Zealand was that while they dropped two more catches on day three, they successfully held five. Brook relished his lives. He smiled and looked to the heavens when Phillips spilled a chance on 147, having been dropped the previous day on 18, 41, 70 and 106. Four overs after his last reprieve, he brought up his 150 in imperious fashion, charging down the wicket at Tim Southee and driving him to the cover boundary. But when New Zealand found a way to make catches stick, Brook's innings, which included 15 fours and three sixes, came to an end. A good length ball from Matt Henry found a faint outside edge and wicketkeeper Blundell grasped the opportunity. The applause as Brook left the ground was as much for New Zealand holding a catch as it was for a magnificent innings. Woakes (one) was out on the second ball he faced with Latham scooping up a low-level chance at second slip. Smith ended Atkinson's breezy innings with Phillips taking a smart catch at long leg. Henry was the most successful New Zealand bowler with 4-84. Smith took 3-141.",https://www.newagebd.net/post/cricket/251615/england-on-verge-of-wrapping-up-first-new-zealand-test
BNP iterates call for vigilance over recent incidents,"The Bangladesh Nationalist Party on Saturday called for a thorough review of the recent incidents, alleging that they were occurring behind the facade of religion, and urged all to remain vigilant. ‘We must look deeply into the incidents happening in the name of religion. We need to be alert,’ BNP standing committee member Amir Khasru Mahmud Chowdhury said at the 7th National Council of Gonoforum, held at the Institution of Engineers, Bangladesh. Referring to recent developments in Chattogram and other parts of the country, the BNP standing committee member expressed his concern, terming the incidents totally unexpected. Those who had not taken to the streets in the past 16 years were now staging demonstrations, he said, adding that other driving forces were behind them, and it should not be ignored. Highlighting the challenges facing the country, Khasru stressed that moving towards a vision of a democratic and peaceful Bangladesh was imperative at the moment. ‘We need to take the country to the place we have always dreamt of. In the past, when this vision was not pursued, it gave rise to monsters. The only way forward is through a peaceful transfer of power,’ he said. Khasru reiterated the need for democracy for restoring people’s ownership over the country. He also pointed out that his party’s 31-point state reform outline was a significant contribution to future governance. The BNP leader assured that after the next election and formation of a national government, implementation of the 31-point reform plan would be prioritised. ‘There is no need for others to worry about reforms,’ Khasru said, adding that the focus should be on electoral reforms to ensure the country’s return to its rightful owners—the people.",https://www.newagebd.net/post/politics/251614/bnp-iterates-call-for-vigilance-over-recent-incidents
Bangladesh women cruise to ODI series win over Ireland,"Bangladesh women put on a collective performance as they beat their Irish counterparts by five wickets in the second ODI to take an unassailable 2-0 lead in the three-match series at the Sher-e-Bangla National Stadium on Saturday. Chasing a target of 194 to win, the hosts cruised to 197-5 with 37 balls to spare. This was their third-highest successful run chase overall, highest at home and against Ireland. Captain Nigar Sultana Joty played a key role in the middle-order with her 40 off 39 while opener Fargana Haque hit her second consecutive fifty, with Sharmin Akter and Sharna Akter all contributing after the bowlers restricted Ireland to 193-6. For Joty, securing two points in the ICC women's championship was more important than the series victory, but the win was a testament to their hard work. ‘These cricketers have been working hard for a long time. When you can’t win, there’s negativity around. But a win is huge for the team,’ Joty, who was adjudged as the player of the match, told reporters after the win. Opting to bat first, Ireland lost both openers cheaply as the spin duo Nahida Akter and Sultana Khatun struck each. Amy Hunter and Orla Prendergast then put on a 91-run partnership for the third wicket to give Ireland a foundation. But they fell in consecutive overs. Prendergast (37) was run out while Hunter was trapped lbw by part-timer Sharna after making 68 off 88 balls. Una Raymond-Hoey’s 18-ball 21 and Laura Delany’s 33 then lifted Ireland close to 200. But Joty admitted that their bowling could’ve been better. Seven bowlers were used by her, with Sultana Khatun grabbing two wickets while Nahida and Sharna took one wicket apiece. In chase, Bangladesh wobbled twice. First when Murshida Khatun fell at the beginning. But Fargana and Sharmin—the stars of the previous match—added 85 runs for the second wicket to steady the ship. Fargana fell after making 50 off 89—her 12th half-century; Sharmin followed her with seven shy of her milestone. Bangladesh wobbled a bit again, but a timely innings from Joty with the help of Sharna (29*) and Sobhana Mostary (16) saw them home. Batting was the main concern for Bangladesh leading into the series, but they stood up in the first two matches. Joty believed that the most important part of the game was to maintain consistency. ‘Today [Saturday] morning, the message I gave to the cricketers was that to be consistent is the key. We should repeat the batting performance of the first match,’ she said. ‘Consistency is important. We lost many matches due to our batting failures. From that point, batters getting runs is a relief. But the question remains: whether we could repeat that in the next match. That challenge remains.’ The third and final ODI will be held at the same venue on Monday. After that, both teams will move to Sylhet, where they will compete in a three-match T20I series starting on December 5. ",https://www.newagebd.net/post/cricket/251613/bangladesh-women-cruise-to-odi-series-win-over-ireland-
Stay Warm This Winter: Geysers and Water Heaters in High Demand Across Bangladesh,"As winter approaches, families across Bangladesh are rushing to purchase geysers and water heaters to combat the seasonal chill. Here's what you need to know about this growing trend. With the winter season just around the corner, the demand forgeysers and water heatersis surging across Bangladesh. Retailers report a noticeable increase in sales as families prepare to make their homes winter-ready. For many, access to hot water has become a necessity rather than a luxury, particularly in regions where temperatures dip significantly during this time of year. “Every year, we see a spike in demand from late November onward,”said a retailer at Dhaka’s popular Katabon electronics market.“People are more proactive now, especially as winter temperatures have been harsher in recent years.” In colder regions like Rangpur, Dinajpur, and Sylhet, winter temperatures can drop to as low as 6–8°C, making daily tasks like bathing and cleaning a challenge without warm water. Hot water has become an essential part of maintaining health and hygiene during the winter months, particularly for children and elderly family members who are more vulnerable to the cold. As a result, many families now consider geysers a vitalhome appliance, not just a convenience. Bangladesh’s market for geysers and water heaters is diverse, with options catering to households of all sizes and budgets. Popular choices include electric storage geysers, instant water heaters, and gas-powered models. The price of geysers in Bangladesh varies depending on the type, capacity, and brand. Leading retailers likeStar Techoffer a range of options, including popular brands like Shameem Tropica, Midea, and Haier, catering to different customer needs. These brands are recognized for their durability and energy efficiency, offering solutions for both budget-conscious buyers and those looking for premium models. Mid-range water heaters are priced between ৳9,000 and ৳15,000, while more advanced electric storage geyser models can reach up to ৳100,000. International brands like Ariston and Rheem are also sought after by customers who prioritize advanced features and long-term reliability. Popular capacities for electric storage geysers typically range from 10 liters to 50 liters, with 30-liter models being the most common choice for small to medium-sized families. Retailers like Star Tech are making sure that there is a variety of options to suit every budget, providing customers with a wide selection to choose from as they prepare for the winter season. Rising electricity costs have made energy efficiency a key consideration for buyers. Appliances with higher energy ratings may have a higher upfront cost but result in significant savings over time. Smart water heaters with features like IoT connectivity and programmable timers are also gaining popularity. These devices allow users to control the heater remotely, schedule heating cycles, and monitor energy consumption through smartphone apps. “Smart geysers are a game-changer as they’re convenient and help consumers to save energy and money, which is a win-win.”, said a technician from an electronics service center in Dhaka. To ensure long-lasting performance, experts recommend regular maintenance of geysers and water heaters. Sediment buildup in storage tanks can reduce efficiency, so it’s essential to flush the tank every few months. Other tips include insulating water pipes to minimize heat loss, turning off the heater when not in use, and routinely checking safety features like the thermostat and pressure valves. “Proper maintenance can extend the lifespan of a geyser by several years,”said an engineer from a local repair shop.“It also ensures the appliance runs safely and efficiently.” With the winter chill fast approaching, households across the country are prioritizing their preparations. From warm clothing to reliable water heaters, families are taking every measure to stay comfortable during the colder months. “Bangladesh’s winters may not be as harsh as in some countries, but they still demand lifestyle adjustments, moreover nowadays geysers are as essential as a warm blanket for many of us.” said a homeowner in Mymensingh. For those considering a geyser or water heater, now is the time to buy. With options available for every budget, it’s easier than ever to ensure your family’s comfort this winter.",https://www.newagebd.net/post/miscellany1/251612/stay-warm-this-winter-geysers-and-water-heaters-in-high-demand-across-bangladesh
Citizens want service-oriented police force,"Discussants at a seminar in Dhaka on Saturday said that the Bangladesh Police needed a comprehensive reform plan to overcome the negative image the force had achieved in the past 16 years. They said that structural legal reform was crucial to transform the police into a service-oriented force. Non-government organisation Humanity Foundation hosted the discussion at the Centre on Integrated Rural Development for Asia and the Pacific auditorium in Dhaka, said a press release. Former inspector general of police Mohammad Nurul Huda said that political will was crucial to make police reform effective. He suggested that personnel on deputation from other forces should undergo at least six months of police training before joining any police unit. Golam Rasul, a former deputy inspector general of police and a member of the police reform commission, suggested exploring the feasibility of establishing a separate police commission outside the Bangladesh Civil Service framework. Former DIG Mesbahun Nabi blamed the lack of good governance for the lack of quality policing, noting that extrajudicial killings started with the induction of personnel from other forces. Lawyer Muhammad Shafiqul Rahman criticised the absence of public discourse on police reforms, stating that even protests or human chains addressing the issue are rare. Chaired by the foundation’s chairman, Muhammad Shafiqul Rahman, former Supreme Court registrar and district judge Ikhtedar Ahmed, former chair of the Department of History at Jahangirnagar University professor Mohammad Mujahidul Islam, vice-chancellor of Global University professor Anisuzzaman, former police officer Mazharul Haque, a central leader of Hefazat-e-Islam Bangladesh maulana Monir Hossain Qasemi,  Rashtra Sanskar Andolon leader Zakia Shishir, among others, also participated in the discussion.",https://www.newagebd.net/post/country/251611/citizens-want-service-oriented-police-force
BCL burns Yunus’ photo after brief procession,"Leaders and activists of Bangladesh Chhatra League, the student organisation of the Awami League, on Saturday brought out a brief procession in the Patuakhali town. The procession of the banned student organization began at Thanapara in the town at about 6:00am. It was allegedly led by Adnan Habib Khan, deputy relief secretary of the central committee of the organisation, and Aminur Rahman Sifat Khan, former assistant secretary of the district BCL. The procession ended in front of the Patuakhali Press Club, where the processionists demonstrated by setting fire to a photo of the chief adviser, Professor Muhammad Yunus. The processionists later circulated it on their Facebook. The district unit of the Jatiyatabadi Chhatra Dal, the student wing of the Bangladesh Nationalist Party, held a protest rally in the town in protest at this flash procession. Later, JCD district senior joint convener Al Amin Howlader led a procession that started from in front of Patuakhali Government College. The procession ended in front of the Sadar police station after parading main roads of the town. The protesters blocked the road in front of the police station, demanding immediate arrest of the BCL leaders and activists. Patuakhali Sadar police station officer-in-charge Md Imtiaz Ahmed said that the situation was brought under control. ‘I have heard about the procession. Legal action will be taken against the BCL people after identifying them,’ he added. Patuakhali deputy commissioner Mohammad Abu Hasnat Arifin said that some of the BCL leaders and activists had been identified and a drive to arrest the others was on.",https://www.newagebd.net/post/politics/251610/bcl-burns-yunus-photo-after-brief-procession
13 more killed in Pakistan sectarian clash,"Sectarian feuding in northwest Pakistan killed 13 more people, a local government official said Saturday, as warring Sunnis and Shiites defied repeated ceasefire orders in recent conflict claiming 124 lives. Pakistan is a Sunni-majority country, but Kurram district — in Khyber Pakhtunkhwa province, near the border with Afghanistan — has a large Shiite population and the communities have clashed for decades. Fresh fighting broke out last Thursday when two separate convoys of Shiite Muslims travelling under police escort were ambushed, killing more than 40. Since then 10 days of fighting with light and heavy weapons has brought the region to a standstill, with major roads closed and mobile phone services cut as the death toll surged. A Kurram local government official put the death toll at 124 on Saturday after 13 more people were killed in the past two days. Two were Sunni and 11 Shiite, he said, whilst more than 50 people have been wounded in fresh fighting which continued Saturday morning. ‘There is a severe lack of trust between the two sides, and neither tribe is willing to comply with government orders to cease hostilities,’ he told AFP, speaking on condition of anonymity. ‘Police report that many people want to flee the area due to the violence, but the deteriorating security situation makes it impossible,’ he added. A seven-day ceasefire deal was announced by the provincial government last weekend but failed to hold. Another 10-day truce was brokered Wednesday but it also failed to stymie the fighting. A senior security official in the provincial capital of Peshawar, also speaking anonymously, confirmed the total death toll of 124. ‘There is a fear of more fatalities,’ he said. ‘None of the provincial government’s initiated measures have been fully implemented to restore peace.’ Police have regularly struggled to control violence in Kurram, which was part of the semi-autonomous Federally Administered Tribal Areas until it was merged with Khyber Pakhtunkhwa in 2018. The Human Rights Commission of Pakistan said 79 people had been killed in the region between July and October in sectarian clashes. The feuding is generally rekindled by disputes over land in the rugged mountainous region, and fuelled by underlying tensions between the communities adhering to different sects of Islam.",https://www.newagebd.net/post/south-asia/251609/13-more-killed-in-pakistan-sectarian-clash
Murder case filed as protests on over killing of lawyer on Ctg court premises,"Four days after lawyer Saiful Islam Alif had been hacked to death in Chattogram, a murder case was filed with the Kotwali police against 31 named and 10–15 unidentified people early Saturday amid protest demanding justice for the killing. The victim’s father Jamal Uddin filed the murder case. Saiful’s elder brother Khane Alam filed another case with the same police station over attacks and vandalism carried out on a Chattogram court premises  against 116 named individuals and 400–500 unnamed people, said Chattogram Metropolitan Police additional deputy commissioner Kazi Md Tarek Aziz. With these two, five cases had been filed so far over the murder of assistant public prosecutor in Chattogram Saiful Islam Alif near court premises and clashes between members of law enforcement agencies and followers of Bangladesh Sammilita Sanatani Jagran Jote spokesperson Chinmoy Krishna Das Brahmachari on November 26. The killing and clashes happened when the police was taking Chinmoy Krishna Das, arrested in a sedition case to jail under a court order. Saiful’s family filed two cases and police filed three, all leading to, so far, arrest of 38 people, including nine allegedly identified for killing the lawyer. In Dhaka city on Saturday morning, Bangladesh Krishi Bank Jatiyatabadi Forum held a rally in front of the bank’s head office in Motijheel area, protesting at the killing. Speakers at the rally alleged that ousted fascist Awami League government killed the lawyer in a planned way to spark anarchy. The named accused in the murder case include Chandan, Aman Das, Shuvo Kanti Das, Bunja, Ranab, Bidhan, Bikash, Ramit, Rumit Das, Nayan Das, Gagan Das, Vishal Das, Omkar Das, Vishal, Rajkapur, Lala, Samir, Sohel Das, Shiv Kumar, Biglal, Parash, Ganesh, Om Das, Poppy, Ajay, Devi Charan, Dev, Joy, Durlav Das, Rajib Bhattacharya, all reportedly residents of the Bandel Road Sebak Colony under the city’s Kotwali police, according to the case documents. When the court ordered Chinmoy Krishna Das to be sent to jail rejecting his bail plea, his lawyers became agitated, made offensive remarks targeting the court, and caused chaos on the premises, the case statement said. Chinmoy followers blocked the prison van for about two–three hours, and when members of police, Border Guard Bangladesh and Ansar tried to disperse them, they created chaos chanting provocative slogans and vandalised 20–30 vehicles, the case statement added. Later that day, around 4:30pm, the accused allegedly targeted Alif due to his beard and attacked him with sharp weapons leaving marks in 21–22 places of his body. In the case statement, Alif’s father also alleged that after speaking with witnesses and his son’s colleagues, he discovered that the murder was carried out with direct and indirect instigation from leaders and activists associated with the Chhatra League, Juba League, Awami League, and other organisations affiliated to it. The lawyers’ death sparked protests in Dhaka and Chattogram as elsewhere in the country demanding justice and also a ban on ISKCON in Bangladesh. Chinmoy Krishna Das Brahmachari was formerly a leader of the International Society for Krishna Consciousness, ISKCON in short. Three leaders of banned student organisation Bangladesh Chhatra League, the student wing of the Awami League, meanwhile were arrested on Saturday in a case filed over vandalising a temple run by the ISKCON in Kishoreganj’s Bhairab. The arrested are Chhatra League Bhairab municipality unit joint general secretary Hasibul Hasan, library affairs secretary Md Sanjib and Bhairab upazila unit joint general secretary Md Pranto. Bhairab police officer-in-charge Md Shahin said that the incident occurred at ‘Sri Sri Hare Krishna Namhatta Sangha’ at Ranibazar Haludpatti in the upazila Friday afternoon. ‘We have so far arrested three suspects in connection with the incident. They are Chhatra League leaders,’ he said. Pranay Karmakar, a resident of the Tinpatti area of the town, filed the case with the Bhairab police against unidentified people, he said. At 5:00pm, 15–20 people attacked the temple with sticks, the case statement said.",https://www.newagebd.net/post/country/251608/murder-case-filed-as-protests-on-over-killing-of-lawyer-on-ctg-court-premises
Former-minister Asaduzzaman Noor assaulted at BSMMU,"Former minister Asaduzzaman Noor was assaulted by injured students of July-August movement when he was taken to Bangabandhu Sheikh Mujib Medical University from jail for treatment. Some injured victims of the movement attacked Noor when he was taken there for treatment in the afternoon, witnesses said. Bulbul Ahmed, an injured victim, alleged that the students were taken to director Brigadier General Rezaur Rahman’s room after the incident and the director seized the mobile phone set of the students. The director could not be reached over phone for comments. The former cultural affairs minister was arrested from Nawraton Colony on Bailey Road on September 16 and sent to jail in a murder case after the fall of Awami League government. Noor had represented the Awami League in Parliament since 2001. He was elected as the Member of Parliament for Nilphamari-2 in the most recent 12th National Parliament elections. He assumed the role of cultural affairs minister on January 13, 2014, following the Awami League’s victory in the 10th National Parliament elections held on January 5, 2013, and continued his full term till January 7, 2019.",https://www.newagebd.net/post/country/251607/former-minister-asaduzzaman-noor-assaulted-at-bsmmu
