title,content,link
Freeing Palestine from occupation urged,"International Day of Solidarity with the Palestinian People was observed on Friday in the country as elsewhere across the globe. The day was observed with a fresh call to free Palestine from occupation and put an end to violence on its land. Different political parties and public universities on the day organised programmes including protests, processions, and discussions to mark the day. The protesters also demanded excluding Israel from the United Nations and bringing it to book for mass killings in the International Court of Justice. Addressing a discussion at the National Press Club, Communist Party of Bangladesh general secretary Ruhin Hossain Prince said, ‘We have to defeat the capitalist United States and Israel. Israel must be expelled from the United Nations and it must face trial on charge of mass killing in the International Court of Justice.’ He said that Palestine must be declared as an independent and sovereign country. Chaired by the CPB president Mohammad Shah Alam, Palestine ambassador to Bangladesh Yousef Ramadan was also present at the event. On the occasion of the International Day of Solidarity with the Palestinian People, a ‘March for Palestine’ began at about 3:30pm at the Anti-Violence Raju Memorial Sculpture at Dhaka University attended by the students and others on Friday, New Age correspondent in Dhaka University reported. At the programme, a large national flag of Palestine was displayed and participants chanted slogans ‘Answer for genocide,’ ‘Free, free Palestine,’ ‘2024: Genocide no more,’ ‘Occupation no more,’ ‘From Arakan to Palestine, let there be freedom,’ ‘Child killing no more,’ and ‘Zionism no more,’ among others. A mass signature campaign in support of Palestine was also conducted. Then a procession carrying the large flag started from the Raju Memorial Sculpture, passed Ruqayyah Hall, the VC Chattor, and Fuller Road, before ending back at the Raju Sculpture. At the programme, Abu Baker Mojumder, a coordinator of the Student Movement Against Discrimination, said, ‘When we started our movement in July, the cries of the people of Palestine worked as our spirit. Therefore, on this day, we demand liberation of Palestine.’ Other leaders of the Student Movement Against Discrimination, the platform that spearheaded the student-led mass uprising, including coordinator Lutfor Rahman, Hasib Al Islam, Rifat Rashid, co-coordinator Mohiuddin, and others were present at the march for Palestine programme. Students of Jahangirnagar University, meanwhile, on the day brought out a protest procession from the campus Shaheed Minar, and after marching through several places on the campus ended back at the Shaheed Minar, the university correspondent at New Age reported. The protest procession was followed by a protest rally there.",https://www.newagebd.net/post/foreign-affairs/251591/freeing-palestine-from-occupation-urged
Buddhadev Bose’s birth anniv today,"Today is the 116th anniversary of birth of one of the prolific poet and essayist of Bangla literature Buddhadev Bose. Born in Cumilla on November 30, 1908, Buddhadev Bose’s ancestral home is at Malkhanagar in Munshiganj. Shortly after his birth, his mother died of tetanus and his father, Bhudev Chandra Bose, a lawyer of the Dhaka Bar, left home. The educationist, writer, and critic, was brought up by his maternal grandparents, spending his early life in Cumilla, Noakhali and Dhaka. He completed bachelor’s of arts in 1930 and master’s of arts in English from the University of Dhaka. Besides teaching at the department of Comparative Literature at Jadavpur University, he also taught at Pennsylvania College for Women, Indiana University, Brooklyn College, Colorado University, Wesleyan College, and the University of Hawaii in the United States. The poet edited and published the literary magazines ‘Pragati’ from 1927 to 1929, and ‘Kabita’ from 1935 to 1960, which were highly regarded in literary circles and played an important role in the post-Rabindranath movement. A distinctive essayist, he wrote extensively both reflective articles and literary criticism, with over a hundred books to his credit. His literary works include Bandir Bandana; Kankabati; Draupadir Shari; Shiter Prarthana: Basanter Uttar; E Andhar Alor Adhik; Lal Megh; Ratbhar Brshti; Patal Theke Alap; Golap Keno Kalo; Abhinay, Abhinay Nay; Kalidaser Meghdut; Charles Baudelaire: Tar Kabita; Rainer Maria Rilker Kabita; Rekha Chitra; Bhaso Amar Bhela; Tapaswi O Tarangini; Kolkatar Electra O Satyasandha; Kaler Putul; Sahityacharcha; Rabindranath: Kathasahitya; Swadesh O Sangskrti; Hathat Alor Jhalkani; and Sab Peyechhir Deshe. Buddhadev Bose passed away in Kolkata, India on March 8, 1974.",https://www.newagebd.net/post/literature/251590/buddhadev-boses-birth-anniv-today
Art exhibition expresses solidarity with Palestine,"In a tribute to the International Day of Solidarity with the Palestinian People, the Embassy of Palestine in Dhaka on Friday hosted an art exhibition featuring the artworks of Bangladeshi artist Tahina Tabani. The exhibition underscored global recognition of the day, marking November 29 when the UN Partition Resolution was adopted in 1947. The resolution proposed the establishment of separate Jewish and Arab states in Palestine. Partnering with Consular Corps in Bangladesh, the exhibition showcased 39 pieces by Tahia Tabani, combining vibrant paintings and intricate calligraphy, a press release said. Among them, 24 artworks specifically focused on the Palestinian cause, with all proceeds dedicated to humanitarian aid in Gaza. For the remaining 15 pieces, 70 per cent of sales would contribute to Gaza relief efforts, the press release said. Tahia, who initiated her campaign in recent months, used her art to support international relief initiatives for those affected by the devastating bombings in Gaza. The event at the Palestine embassy not only highlighted Tahia’s artistic talent but also amplified efforts to address the pressing humanitarian needs in Palestine, the press release said.",https://www.newagebd.net/post/photography-art-design/251589/art-exhibition-expresses-solidarity-with-palestine
Prachyanat stages ‘Khwabnama’ at BSA,"Theatre troupe Prachyanat staged its production titled Khwabnama at the National Theatre Hall of Bangladesh Shilpakala Academy in Dhaka on Thursday. Khwabnama, the 37th production of the theatre troupe, is an adaptation of eminent fiction writer Akhtaruzzaman Elias’ much-acclaimed novel with the same title. It has been adapted by Shaokat Hossain and directed by Kazi Toufiqul Islam Emon. The play gives the audience a glimpse into the history of Bengal towards the end of British colonial rule, revolving around the lives of people during the partition of the Indian subcontinent. Kazi Toufiqul Islam Emon told New Age that they had been staging the play for five years, mentioning, ‘After we began staging the play, we were forced to stop it for the emergence of Covid crisis in the country.’ Toufiqul Islam also added, ‘In this new political situation, we started again to perform the play.’ Khwabnama also depicts socio-political issues, sectarian violence, the conflict between peasants and landlords and others. Shakhawat Hossain Rezvi, Sahana Rahman Sumi, Itmam, Chetona Rahman, Mitul Rahman, Diana, Shormi, Saidur Shahin, Biplob, Murtoja Shuvo, Saim Bin Mujib, Ratul Roy and Urmi Saha have portrayed different characters in the play.",https://www.newagebd.net/post/theatre/251588/prachyanat-stages-khwabnama-at-bsa
Ramna park hours cut further,"Ramna park hours have been shortened further as two schedules have been enforced by separate government departments for public entry. The two schedules have significantly reduced public access to the 68.50-acre park located in the heart of the capital, causing confusion and dissatisfactions among the public who feel that their right to open spaces has been denied. The Public Works Department has ordered closure of the park from 12 noon to 2:00pm for everyday maintenance and cleaning since 2022, a decision made after the park reopened following Covid-19 restrictions, which has sparked public dissatisfactions. A recent notice from the Chief Adviser’s Office, displayed at several park gates—particularly those on the opposite side of State Guest House Jamuna, now residence of interim government chief adviser Professor Muhammad Yunus—states that ‘the park will remain closed from 10:00am to 4:00pm’ for the chief adviser’s security. Md Mehbubur Rahman, deputy divisional engineer of Ramna PW sub-division-1, told New Age that the park was closed for two hours daily for maintenance and cleaning. He said that although the Chief Adviser’s Office had not officially informed the PWD about the new restriction, he was aware that only the gate ‘Arunaday’ in the close vicinity of Jamuna would remain closed to the public for six hours. According to the PWD authorities, the park—often referred to as the ‘lungs of Dhaka City’—receives around 3,000 visitors each weekday and over 5,000 at weekends for activities such as physical exercise, morning walks, and as a passage to nearby areas. Mohammad Abul Kalam Azad Majumder, deputy press secretary to the chief adviser, said, ‘Security agencies responsible for the chief adviser’s protection can make any decisions.' During visits to the park between November 1 and November 18, security personnel at three —two on Minto Road and one opposite to Shishu Park in Shahbagh— out of five gates were seen barring public entry during the restricted hours started from 10:00am. A PWD official said that he also found several gates closed during his visits on November 17. A member of the Ansars, speaking on condition of anonymity, said that the gate opposite to Jamuna strictly followed security instructions while other gates remained closed only when VIP guests were in the area. ‘These days, the gate opposite to Matsya Bhaban also remains closed beyond the PWD’s restricted hours. Only the gate opposite the High Court, which provides access to the park’s restaurant, stays open during restricted hours to accommodate restaurant visitors,’ he added. The Institute for Planning and Development director professor Adil Muhammad Khan said, ‘We have very few open spaces like Ramna in Dhaka. The authorities should not close the park, even for a minute, during the daytime considering its multi-dimensional uses and its impact on health.’ ‘The July-August mass uprising was about restoring citizens’ rights, not continuing the deprivation experienced under the ousted Awami League government,’ he added. During visits to the park, which typically remains open from 6:00am to 12:00 noon and then from 2:00 pm to 8:00 pm, many visitors were seen returning from the gates due to the restrictions. A frustrated visitor, Rifat, expressed his anger saying, ‘If the park is closed for six hours, what’s the point of keeping it open? Won’t there be any security issues after 4:00pm?’ Jubed, a security guard, said that they had to encounter heated conversations with visitors every day due to the restrictions.",https://www.newagebd.net/post/country/251587/ramna-park-hours-cut-further
Kashinath Roy birth anniv today,"Today is the 77th anniversary of birth of poet, short story writer, essayist and former professor of Dhaka University Kashinath Roy. Born on November 30, 1947 in Natore, Kashinath Roy secured first position on the merit list in both secondary and higher secondary from Pabna Zilla School and Government Edward College respectively in the Humanities group. He obtained his bachelor’s and master’s in English from Dhaka University. He also served as a faculty member at some other universities, including Jahangirnagar University and Eastern University. He wrote collections of poems titledJibanananda DekhunandAmi Jaha Dite Pari. He also wrote a play in verse calledDibhain Kamedi. He also left his mark of excellence in his short stories, including ‘Rupantar’, ‘Memsaheber Paa’ and others. He also had a number of academic publications published in local and international journals. He also contributed to the English-Bengali Dictionary published by the Bangla Academy. Kashinath Roy passed away on January 17, 2021.",https://www.newagebd.net/post/literature/251586/kashinath-roy-birth-anniv-today
Two killed in road accidents,"At least two persons were killed and six others injured in road accidents in Rangamati and Dinajpur on Friday. Bangladesh Sangbad Sangstha reported that a college girl was killed and four others were injured in a collision between a bus and a CNG-run auto-rickshaw in Rajasthali upazila of the hilly district Rangamati. The deceased Maipay Marma of Bandarban was a student at Rangunia College. Chandroghona Thana officer-in-charge Mohammad Shahjahan Kamal said that the accident occurred at about 11:45am in Dakbanglo area on Bangalhalia-Chandroghona Road in the upazila. The body was sent to Rangamati General Hospital for autopsy. In another incident, the BSS reported that a motorcyclist was killed and two others were injured as a truck hit their vehicle in Ghoraghat upazila of Dinajpur. The deceased is Lutfur Rahman, 68, of Balgari Shalikadah village in the upazila. Ghoraghat Thana OC Md Nazmul Haque said that the accident occurred in Kalabari area on Dinajpur-Gobindaganj regional highway. Lutfur Rahman died on the way to Rangpur Medical College and Hospital, the OC added.",https://www.newagebd.net/post/country/251585/two-killed-in-road-accidents
Bus worker dies in fire from mosquito coil,"A teenage transport worker asleep in a parked bus was burned to death in a fire triggered by a burning mosquito coil in Khulna in the early hours of Friday. The deceased Md Sharif, 16, was raised in an orphanage in Munshiganj’s Srinagar, according to police. Sonadanga police station officer-in-charge Md Shafiqul Islam said that the incident occurred at about 2:00am on Friday. The bus caught fire when helper Shariful was sleeping inside a Sundarban Paribahan bus starting a mosquito coil, he said. ‘We assume that Sharif fell asleep after lighting the coil inside the bus, which caused the fire. But he could not escape the bus as the doors and windows were closed,’ OC Shafiqul said. The body was sent to Khulna Medical College Hospital for autopsy, he added. Quoting the witnesses, the OC said that the bus, which ran on the Dhaka-Khulna route, was parked inside the terminal and local people noticed a sudden fire inside the bus at about 2:00am. They informed the Fire Service and Civil Defence, but the bus was burnt before fire service officials arrived at the scene. The fire service officials went to the spot after getting a call at 1:45am, according to fire service control room in Khulna. ‘The firefighters brought the fire under control at about 2:10am and recovered bus worker Sharif’s body,’ control room officer Md Rokonuzzaman said.",https://www.newagebd.net/post/country/251584/bus-worker-dies-in-fire-from-mosquito-coil
Govt firm to enforce ban on polythene bags,"The government remained steadfast in its efforts to enforce the ban on polythene shopping bags, said the polythene monitoring committee. ‘All citizens must adhere to the government’s directives to stop the use of such bags, otherwise strict actions will be taken,’ said Tapan Kumar Biswas, additional secretary and chair of the monitoring committee on polythene. He made the remarks during a monitoring drive at Kitchen Market in Dhaka’s New Market area on Friday, said a press release of the environment, forests and climate change ministry. Tapan informed reporters that 166 drives had been conducted since November 3 to enforce the ban on polythene use. 349 entities were fined Tk 19,29,900 and 40,000 kg of polythene was seized during the period. ‘Public awareness is growing, and we are witnessing gradual improvements,’ the additional secretary said, adding that efforts to eliminate single-use plastics were also underway. ‘Awareness campaigns, providing alternatives and strict enforcement are progressing simultaneously,’ he said. During the monitoring drive, members of the market committee acknowledged the harmful effects of polythene use and committed to take eco-friendly alternatives. Officials from the ministry and department of environment, members of law enforcement agencies, and representatives from the media were present during the monitoring drive.",https://www.newagebd.net/post/country/251583/govt-firm-to-enforce-ban-on-polythene-bags
Fakhrul leaves for London to meet Tarique,"Bangladesh Nationalist Party secretary general Mirza Fakhrul Islam Alamgir is leaving for London today to meet the party’s acting chairperson, Tarique Rahman. After the fall of the Awami League government on August 5 amid a student-led mass uprising, this will be the first visit of the BNP leader to London, and he would stay there for a week or 10 days, said several BNP leaders. Fakhrul is going to London to discuss issues regarding political and party at his meeting with Tarique, who is staying in London, said the party leaders.",https://www.newagebd.net/post/politics/251582/fakhrul-leaves-for-london-to-meet-tarique
Rally demands compensation for uprising victims,"A protest rally on Friday demanded immediate compensation and full rehabilitation for the families of those killed and injured during the July-August uprising. The rally called for the trial of the terrorists responsible for the violence. Participants also called for justice for lawyer Saiful Islam, who was killed in Chattogram. The rally, held at Mirpur 10 Circle, was organised by the Jatiya Nagorik Committee and attended by representatives from various areas of Mirpur. Speakers said that the July-August killers were roaming openly then and threatening the martyrs’ families. Yunus Ali Masud, a representative of the Jatiya Nagorik Committee from Pallabi, said that the country remained unstable. ‘The Awami League’s evil forces are collaborating with ISKCON to destabilise the state. If the criminals are caught, peace will be restored,’ he said. Ariful Islam Arif, a central member of the committee, demanded the immediate arrest of all police officers directly involved in the July-August killings. ‘Compensation should be delivered to the families of the martyrs, and the injured must receive full medical treatment,’ he added. Arif also highlighted the death of lawyer Saiful Islam, calling for the prosecution of those responsible. He further criticised ISKCON, accusing the group of sabotaging various movements, and called for its ban. Representatives of the committee stressed that the current government, being the result of a mass movement, should act more decisively and expedite the legal process to bring justice to the victims. They further emphasised the need for a strict approach to ensure that those behind the violence are held accountable.",https://www.newagebd.net/post/country/251581/rally-demands-compensation-for-uprising-victims
Showdown looms on plastic treaty days before deadline,"Diplomats warned on Friday of a looming showdown in negotiations to reach the world’s first deal to curb plastic pollution, after a new draft text emerged littered with competing visions and on-going disagreements. With just two days of talks left, countries seeking an ambitious treaty urged delegations that ‘have not moved a centimetre’ to make compromises or ‘get out of the way.’ Panama’s delegation head even warned that the UN’s usual consensus process could be abandoned for a vote if progress stalled further. ‘If there is not a full consensus and we can go to voting, one country, one vote, we’re also looking forward to that option,’ said Juan Carlos Monterrey Gomez. Nearly 200 nations are in South Korea’s Busan with the goal of sealing a landmark deal by Sunday, capping two years of negotiations. But the latest draft text continues to reflect the faultline dividing a handful of mostly oil-producing states — who supply the precursors for plastic production — from a coalition grouping European, African, Latin American and Asian countries. The text has eight possible definitions for plastic alone, and five options for the meaning of plastic pollution. No text at all is proposed on ‘chemicals of concern’ that are known or believed to be harmful to human health, and an article on health remains virtually bare, along with an option to scrap it altogether — a request made earlier by Saudi Arabia. It includes language proposed by Panama on production, which suggests countries agree a reduction target after the treaty is signed. But it leaves open the option of deleting the article on supply entirely, a suggestion also previously made by Saudi Arabia. There is growing frustration among some delegations, particularly small island states that are especially vulnerable to ocean plastic. ‘The Gulf states want to protect their economy with the fossil fuels. What about us? Do we even mean anything?’ asked Micronesia’s Andrew Yatilman. Panama’s Monterrey said that if nations opposed to cutting production are ‘not willing to lead, please leave it to the rest of us and get out of the way’. Monterrey said his focus was squarely on production cuts. ‘The battle will be based on defending that article,’ he said. ‘We are not here to negotiate a greenwashing and recycling treaty.’ European diplomats echoed that sentiment. ‘Mopping the floor when the tap is open is useless,’ said the EU’s Anthony Agotha. In 2019, the world produced around 460 million tonnes of plastic — a figure expected to triple by 2060, according to the Organisation for Economic Co-operation and Development. Plastic pollution is so ubiquitous that it has been found in clouds, the deepest ocean trenches and even human breastmilk, raising growing concerns about its health impacts. Other delegates sounded the alarm on the draft’s lack of text on health issues and chemical components of plastic. Fiji’s representative warned there would be ‘no treaty without a provision on chemicals of concern.’ ‘This is a non-negotiable for us,’ said Sivendra Michael. Time pressure is mounting on the delegates, some of whom are soon due to leave Busan for a climate meeting on desertification in Riyadh that begins on December 2. Environmental groups warned against accepting ‘the low level of ambition’ in the draft. Without strong measures ‘the treaty will fail,’ said Eirik Lindebjerg, global plastics policy lead at WWF. Not everyone was similarly pessimistic. The International Council of Chemical Associations, which groups global chemical and petrochemical industry bodies, welcomed ‘the progress made’ in the latest text, which ‘moves us closer towards a legally binding plastics agreement.’ However, the Business Coalition for a Global Plastics Treaty, which represents multinationals including Nestle, warned the text was ‘too weak.’ ‘This draft does not provide the certainty business is seeking,’ said spokeswoman Jodie Roussell.",https://www.newagebd.net/post/asia/251580/showdown-looms-on-plastic-treaty-days-before-deadline
