title,content,link
Foreign loan drops by 26pc in July-Oct,"The disbursement of foreign loans in the first four month of the current financial year dropped by 26 per cent due mainly to the regime change in the country, economists said. The country’s multilateral and bilateral lenders disbursed $1,202.00 million in the July-October of FY25 compared with $1626.17 million during the same period of FY24, according to the Economic Relations Division update released on November 28. Slowdown in the foreign loan disbursement was high in the July-September period of FY25 as the ERD calculated the rate at 35 per cent to $831.12 million from $1,276.22 million in FY24. Economists said the trend was not unusual against the backdrop of the regime change on August 5 amid a mass uprising and the assumption in power by the interim government. The new government is reviewing many annual development programme projects, including lenders-driven ones, to find out the politically motivated and less important projects. It is also renegotiating with lenders regarding many projects taken by the immediate past political regime, said former World Bank Dhaka office chief economist Zahid Hussain. The slowdown in disbursement of foreign loan is not unusual, he said. Because of the slowdown in disbursement of the foreign loans the ongoing pressure on the government in repayment of debt is increasing. The government paid back $1,437.90 million in the July-October period of FY25 compared with that of $1,101.50 million during the same period of FY24. The rate of increase was 29 per cent in the July-September of FY25. Institute for Inclusive Finance and Development executive director MK Mujeri said that the interim government needed dynamism in negotiating with the lenders to reverse the trend. He said that a positive development was imperative to tackle the economic downturn persisting since 2022 amid a shortage of dollars because of mismanagement and flawed policies by the immediate past political regime. Over the past three years until FY24, the Bangladesh Bank sold more than $34 billion to commercial banks depleting the country’s foreign exchange reserve which is now hovering at $19 billion. In the past month, Moody’s in a report downgraded Bangladesh’s credit rating citing heightened political risks and lower growth. The global leading agency lowered the rating to B2 from B1 as it found that the country’s outlook had been changed to ‘negative’ from ‘stable’.",https://www.newagebd.net/post/banking/251651/foreign-loan-drops-by-26pc-in-july-oct
Stocks decline for 2nd week,"Dhaka stocks fell slightly in the past week, extending the falling streak to the second week, as a section of investors sold shares to protect their funds from further erosion, market operators said. They said that investors were active on both sides of the trading fence, however, opportunistic investors sought profit booking. DSEX, the key index of the Dhaka Stock Exchange, decreased by 4.99 points, or 0.10 per cent, in the past week to end at 5,192.59 points, after decreasing by 157.75 points in the previous week. Investors were cautious as the earnings declarations by companies are going on, market operators said. Also, higher bank interest rates are inspiring investors to invest in fixed-income options instead of the stock market, they said. The daily average turnover on the DSE decreased in the past week to reach Tk 381.31 crore compared with that of Tk 465.80 crore in the previous week. Of the 390 issues traded in the past week, 213 increased, 126 decreased and 51 stayed the same. Investors were mostly active in bank scrips, followed by pharmaceutical and food shares. EBL Securities in its weekly market commentary said, ‘Market volatility persisted throughout the week as sellers maintained their dominance, while opportunistic investors preferred to observe the market’s trend and sit on cash to look for lucrative investment opportunities following the corrections.’ ‘However, the market logged a slight recovery due to some positive sentiment following media reports regarding the central bank’s approval of the anticipated Tk 30 billion sovereign-guaranteed loan to ICB. Nevertheless, profit-booking by wary investors soon eroded most of the gains in the final session amidst the waning market momentum,’ it added. The DS30 index decreased by 2.82 points, or 0.15 per cent, to finish at 1,916.23 points. Only the DSE Shariah index gained, by 15.33 points, or 1.33 per cent, to close at 1,166.89 points in the past week. NRB Bank topped the average weekly turnover chart with shares worth Tk 15.70 crore changing hands per session. Taufika Foods and Lovello Ice-cream, Bangladesh Shipping Corporation, Agni Systems, Midland Bank, Genex Infosys, Eastern Bank, Beach Hatchery, Alif Industries and Fine Foods were the other turnover leaders.",https://www.newagebd.net/post/stocks/251650/stocks-decline-for-2nd-week
100 Rohingya refugees rescued off Indonesia,"More than 100 Rohingya refugees including women and children have been rescued after their boat sank off the coast of Indonesia, the United Nations refugee agency said Saturday. The mostly Muslim ethnic Rohingya are heavily persecuted in Myanmar and thousands risk their lives each year on long and dangerous sea journeys to reach Malaysia or Indonesia. ‘We received a report from the East Aceh government that there are 116 refugees in total,’ UNHCR’s Faisal Rahman told AFP on Saturday. ‘The refugees are still on the beach right now, it has not been decided where they would be taken.’ He said the flimsy wooden boat carrying the Rohingyas was found half-submerged not far from the beach off the coast of northeastern Sumatra island. A local fisherman, Saifudin Taher said the boat was first spotted entering East Aceh waters on Saturday morning, and a few hours later it nearly sank. ‘All passengers survived, but one of them was ill and ...immediately received treatment,’ Saifudin told AFP, adding the boat was only 100 metres away from the beach, and the refugees could walk easily to safety. Rohingya arrivals in Indonesia tend to follow a cyclical pattern, slowing during the stormy months and picking back up when sea conditions calm down. Last month, 152 Rohingya refugees were finally brought ashore after being anchored for days off the coast of South Aceh district for days while officials decided whether to let them land. Indonesia is not a signatory to the UN refugee convention and says it cannot be compelled to take in refugees from Myanmar, calling instead on neighbouring countries to share the burden and resettle Rohingya who arrives on its shores. Many Acehnese, who have memories of decades of bloody conflict themselves, are sympathetic to the plight of their fellow Muslims. But others say their patience has been tested, claiming the Rohingya consume scarce resources and occasionally come into conflict with locals. In December 2023, hundreds of students forced the relocation of more than 100 Rohingya refugees, storming a community hall in Aceh where they were sheltering and vandalising their belongings.",https://www.newagebd.net/post/asia/251649/100-rohingya-refugees-rescued-off-indonesia
Trudeau in Florida to meet Trump as tariff threats loom,"Canadian prime minister Justin Trudeau traveled to Florida on Friday for a dinner with Donald Trump at the president-elect’s Mar-a-Lago estate, as the incoming US leader promised tariffs on Canadian imports. The unannounced meeting came at the end of a week that has seen Canada as well as Mexico scramble to blunt the impact of Trump’s trade threats, which experts have warned could also hit US consumers hard. A smiling Trudeau was seen exiting a hotel in West Palm Beach before arriving at Mar-a-Lago, making him the latest high-profile guest of Trump, whose impending second term—which starts in January—is already overshadowing the last few months of President Joe Biden’s administration. Flight trackers had first spotted a jet broadcasting the prime minister’s callsign making its way to the southern US state. A Canadian government source later told AFP that the two leaders were dining together. Trump caused panic among some of the biggest US trading partners on Monday when he said he would impose tariffs of 25 percent on Mexican and Canadian imports and 10 percent on goods from China. He accused the countries of not doing enough to halt the ‘invasion’ of the United States by drugs, ‘in particular fentanyl,’ and undocumented migrants. Mexican President Claudia Sheinbaum spoke with Trump by phone on Wednesday, though the two leaders’ accounts of the conversation differed drastically. Trump claimed that Mexico’s left-wing president had ‘agreed to stop migration through Mexico, and into the United States, effectively closing our Southern Border.’ Sheinbaum later said she had discussed US-supported anti-migration policies that have long been in place in Mexico. She said that after that, the talks had no longer revolved around the threat of tariff hikes, downplaying the risk of a trade war. Biden warned that same day that Trump’s tariff threats could ‘screw up’ Washington’s relationships with Ottawa and Mexico City. ‘I think it’s a counterproductive thing to do,’ Biden told reporters. Trudeau did not respond to questions from the media as he returned to his hotel Friday evening after meeting with Trump. But for Canada, the stakes of any new tariffs are high. More than three-quarters of Canadian exports, or Can$592.7 billion ($423 billion), went to the United States last year, and nearly two million Canadian jobs are dependent on trade. A Canadian government source told AFP that Canada is considering possible retaliatory tariffs against the United States. Some have suggested Trump’s tariff threat may be bluster, or an opening salvo in future trade negotiations. But Trudeau rejected those views when he spoke with reporters earlier in Prince Edward Island province. ‘Donald Trump, when he makes statements like that, he plans on carrying them out,’ Trudeau said. ‘There’s no question about it.’ According to the website Flightradar, the Canadian leader’s plane landed at Palm Beach International Airport late Friday afternoon. Canadian public broadcaster CBC said that Trudeau’s public safety minister, Dominic LeBlanc, was accompanying him on the trip.",https://www.newagebd.net/post/mis/251648/trudeau-in-florida-to-meet-trump-as-tariff-threats-loom
Inflation-wary US consumers flock to ‘Black Friday’ deals,"US shoppers were out in force for ‘Black Friday,’ with preliminary data showing strong online sales despite inflation nerves prompting retailers in the world’s biggest economy to come up with ever more deals. As markets and consumers eye possible turbulence during the transition from President Joe Biden to Donald Trump, there are hopes that the year’s biggest shopping season — stretching from Thanksgiving to Christmas — will be a bonanza. The National Retail Federation (NRF) said a record 183.4 million people are planning to shop over the weekend, ticking up from 182 million last year and 18.1 million higher than 2019, before the Covid pandemic derailed the global economy. Adobe Analytics said US consumers had spent $7.9 billion online as of Friday afternoon, an increase of 8.2 per cent over last year, with a projected final tally between $10.7 and $11 billion — an e-commerce record for Black Friday. The so-called ‘Black Friday’ discounts day originated as a single day when shoppers poured — sometimes stampeded — into malls in search of incredible deals, but is now accompanied by ‘Small Business Saturday’ and ‘Cyber Monday.’ While inflation has been largely tamed from its post-Covid spike, Americans remain wary, with consumer prices still significantly elevated above their pre-pandemic levels. Beatrice Judon, a shopper ‘over 75’ years old, described the situation as ‘challenging.’ ‘We hope things get better,’ she told AFP after a trip to a department store in the US capital. ‘We just have to wait and see.’ Holiday shoppers in 2024 are ‘even more preoccupied and very focused around value and discounts,’ said Vivek Pandya, leading insights analyst at Adobe Digital Insights. Discontent with high costs was seen as one of the main reasons Trump defeated Vice President Kamala Harris in the presidential election this month. Target CEO Brian Cornell told analysts earlier this month that after a lengthy period of inflation, ‘consumers tell us their budgets remain stretched.’ ‘They’re becoming increasingly resourceful in their shopping behaviors, waiting to buy until (the) last moment of need, focusing on deals and then stocking up when they find them,’ he said. ‘It’s pretty expensive to live in America in general,’ said Tyler Austin, 25, who was out shopping Friday in downtown Washington for clothes ‘to upgrade the wardrobe.’ Despite the negative perceptions of the economy, the NRF has projected holiday spending to grow between 2.5 and 3.5 per cent over last year, to as much as $989 billion over the two-month period. President Joe Biden did his part to support the US economy on Black Friday by visiting a bookshop on the Massachusetts island of Nantucket, where he is currently on holiday with his family. The inflationary environment has weighed especially heavily on households with lower incomes, with banks pointing to rising charge-off rates as an indicator of increased stress. But budget-conscious retailer Burlington Stores is seeing some of the strongest sales in low-income zip codes, said Chief Executive Michael O’Sullivan. ‘Maybe for the first time since 2021, it looks like their real incomes are finally edging up,’ O’Sullivan said on a conference call this week. Wall Street stocks closed higher during the shortened trading session on Friday with the Dow and S&P 500 indexes both hitting fresh records. Thanksgiving, which is always the fourth Thursday in November, falls on its latest possible date in 2024. As a result, retailers are pivoting to a shopping season with five fewer days than last year, which analysts say may be responsible for the outsized early sales. While Black Friday deals are often targeted at people living in the United States, they also draw tourists and bargain-hunters from abroad. ‘We came mostly for the experience but we’ve also found some very good deals,’ Mario Clemente, a tourist from the Mexican city of Guadalajara told AFP during a trip to a shopping mall in Los Angeles. ‘Compared to Mexico, it’s much cheaper to come here, even when you add the hotel and the flight,’ he said.",https://www.newagebd.net/post/economy/251647/inflation-wary-us-consumers-flock-to-black-friday-deals
China manufacturing expands for second straight month,"China in November saw an uptick in industrial output for the second straight month, government data showed Saturday, an encouraging sign for officials as they battle stagnant activity. Beijing has in recent weeks announced a slew of the most aggressive measures in years aimed at boosting growth in the world’s second-largest economy, which has struggled to fully recover since the pandemic. A key measure of activity in the manufacturing sector, the Purchasing Managers’ Index (PMI), was 50.3 in November, according to data published by the National Bureau of Statistics (NBS). The latest PMI reading marks the second straight month of expansion — indicated by a figure above 50 — after a five-month run in negative territory that ended in October. And it came in higher than a Bloomberg forecast, which had predicted the figure to stand at 50.2. Since late September, Beijing has unveiled a string of measures aimed at bolstering growth, including cutting interest rates, cancelling restrictions on homebuying and easing the debt burden on local governments. But economists have warned that more direct fiscal stimulus aimed at shoring up domestic consumption is needed to restore full health in China’s economy as fears of a renewed trade war with the United States mount. Writing ahead of Saturday’s data release by the NBS, Chang Shu and David Qu of Bloomberg Economics said that the expected increase in November’s PMI “reflects a seasonal tendency to rise following a holiday-led lull in October, not an economy that’s gearing up”. Beijing is targeting annual growth this year of around five per cent — a goal that officials have recently expressed confidence in achieving. But many observers are more sceptical, with the IMF in October revising its forecast for China’s economic growth this year to 4.8 per cent. The International Monetary Fund anticipates that figure slowing further to 4.5 per cent next year.",https://www.newagebd.net/post/mis/251646/china-manufacturing-expands-for-second-straight-month
Moody’s downgrades Hungary outlook on institutional ‘weaknesses’,"The US ratings agency Moody’s downgraded its outlook for Hungary’s government debt Friday citing ‘institutional and governance weaknesses’ and concerns its antagonistic relationship with the EU could have financial consequences. Hungary is a recipient of substantial amounts of funding from the European Union, which are conditional on meeting certain criteria, including adherence to the rule of law. The country’s nationalist prime minister, Viktor Orban, has clashed with Brussels on a range of issues in recent years, some of which could see it lose out on those EU funds, Moody’s indicated in a note explaining its decision. ‘Our decision to change the outlook to negative (from stable) reflects downside risks related to the quality of Hungary’s institutions and governance,’ Moody’s analysts wrote in a note explaining their decision. What that means, they said, is that Hungary could ultimately lose out on a ‘substantial’ amount of EU money ‘because it does not meet the conditions for the release of these funds.’ ‘In turn, this could lower trend GDP growth and weaken fiscal and debt metrics,’ they added. In the same note, Moody’s affirmed Hungary’s investment grade foreign- and local-currency credit rating of Baa2. Moody’s said that the total EU funds allocated to Hungary were equivalent to around 3.4 per cent of economic output per year. Given the ongoing ‘difficult negotiations’ between Hungary and the EU, Moody’s noted there were ‘elevated risks that Hungary will miss out on a substantial amount’ of some of that funding.",https://www.newagebd.net/post/economy/251645/moodys-downgrades-hungary-outlook-on-institutional-weaknesses
Sri Lanka records highest deflation since 1961,"Sri Lanka’s consumer prices fell by 2.1 per cent in November, the highest deflation rate recorded by the economically fragile island nation since 1961, official data showed Saturday. An unprecedented financial crash in 2022 brought months of consumer goods shortages, with inflation peaking at nearly 70 per cent that year. Since then, a $2.9 billion bailout loan from the International Monetary Fund, tax hikes and other austerity measures have slowly made headway in repairing the island’s economy. ‘Headline inflation will remain negative in the next few months, deeper than previously projected, mainly due to larger downward adjustments in energy prices and reduction in volatile food prices,’ Sri Lanka’s central bank said in a statement. The bank said inflation was likely to return to its target level of five percent in the coming months. Sri Lanka had already seen deflation of 0.8 per cent in October and 0.5 per cent in September.",https://www.newagebd.net/post/economy/251644/sri-lanka-records-highest-deflation-since-1961
Failed to fetch title,Content not available,https://www.newagebd.net/post/economy/251643/s&p-maintains-france-economy-rating-and-outlook
Failed to fetch title,Content not available,https://www.newagebd.net/post/asia/251642/vietnam-to-build-$67b-high-speed-railway
Blast at Kosovo canal a ‘terrorist attack’: Pristina,"An explosion on Friday damaged a canal supplying water to Kosovo’s two main coal-fired power plants, prime minister Albin Kurti said, blaming a ‘terrorist attack’ by neighbouring Serbia. ‘This is a criminal and terrorist attack aimed at damaging our critical infrastructure’, Kurti told a press conference late Friday. ‘The attack was carried out by professionals. We believe it comes from gangs directed by Serbia,’ he added without providing any evidence. The blast occurred near the town of Zubin Potok in the country’s troubled north, damaging a canal supplying water to cooling systems at two power plants that generate most of Kosovo’s electricity. Kurti gave no details about the extent of the damage, but said if it was not repaired part of Kosovo could be without electricity as soon as Saturday morning. Pictures from the scene published by local media showed water leaking heavily from one side of the reinforced canal, which runs from the Serb-majority north of Kosovo to the capital Pristina and also supplies drinking water. The United States strongly condemned the ‘attack on critical infrastructure in Kosovo’, the US embassy in Pristina said in a statement on Facebook. ‘We are monitoring the situation closely... and have offered our full support to the government of Kosovo to ensure that those responsible for this criminal attack are identified and held accountable.’ Animosity between ethnic Albanian-majority Kosovo and Serbia has persisted since the end of the war between Serbian forces and ethnic Albanian insurgents in the late 1990s. Kosovo declared independence in 2008, a move that Serbia has refused to acknowledge. Kurti’s government has for months sought to dismantle a parallel system of social services and political offices backed by Belgrade to serve Kosovo’s Serbs. Friday’s attack came after a series of violent incidents in northern Kosovo, including the hurling of hand grenades at a municipal building and a police station earlier this week. AFP has contacted the Serbian government for comment.",https://www.newagebd.net/post/europe/251641/blast-at-kosovo-canal-a-terrorist-attack-pristina
Failed to fetch title,Content not available,https://www.newagebd.net/post/asia/251640/us-approves-$385m-arms-sales-to-taiwan
31 crew of Thai fishing vessels held in Myanmar,"More than 30 crew members of Thai fishing boats were detained in Myanmar waters on Saturday after an encounter with other vessels which left one person dead, a navy commander said. Suwat Donsakul, a naval commander in the southern province of Ranong, told AFP one Thai fisherman drowned and ‘31 people were taken into Myanmar’, without specifying who had detained them. Suwat said several Thai fishing boats were operating within Myanmar’s waters at the time of the incident on Saturday. The deceased ‘jumped into the water during the attack’, he said. Suwat said he had instructed local authorities to negotiate with their Myanmar counterparts to secure the release of the fishermen. A spokesperson for Thailand’s Ministry of Foreign Affairs told AFP that they would also engage in negotiations with the Myanmar side to secure their release. AFP has reached out to Myanmar’s junta government for comment. The incident prompted the Ranong provincial fisheries department to issue a warning to fishers and boat owners to avoid areas near the Thai-Myanmar maritime border. The fisheries department said in a statement that ‘Myanmar armed fishing boats’ had attacked Thai fishing vessels around 20 kilometres (12 miles) west of Phayam island, off the Thai coast, without specifying the identity of the alleged attackers. Its warning was to ‘all fishing operators and vessel owners to be cautious when navigating near the border’. Thailand and Myanmar share approximately 1,500 miles of land and maritime borders, including in the Andaman Sea. According to a notice on the website of Thailand’s fisheries department, Thai fishing boats have been illegally operating in Myanmar waters, raising tensions between the two countries.",https://www.newagebd.net/post/south-asia/251639/31-crew-of-thai-fishing-vessels-held-in-myanmar
