title,content,link
United States appreciates Bangladesh’s effort to ensure security for all,"The United States has welcomed the ongoing efforts of Bangladesh’s interim government to ensure the safety and security of all citizens. A spokesperson for the US Department of State made this statement in response to a question from Voice of America Bangla on Tuesday, December 3. Addressing concerns about alleged inaction by the interim government regarding the safety of minority communities, the State Department noted via an emailed response: ‘We condemn any acts of violence or intolerance towards members of minority communities and welcome the interim government’s continued efforts to ensure the security of all citizens in Bangladesh.’ When asked about the US position on alleged persecution of minority communities in Bangladesh, the Department further stated: ‘The United States supports freedom of religion or belief, freedom of expression, and the rights to peaceful assembly and association as fundamental freedoms. We consistently communicate our support for these rights to the interim government of Bangladesh and our other partners.’ The US State Department also addressed concerns surrounding the designation of ISKCON as a ‘terrorist organisation’ in Bangladesh and the ongoing legal troubles of Chinmoy Krishna Das Brahmachari. The spokesperson noted — ‘These issues should be resolved by the government of Bangladesh in line with the rights guaranteed by its constitution and laws. We urge Bangladesh, as we do all countries, to uphold freedoms of expression, peaceful assembly, association, and religion or belief.’ Tensions have risen between Bangladesh and India over the arrest of Chinmoy Krishna Das and the reported persecution of Hindus in Bangladesh. Responding to a question about the US role in promoting regional security amid these developments, the State Department spokesperson said, ‘We deeply value our relationships with both Bangladesh and India. We leave the matter of their diplomatic relations to the respective governments.’",https://www.newagebd.net/post/foreign-affairs/251980/united-states-appreciates-bangladeshs-effort-to-ensure-security-for-all
Failed to fetch title,Content not available,https://www.newagebd.net/post/country/251979/bangladesh%5C%27s-civic-space-broadened-report-
"Ex-ministers Amu, Qamrul produced before International Crimes Tribunal","Former ministers Amir Hossain Amu and advocate Qamrul Islam have been produced before the International Crimes Tribunal in connection with a genocide case. They were presented before the court at about 10:00am, according to the prosecution. On December 2, the ICT directed the relevant authorities to produce them on Wednesday. It has been reported that the duo will be shown arrested in a case filed on charges of crimes against humanity and genocide allegedly committed during the July-August mass uprising. Qamrul was detained by detectives from the Dhaka Metropolitan Police in Uttara, Dhaka, on November 18. He was subsequently shown arrested in a case related to the death of businessman Abdul Wadud, 45, which occurred on July 19 in the New Market area during the anti-discrimination student movement. Separately, Amu was apprehended by detectives from a residence in West Dhanmondi on November 6. He has also been implicated in the same case.",https://www.newagebd.net/post/country/251978/ex-ministers-amu-qamrul-produced-before-international-crimes-tribunal
"Gas supply to remain off for 24 hours in Monohordi, Kishoreganj","Gas supply will remain suspended for 24 hours on Thursday and Friday in different areas at Sadar and Gotashia areas in Monohordi upzila and Sadar upzila in Kishoreganj district for emergency tie-in works in gas pipeline in the GTCL’s off-remission point. According to Titas Gas Transmission and Distribution Company PLC, in the areas gas supply will remain off for 24 hours from 6:00pm on Thursday to 6:00pm on Friday. The Titas Gas regrets the temporary inconvenience to its consumers.",https://www.newagebd.net/post/country/251977/gas-supply-to-remain-off-for-24-hours-in-monohordi-kishoreganj
"Thousands march in S Korea, ask president to quit","Thousands of protesters marched on president Yoon Suk Yeol’s office in the South Korean capital Wednesday evening, joining a push by the country’s opposition to impeach the leader after his extraordinary but short-lived imposition of martial law. Yoon’s shock bid to suspend civilian rule for the first time in over four decades — before being overturned by lawmakers in a night of drama — plunged South Korea into deep turmoil and alarmed its close allies. The future of Yoon, a conservative politician and former star public prosecutor who was elected president in 2022, is now highly uncertain. Live feed video showed thousands of protesters marching towards Yoon’s office in central Seoul after staging a rally in Gwanghwamun Square. South Korea’s opposition parties — whose lawmakers jumped fences and tussled with security forces to vote down the martial law — filed a motion to impeach Yoon. They were yet to decide when to put it to a vote, but it could come as soon as Friday. The opposition holds a large majority in the 300-member parliament and needs only a handful of defections from the president’s party to secure the two-thirds majority needed to pass the motion. The DP has also filed charges of ‘insurrection’ against the president, some of his ministers and top military and police officials — which can carry a penalty of life imprisonment or even death. The nation’s largest umbrella labour union called an ‘indefinite general strike’ until Yoon resigns. Even the leader of Yoon’s own ruling party described the attempt as ‘tragic’ while calling for those involved to be held accountable. Seoul’s stock exchange closed down more than one per cent Wednesday as markets were roiled by the turmoil. In his late-night television announcement, Yoon declared martial law, citing the threat of North Korea and ‘anti-state forces’. More than 280 troops, some flown in by helicopters, arrived at parliament to lock down the site. But 190 lawmakers defied rifle-carrying soldiers to force their way into parliament to vote against the move. This left Yoon with no choice but to retract his decision and call off the military in another television address six hours later. Under the constitution, martial law must be lifted when a majority in parliament demands it. Senior aides working for Yoon offered Wednesday to resign en masse over the martial law declaration. Yoon’s defence minister also offered to step down, saying he took ‘full responsibility for the confusion and concern’ around the martial law declaration. By evening, Yoon had yet to publicly reappear. The repeal of martial law prompted jubilation among flag-waving protesters outside parliament who had braved freezing temperatures to keep vigil through the night in defiance of Yoon’s order. Demonstrator Lim Myeong-pan, 55, said that Yoon now has to go. ‘Yoon’s act of imposing it in the first place without legitimate cause is a serious crime in itself,’ Lim said. ‘He has paved his own path to impeachment with this.’ As night fell in Seoul, protesters gathered again, ramping up their calls for Yoon to go. ‘I was so incensed I couldn’t sleep a wink last night, I came out to make sure we push out Yoon once and for all,’ 50-year-old Kim Min-ho said at a demonstration at the assembly Wednesday. Yoon had said that his imposition of martial law was to ‘safeguard a liberal South Korea from the threats posed by North Korea’s communist forces and to eliminate anti-state elements plundering people’s freedom and happiness’. Yoon did not elaborate on the North’s threats, but the South remains technically at war with nuclear-armed Pyongyang. The president labelled the main opposition Democratic Party ‘anti-state forces intent on overthrowing the regime’. In recent weeks, Yoon and his People Power Party have been bitterly at odds with the opposition over next year’s budget. His approval rating dropped to 19 per cent in the latest Gallup poll last week, with voters angry at the state of the economy as well as controversies involving his wife, Kim Keon Hee. Yoon’s action took allies by surprise, with the United States, which has nearly 30,000 troops in the country to protect it from the nuclear-armed North, saying it had no prior notice and voicing relief at his reversal. ‘This is a surprising last-ditch move by Yoon to grab political power,’ Gi-Wook Shin, a sociology professor at Stanford University, said. ‘This move will only fasten the demise of his political career as it is likely to lead to his impeachment.’",https://www.newagebd.net/post/asia/251976/thousands-march-in-s-korea-ask-president-to-quit
Dhaka becomes most polluted city with AQI score of 259,"Dhaka, the overcrowded capital of Bangladesh, has topped the list of cities worldwide with the worst air quality with an AQI score of 259 at 9:00 am on Wednesday. Dhaka’s air was classified as ‘very unhealthy’, according to the air quality and pollution city ranking. An AQI between 151 and 200 is considered ‘unhealthy’ while 201-300 is ‘very unhealthy’, and 301-400 is considered ‘hazardous’, posing severe health risks to residents.Egypt’s Cairo, Iraq’s Baghdad and Uganda’s Kampala occupied the second, third and fourth spots in the list, with AQI scores of 241, 189 and 187, respectively. The AQI, an index for reporting daily air quality, informs people how clean or polluted the air of a certain city is and what associated health effects might be a concern for them. The AQI in Bangladesh is based on five pollutants: particulate matter (PM10 and PM2.5), NO2, CO, SO2, and ozone. Dhaka has long been grappling with air pollution issues. Its air quality usually turns unhealthy in winter and improves during the monsoon.",https://www.newagebd.net/post/country/251975/dhaka-becomes-most-polluted-city-with-aqi-score-of-259
Taijul spins Bangladesh to win over Windies,"Taijul Islam snared five wickets for the 15th time in a Test innings to lead Bangladesh to a series-levelling 101-run victory over the West Indies on the fourth evening of the second and final Test at Sabina Park on Tuesday. After Jaker Ali's Test-best innings of 91 lifted the tourists to 268 all out in their second innings and left the home team with a daunting victory target of 287, left-arm spinner Islam broke the back of the Caribbean side's effort with five for 50 as they were dismissed for 185 in the day's final session. Fast bowler Nahid Rana, whose maiden five-wicket haul in the first innings pulled Bangladesh back into contention, had the satisfaction of administering the final rites when he yorked last man Shamar Joseph for his only wicket of the innings. ‘It's a great feeling to win a Test match abroad which we don't often do and all the boys really put in a tremendous effort,’ said player-of-the-match Islam. Seamers Taskin Ahmed and Hasan Mahmud took two wickets each with Taskin emerging as the leading wicket-taker in the brief series with 11 victims to his name. Kavem Hodge topscored for the West Indies with 55, while captain Kraigg Brathwaite played with unusual adventure at the top of the order in contributing 43 off 63 deliveries. But they lost wickets at regular intervals and eventually succumbed in just 50 overs as Bangladesh swiftly avenged the 201-run mauling they endured in the first Test in Antigua a week earlier. ‘We wanted to be positive and I thought we started well but obviously we couldn't carry it through to the end of the day,’ said a rueful Brathwaite. This was Bangladesh's first Test victory in the West Indies since their 2-0 sweep over a depleted Caribbean side in 2009. Earlier Ali's belligerent innings, which occupied 106 deliveries and was embellished by eight fours and five sixes, tilted the balance heavily in favour of Bangladesh as the highest successful run-chase in a Test at Sabina Park was the 212 achieved by the West Indies over Sri Lanka in 2003. Such was the extent of the 26-year-old right-hander's dominance of the morning that he contributed 62 of the 75 runs added by the tourists after resuming at the overnight position of 193-5. Alzarri Joseph and Kemar Roach took three wickets each for the West Indies, Joseph ending Ali's quest for a maiden Test hundred when he was last out, caught at deep midwicket a half-hour before lunch. ",https://www.newagebd.net/post/cricket/251974/taijul-spins-bangladesh-to-win-over-windies
Barca hit five as they return to winning ways at Mallorca,"Raphinha and Lamine Yamal inspired Barcelona to a first win in four La Liga outings as they beat Mallorca 5-1 on Tuesday. The comprehensive victory brings the Catalans to 37 points at the top of the league table, four ahead of second-placed Real Madrid, but with two extra matches played. Carlo Ancelotti's Spanish and European champions will have the chance to cut that lead back to one point on Wednesday when they travel to Athletic Bilbao. Mallorca stay sixth in La Liga, still two points behind Athletic Bilbao in the final Champions League spot. Ferran Torres gave Barcelona the lead, before Vedat Muriqi equalised to ensure the sides were level at half-time. Raphinha and Yamal lit up the second half as the away side ran riot with the Brazilian scoring a double, followed by strikes from Frenkie de Jong and Pau Victor. Barcelona were boosted by the return of teenage starlet Yamal, who started the match after recovering from an ankle problem. Hansi Flick's side dropped points in the two league outings Yamal missed, and were also defeated last time out at home to lowly Las Palmas when he was only fit enough to start on the bench. The hosts gifted Barca the lead in the 12th minute when panicked defending resulted in Torres being presented with a golden opportunity when there seemed to be no danger. As a trio of Majorcan defenders shepherded the ball back to their goalkeeper, full-back Johan Mojica suddenly decided to try to lash it away, only to smash the ball straight into Antonio Raillo and it fell perfectly to the feet of the Barcelona forward, who duly stroked home the opener. The Catalans' high defensive line caught Mallorca out on several occasions as they tried to spring their attackers with passes over the top. Mallorca were, however, starting to build pressure on Barcelona, though the visitors remained dangerous on the counter with their fleet-footed attacking quartet of Yamal, Dani Olmo, Raphinha and Torres. A second goal in the match did not seem far away, for either side, and it came for the hosts in the 43rd minute. Inigo Martinez was deeper than the rest of the Barcelona line and Pablo Maffeo timed his run onto Sergi Darder's pass to perfection, before rolling the ball across to Muriqi to tap into an open net. Another defensive lapse nearly restored the visitors' lead on the stroke of half-time, but goalkeeper Leo Roman bailed out Raillo for his poor back-header by denying Raphinha one-on-one. The Mallorca 'keeper thwarted the Brazilian again early in the second period, punching away a fizzing free-kick from close range. But it was eventually third time lucky for Raphinha in his duel with Roman as he flashed a 56th-minute penalty just beyond the Spaniard's reach. The sheer pace of the returning Yamal had earned the spot-kick as he raced onto Olmo's through-ball, before being brought down by Mojica inside the box. Barcelona struggled recently in Yamal's absence, and the 17-year-old displayed his brilliance again moments later when an inspired backheel created a chance out of nothing, until Pedri's snapshot was blocked. Raphinha made the game safe for Barcelona with 14 minutes remaining when he latched onto a magnificent outside-of-the-foot cross courtesy of Yamal. The Euro 2024 winner repeated the trick five minute later, this time finding the forward run of Victor, whose pass across goal was cut out, but only as far as the onrushing De Jong who finished unerringly. De Jong then turned provider in the final 10 minutes as he squared for 23-year-old substitute Victor to score. Yamal could have capped off a superb second-half showing but his dinked finish near the end was well saved by the defiant Roman.",https://www.newagebd.net/post/football/251973/barca-hit-five-as-they-return-to-winning-ways-at-mallorca
"IU pro-VC, treasurer take charges","PROFESSOR M Yaqub Ali and professor M Jahangir Alam took charge as the new pro-vice-chancellor and treasurer of Islamic University in Kushtia respectively Monday night. They signed the joining papers in a ceremony at IU vice-chancellor office at about 8:30pm. A press release, signed by IU information, publication and public relations office deputy director Rajibul Islam Kanok, was issued in this regard. IU VC professor Nakib M Nasrullah, theology and Islamic studies faculty dean professor ABM Siddiqur Rahman Asrafi, acting registrar HM Ali Hasan, among others, were present. The new pro-VC and treasurer sought cooperation from all to work for the improvement of the university’s ranking in the international arena and maintain transparency and accountability in all sectors. President Mohammed Shahabuddin, also the chancellor of the university, appointed the duo on Monday for a four-year term.",https://www.newagebd.net/post/country/251972/iu-pro-vc-treasurer-take-charges
CAB demands punishment of dishonest traders,"The Consumers Association of Bangladesh on Tuesday submitted a memorandum to Rajshahi deputy commissioner with their eight-point demand, including identifying syndicates of dishonest dealers and traders and ensuring their exemplary punishment. A 10-member delegation of the association’s Rajshahi unit submitted the memorandum to DC Afia Akhtar at her office at 11:30am. Their other demands include - ensuring the supply of daily commodities, strengthening market monitoring, increasing TCB truck sales and TCB cards, establishing a separate department or ministry for consumer affairs under the commerce ministry to look after consumer interests, and stopping the sale of open edible oil. Among others, CAB Rajshahi unit general secretary Golam Mostafa Mamun, vice-president Mizanur Rahman, joint-general secretary Mahmudul Alam Masud, joint-organising secretary Subhash Chandra Hembram, and cultural affairs secretary Amlan Aniruddha were present. On Monday, CAB Rajshahi members formed a human chain in Saheb Bazar zero-point area of the city, urging the government to take necessary actions to reduce the prices of daily essential commodities as soon as possible.",https://www.newagebd.net/post/country/251971/cab-demands-punishment-of-dishonest-traders
Ministry seeks harassment cases list under AL rule,"Ministry of law, justice and parliamentary affairs has called for submitting list of politically motivated harassment cases, filed during the former Awami League regime from January 6, 2009 to August 5, 2024. ‘Solicitor wing of the law and justice division sent letters to public prosecutors and metropolitan public prosecutors across the country to this end on December 2,’ law ministry spokesperson Md Rezaul Karim told media. Signed by deputy solicitor (GP-PP) Sana Md Mahruf Hossain, the letter has asked the public prosecutors to prepare the lists as per the table set by the ministry and send those to solicitor wing by December 17. ‘Many harassment cases were filed against political leaders, activists and others between January 6, 2009 to August 5, 2024, especially before and after the national elections held in 2014, 2018, and 2024. Due to the lack of accurate and complete information regarding these cases, it is not being possible to take legal remedial action. So it is very important to obtain information on the cases as per the table mentioned in the letter on an urgent basis,’ read the letter. As per the letter, the government law officers were asked to prepare the list with the name of concerned district, court, case number, name and identification of the complainant, number of accused and number of unnamed accused, date of the incident narrated in the complaint, under which section and act the concerned case was filed and which stage that case is in now. ‘The public prosecutors and metropolitan public prosecutors were asked to exercise extreme caution in this regard. The lists of those cases will be thoroughly scrutinised by the ministry,’ Karim said. The ministry in the letters asked the public prosecutors to send the list to the address of solicitor, solicitor wing, law and justice division, law, justice and parliamentary affairs ministry, Supreme Court premises, or by email on[email protected].",https://www.newagebd.net/post/country/251970/ministry-seeks-harassment-cases-list-under-al-rule
Matarbari plant to generate 1200MW from Friday,"Matarbari Ultra Super Critical Coal Fired Power Plant will go for 1200MW electricity generation from Friday, as coal is imported for power generation. ‘We have ensured coal supply for the plant to keep it operation for electricity generation,’ AJM Ershad Ahsan Habib, director general (additional charge) of Power Cell told media on Tuesday. He said that Matarbari Ultra Super Critical Coal Fired Power Plant was under maintenance then and it would go for operation from Friday. ‘From now coal crisis will not be visible, as coal is coming in every week. Each unit of the plant, having 600MW generation capacity, is required 5000 metric tonnes of coal per day while 5000 metric tonnes for another unit,’ he added. Habib said that workers of the power plant had been unloading coal from mother vessel within 2-3 days instead of 10-15 days. He said that the country generated 10,000 MW power on Monday as electricity demand was gradually decreasing due to winter season. According to information, the 1,200 MW two-unit power plant was shut down from October 31 due to coal shortage. A ship bearing the Indonesian flag arrived at the jetty of the power plant with 70,000 metric tonnes of coal last week. Apart from this, another ship from Indonesian ship with 60,000 metric tonnes of coal arrived at Matarbari power. Manowar Hossain Majumdar, supervising engineer (transportation) of Matarbari Site Office of Coal Power Generation Company Bangladesh Limited, told journalists recently that an agreement was signed for coal import. According to the agreement, Meghna Group and Birla would import 3.5 million metric tonnes of coal for the power plant in a year. The Power Cell DG said that the demand for electricity was less than before due to the winter season which was already approached.",https://www.newagebd.net/post/country/251969/matarbari-plant-to-generate-1200mw-from-friday
Islamic Foundation to publish corruption white paper,"The board of governors of the Islamic Foundation has decided to publish a white paper on corruption within the organisation. The decision was made during a meeting at the Islamic Foundation’s meeting room in the Dhaka’s Agargaon area on Tuesday. The meeting, chaired by AFM Khalid Hossain, chairman of the board of governors and religious adviser, also decided to form a five-member committee, led by a retired Supreme Court judge, to investigate allegations of irregularities and corruption at the Islamic Foundation over the past 15 years. In addition to this, the meeting discussed several key issues, including the appointment of staff to vacant positions, revising the rent for shops at the Baitul Mukarram National Mosque, reviving the foundation’s publication department, and enhancing the overall activities of the organisation. Among others, professor SMA Faiz, chairman of the University Grants Commission, AKM Aftab Hossain Pramanik, secretary of the ministry of religious affairs, professor Nakib Muhammad Nasrullah, vice-chancellor of the Islamic University professor Muhammad Shah Alamgir, chairman of the Bangladesh Madrassah Education Board, and Md Saiful Islam, director general of the Islamic Foundation. A condolence motion was adopted in memory of the martyrs of the July Revolution. The meeting concluded with prayers for the souls of the martyrs and for the speedy recovery of the injured.",https://www.newagebd.net/post/country/251968/islamic-foundation-to-publish-corruption-white-paper
